,number,value,datetime_start,datetime_complete,duration,params_affinity,params_agglo_metric,params_agglo_n,params_alpha,params_assign_lables,params_clusterer,params_coef0,params_degree,params_eigen_solver,params_epsilon,params_hdbscan_algo,params_hdbscan_leaf_size,params_hdbscan_method,params_hdbscan_metric,params_hdbscan_n,params_kmeans_algo,params_kmeans_init,params_kmeans_n,params_kmeans_n_init,params_kmeans_tol,params_linkage,params_max_eps,params_min_dist,params_min_samples,params_n_oversamples,params_normalizer,params_optics_algo,params_optics_leaf_size,params_optics_method,params_optics_metric,params_optics_n,params_p,params_pca_n,params_pca_tol,params_perplexity,params_reducer,params_solver,params_spec_cluster,params_spec_gamma,params_spec_n,params_spec_n_init,params_spec_n_neighbors,params_tightness,params_tsne_init,params_tsne_lr,params_tsne_method,params_tsne_metric,params_tsne_n,params_umap_metric,params_umap_n,params_umap_n_neighbors,params_whiten,params_xi,state
601,601,0.8926440250611231,2024-05-01 06:26:14.404512,2024-05-01 06:26:14.653133,0 days 00:00:00.248621,,manhattan,4.0,,,Agglomerative,,,,,,,,,,,,,,,average,,,,1.0,none,,,,,,,2.0,4.150151954501619,,PCA,randomized,,,,,,,,,,,,,,,True,,COMPLETE
602,602,0.8486088161210154,2024-05-01 06:26:14.654295,2024-05-01 06:26:14.896873,0 days 00:00:00.242578,,manhattan,3.0,,,Agglomerative,,,,,,,,,,,,,,,average,,,,1.0,QR,,,,,,,2.0,0.8832992999717266,,PCA,randomized,,,,,,,,,,,,,,,True,,COMPLETE
603,603,0.9518219362694045,2024-05-01 06:26:14.897960,2024-05-01 06:26:15.150503,0 days 00:00:00.252543,,manhattan,3.0,,,Agglomerative,,,,,,,,,,,,,,,average,,,,1.0,none,,,,,,,2.0,4.731009705365674,,PCA,randomized,,,,,,,,,,,,,,,True,,COMPLETE
604,604,0.8852408091547138,2024-05-01 06:26:15.151691,2024-05-01 06:26:15.394423,0 days 00:00:00.242732,,manhattan,3.0,,,Agglomerative,,,,,,,,,,,,,,,average,,,,15.0,none,,,,,,,2.0,5.044100635999651,,PCA,randomized,,,,,,,,,,,,,,,True,,COMPLETE
605,605,0.8926440250611231,2024-05-01 06:26:15.395577,2024-05-01 06:26:15.641470,0 days 00:00:00.245893,,manhattan,4.0,,,Agglomerative,,,,,,,,,,,,,,,average,,,,1.0,none,,,,,,,2.0,4.780422063847514,,PCA,randomized,,,,,,,,,,,,,,,True,,COMPLETE
606,606,0.8486088161210161,2024-05-01 06:26:15.642600,2024-05-01 06:26:15.885966,0 days 00:00:00.243366,,manhattan,3.0,,,Agglomerative,,,,,,,,,,,,,,,average,,,,1.0,none,,,,,,,2.0,5.065593697539627,,PCA,arpack,,,,,,,,,,,,,,,True,,COMPLETE
607,607,0.9518219362694045,2024-05-01 06:26:15.887095,2024-05-01 06:26:16.169770,0 days 00:00:00.282675,,manhattan,3.0,,,Agglomerative,,,,,,,,,,,,,,,average,,,,1.0,none,,,,,,,2.0,4.349389761241472,,PCA,randomized,,,,,,,,,,,,,,,True,,COMPLETE
608,608,-1.0,2024-05-01 06:26:16.170677,2024-05-01 06:26:16.289177,0 days 00:00:00.118500,,,,,,OPTICS,,,,,,,,,,,,,,,,100.0,,,1.0,none,kd_tree,45.0,xi,russellrao,52.0,,2.0,4.426495344783645,,PCA,randomized,,,,,,,,,,,,,,,True,0.30000000000000004,COMPLETE
609,609,0.26623955368995667,2024-05-01 06:26:16.289925,2024-05-01 06:32:49.912336,0 days 00:06:33.622411,,manhattan,3.0,,,Agglomerative,,,,,,,,,,,,,,,average,,0.25,,,,,,,,,,,,,UMAP,,,,,,,,,,,,,mahalanobis,10.0,502.0,,,COMPLETE
610,610,0.8936432648439672,2024-05-01 06:32:49.913292,2024-05-01 06:32:50.202988,0 days 00:00:00.289696,,manhattan,3.0,,,Agglomerative,,,,,,,,,,,,,,,average,,,,16.0,none,,,,,,,2.0,4.737382388127587,,PCA,randomized,,,,,,,,,,,,,,,True,,COMPLETE
611,611,0.5100675312237335,2024-05-01 06:32:50.204123,2024-05-01 06:32:50.364821,0 days 00:00:00.160698,,,,,,KMeans,,,,,,,,,,lloyd,k-means++,12.0,,0.01,,,,,1.0,none,,,,,,,2.0,0.16919188744274205,,PCA,randomized,,,,,,,,,,,,,,,True,,COMPLETE
612,612,0.9518219362694045,2024-05-01 06:32:50.365761,2024-05-01 06:32:50.623123,0 days 00:00:00.257362,,manhattan,3.0,,,Agglomerative,,,,,,,,,,,,,,,average,,,,1.0,none,,,,,,,2.0,9.780140655816698,,PCA,randomized,,,,,,,,,,,,,,,True,,COMPLETE
613,613,0.8926440250611231,2024-05-01 06:32:50.624265,2024-05-01 06:32:50.868045,0 days 00:00:00.243780,,manhattan,4.0,,,Agglomerative,,,,,,,,,,,,,,,average,,,,1.0,none,,,,,,,2.0,4.314962313560842,,PCA,randomized,,,,,,,,,,,,,,,True,,COMPLETE
614,614,0.9518219362694045,2024-05-01 06:32:50.868973,2024-05-01 06:32:51.134491,0 days 00:00:00.265518,,manhattan,3.0,,,Agglomerative,,,,,,,,,,,,,,,average,,,,1.0,none,,,,,,,2.0,4.883016585285157,,PCA,randomized,,,,,,,,,,,,,,,True,,COMPLETE
615,615,0.9518219362694045,2024-05-01 06:32:51.135453,2024-05-01 06:32:51.381743,0 days 00:00:00.246290,,manhattan,3.0,,,Agglomerative,,,,,,,,,,,,,,,average,,,,1.0,none,,,,,,,2.0,9.715800947233697,,PCA,randomized,,,,,,,,,,,,,,,True,,COMPLETE
616,616,0.9518219362694045,2024-05-01 06:32:51.382681,2024-05-01 06:32:51.627675,0 days 00:00:00.244994,,manhattan,3.0,,,Agglomerative,,,,,,,,,,,,,,,average,,,,1.0,none,,,,,,,2.0,9.963230303990748,,PCA,randomized,,,,,,,,,,,,,,,True,,COMPLETE
617,617,0.22473429143428802,2024-05-01 06:32:51.628604,2024-05-01 06:36:26.542927,0 days 00:03:34.914323,,manhattan,3.0,,,Agglomerative,,,,,,,,,,,,,,,average,,,,,,,,,,,,,,26.319646573187168,t-SNE,,,,,,,9.105220135244258,pca,95.0,exact,euclidean,15.0,,,,,,COMPLETE
618,618,0.7768638580646257,2024-05-01 06:36:26.544164,2024-05-01 06:36:26.806742,0 days 00:00:00.262578,,manhattan,8.0,,,Agglomerative,,,,,,,,,,,,,,,average,,,,1.0,none,,,,,,,2.0,9.987776525274398,,PCA,randomized,,,,,,,,,,,,,,,True,,COMPLETE
619,619,-1.0,2024-05-01 06:36:26.807801,2024-05-01 06:36:27.055499,0 days 00:00:00.247698,rbf,,,,kmeans,Spectral,15.398440418772438,3.0,amg,,,,,,,,,,,,,,,,1.0,none,,,,,,,2.0,9.999545322856102,,PCA,randomized,17.0,6.1,11.0,10.0,497.0,,,,,,,,,,True,,COMPLETE
620,620,0.8926440250611231,2024-05-01 06:36:27.056288,2024-05-01 06:36:27.285919,0 days 00:00:00.229631,,manhattan,4.0,,,Agglomerative,,,,,,,,,,,,,,,average,,,,1.0,none,,,,,,,2.0,9.72687663675748,,PCA,randomized,,,,,,,,,,,,,,,True,,COMPLETE
621,621,0.7717733143633931,2024-05-01 06:36:27.286839,2024-05-01 06:36:27.556466,0 days 00:00:00.269627,,manhattan,10.0,,,Agglomerative,,,,,,,,,,,,,,,average,,,,1.0,none,,,,,,,2.0,4.9581504091871915,,PCA,randomized,,,,,,,,,,,,,,,True,,COMPLETE
622,622,0.9518219362694045,2024-05-01 06:36:27.557395,2024-05-01 06:36:27.851695,0 days 00:00:00.294300,,manhattan,3.0,,,Agglomerative,,,,,,,,,,,,,,,average,,,,1.0,none,,,,,,,2.0,4.0458165325906865,,PCA,randomized,,,,,,,,,,,,,,,True,,COMPLETE
623,623,-1.0,2024-05-01 06:36:27.852848,2024-05-01 06:36:27.980789,0 days 00:00:00.127941,,,,10.0,,HDBSCAN,,,,5.4,auto,90.0,leaf,minkowski,457.0,,,,,,,,,200.0,1.0,none,,,,,,,2.0,9.593955304759104,,PCA,randomized,,,,,,,,,,,,,,,True,,COMPLETE
624,624,0.9518219362694045,2024-05-01 06:36:27.981620,2024-05-01 06:36:28.248422,0 days 00:00:00.266802,,manhattan,3.0,,,Agglomerative,,,,,,,,,,,,,,,average,,,,1.0,none,,,,,,,2.0,4.578685012768885,,PCA,randomized,,,,,,,,,,,,,,,True,,COMPLETE
625,625,0.9518219362694045,2024-05-01 06:36:28.250266,2024-05-01 06:36:28.512840,0 days 00:00:00.262574,,manhattan,3.0,,,Agglomerative,,,,,,,,,,,,,,,average,,,,1.0,none,,,,,,,2.0,9.733319344071685,,PCA,randomized,,,,,,,,,,,,,,,True,,COMPLETE
626,626,0.9518219362694045,2024-05-01 06:36:28.513925,2024-05-01 06:36:28.764984,0 days 00:00:00.251059,,manhattan,3.0,,,Agglomerative,,,,,,,,,,,,,,,average,,,,1.0,none,,,,,,,2.0,9.489890429203703,,PCA,randomized,,,,,,,,,,,,,,,True,,COMPLETE
627,627,0.8486088161210154,2024-05-01 06:36:28.765928,2024-05-01 06:36:29.010015,0 days 00:00:00.244087,,manhattan,3.0,,,Agglomerative,,,,,,,,,,,,,,,average,,,,1.0,QR,,,,,,,2.0,5.184854591570706,,PCA,randomized,,,,,,,,,,,,,,,True,,COMPLETE
628,628,0.8926440250611231,2024-05-01 06:36:29.010930,2024-05-01 06:36:29.262155,0 days 00:00:00.251225,,manhattan,4.0,,,Agglomerative,,,,,,,,,,,,,,,average,,,,1.0,none,,,,,,,2.0,9.792620093106935,,PCA,randomized,,,,,,,,,,,,,,,True,,COMPLETE
629,629,0.8486088161210161,2024-05-01 06:36:29.263485,2024-05-01 06:36:29.504686,0 days 00:00:00.241201,,manhattan,3.0,,,Agglomerative,,,,,,,,,,,,,,,average,,,,1.0,none,,,,,,,2.0,9.585406320151941,,PCA,arpack,,,,,,,,,,,,,,,True,,COMPLETE
630,630,0.8926440250611231,2024-05-01 06:36:29.505622,2024-05-01 06:36:29.781915,0 days 00:00:00.276293,,manhattan,4.0,,,Agglomerative,,,,,,,,,,,,,,,average,,,,1.0,none,,,,,,,2.0,4.8262058275426325,,PCA,randomized,,,,,,,,,,,,,,,True,,COMPLETE
631,631,0.9518219362694045,2024-05-01 06:36:29.789277,2024-05-01 06:36:30.058308,0 days 00:00:00.269031,,manhattan,3.0,,,Agglomerative,,,,,,,,,,,,,,,average,,,,1.0,none,,,,,,,2.0,1.4925313399816238,,PCA,randomized,,,,,,,,,,,,,,,True,,COMPLETE
632,632,0.4237454831600189,2024-05-01 06:36:30.059424,2024-05-01 06:38:26.756579,0 days 00:01:56.697155,,manhattan,3.0,,,Agglomerative,,,,,,,,,,,,,,,average,,0.55,,,,,,,,,,,,,UMAP,,,,,,,,,,,,,minkowski,6.0,62.0,,,COMPLETE
633,633,-1.0,2024-05-01 06:38:26.757486,2024-05-01 06:38:29.359877,0 days 00:00:02.602391,,,,,,OPTICS,,,,,,,,,,,,,,,,10.0,,,1.0,none,brute,80.0,dbscan,cosine,302.0,,2.0,4.225321237686663,,PCA,randomized,,,,,,,,,,,,,,,True,0.0,COMPLETE
634,634,0.9267847662589,2024-05-01 06:38:29.360621,2024-05-01 06:38:29.623437,0 days 00:00:00.262816,,manhattan,3.0,,,Agglomerative,,,,,,,,,,,,,,,average,,,,1.0,none,,,,,,,3.0,9.729983507340634,,PCA,randomized,,,,,,,,,,,,,,,True,,COMPLETE
635,635,0.9518219362694045,2024-05-01 06:38:29.624563,2024-05-01 06:38:29.878840,0 days 00:00:00.254277,,manhattan,3.0,,,Agglomerative,,,,,,,,,,,,,,,average,,,,1.0,none,,,,,,,2.0,9.83885722850004,,PCA,randomized,,,,,,,,,,,,,,,True,,COMPLETE
636,636,0.4898836773506975,2024-05-01 06:38:29.880010,2024-05-01 06:38:30.034079,0 days 00:00:00.154069,,,,,,KMeans,,,,,,,,,,elkan,k-means++,18.0,,0.001,,,,,1.0,none,,,,,,,3.0,4.614452545071891,,PCA,randomized,,,,,,,,,,,,,,,True,,COMPLETE
637,637,0.9518219362694045,2024-05-01 06:38:30.035035,2024-05-01 06:38:30.287218,0 days 00:00:00.252183,,manhattan,3.0,,,Agglomerative,,,,,,,,,,,,,,,average,,,,1.0,none,,,,,,,2.0,0.3797202495142562,,PCA,randomized,,,,,,,,,,,,,,,True,,COMPLETE
638,638,0.5335861444473267,2024-05-01 06:38:30.288179,2024-05-01 06:38:35.106514,0 days 00:00:04.818335,,manhattan,5.0,,,Agglomerative,,,,,,,,,,,,,,,average,,,,,,,,,,,,,,22.33418584482238,t-SNE,,,,,,,17.669093641604867,random,70.0,barnes_hut,correlation,1.0,,,,,,COMPLETE
639,639,0.8926440250611231,2024-05-01 06:38:35.107796,2024-05-01 06:38:35.330733,0 days 00:00:00.222937,,manhattan,4.0,,,Agglomerative,,,,,,,,,,,,,,,average,,,,1.0,none,,,,,,,2.0,9.475380879545053,,PCA,randomized,,,,,,,,,,,,,,,True,,COMPLETE
640,640,0.9267847662589,2024-05-01 06:38:35.331676,2024-05-01 06:38:35.610566,0 days 00:00:00.278890,,manhattan,3.0,,,Agglomerative,,,,,,,,,,,,,,,average,,,,1.0,none,,,,,,,3.0,9.993518848444523,,PCA,randomized,,,,,,,,,,,,,,,True,,COMPLETE
641,641,0.9267847662589,2024-05-01 06:38:35.611685,2024-05-01 06:38:35.860149,0 days 00:00:00.248464,,manhattan,3.0,,,Agglomerative,,,,,,,,,,,,,,,average,,,,1.0,none,,,,,,,3.0,9.804156383137661,,PCA,randomized,,,,,,,,,,,,,,,True,,COMPLETE
642,642,0.9267847662589,2024-05-01 06:38:35.861251,2024-05-01 06:38:36.110219,0 days 00:00:00.248968,,manhattan,3.0,,,Agglomerative,,,,,,,,,,,,,,,average,,,,1.0,none,,,,,,,3.0,9.576044754189425,,PCA,randomized,,,,,,,,,,,,,,,True,,COMPLETE
643,643,0.8921000487059627,2024-05-01 06:38:36.111349,2024-05-01 06:38:36.356955,0 days 00:00:00.245606,,manhattan,5.0,,,Agglomerative,,,,,,,,,,,,,,,average,,,,1.0,none,,,,,,,2.0,5.138408164772691,,PCA,randomized,,,,,,,,,,,,,,,True,,COMPLETE
644,644,0.8926440250611231,2024-05-01 06:38:36.357873,2024-05-01 06:38:36.663148,0 days 00:00:00.305275,,manhattan,4.0,,,Agglomerative,,,,,,,,,,,,,,,average,,,,1.0,none,,,,,,,2.0,9.807706733558673,,PCA,randomized,,,,,,,,,,,,,,,True,,COMPLETE
645,645,0.14965582925359602,2024-05-01 06:38:36.665099,2024-05-01 06:38:37.089820,0 days 00:00:00.424721,nearest_neighbors,,,,cluster_qr,Spectral,90.15724511020184,2.0,lobpcg,,,,,,,,,,,,,,,,1.0,none,,,,,,,3.0,9.996092273559595,,PCA,randomized,13.0,2.1,7.0,16.0,262.0,,,,,,,,,,True,,COMPLETE
646,646,0.9518219362694045,2024-05-01 06:38:37.091081,2024-05-01 06:38:37.344585,0 days 00:00:00.253504,,manhattan,3.0,,,Agglomerative,,,,,,,,,,,,,,,average,,,,1.0,none,,,,,,,2.0,4.404574109021742,,PCA,randomized,,,,,,,,,,,,,,,True,,COMPLETE
647,647,0.9267847662589,2024-05-01 06:38:37.345503,2024-05-01 06:38:37.595531,0 days 00:00:00.250028,,manhattan,3.0,,,Agglomerative,,,,,,,,,,,,,,,average,,,,1.0,none,,,,,,,3.0,9.606019867313577,,PCA,randomized,,,,,,,,,,,,,,,True,,COMPLETE
648,648,0.9518219362694045,2024-05-01 06:38:37.596452,2024-05-01 06:38:37.855254,0 days 00:00:00.258802,,manhattan,3.0,,,Agglomerative,,,,,,,,,,,,,,,average,,,,1.0,none,,,,,,,2.0,9.425868859408721,,PCA,randomized,,,,,,,,,,,,,,,True,,COMPLETE
649,649,-1.0,2024-05-01 06:38:37.856313,2024-05-01 06:38:37.990033,0 days 00:00:00.133720,,,,7.9,,HDBSCAN,,,,0.9,brute,25.0,eom,sqeuclidean,147.0,,,,,,,,,86.0,1.0,none,,,,,,,5.0,9.662719929251756,,PCA,randomized,,,,,,,,,,,,,,,True,,COMPLETE
650,650,0.9267847662589,2024-05-01 06:38:37.990790,2024-05-01 06:38:38.260324,0 days 00:00:00.269534,,manhattan,3.0,,,Agglomerative,,,,,,,,,,,,,,,average,,,,1.0,none,,,,,,,3.0,4.826905629024925,,PCA,randomized,,,,,,,,,,,,,,,True,,COMPLETE
651,651,0.8348654558886113,2024-05-01 06:38:38.261447,2024-05-01 06:38:38.582656,0 days 00:00:00.321209,,manhattan,3.0,,,Agglomerative,,,,,,,,,,,,,,,average,,,,1.0,QR,,,,,,,3.0,9.854320026821183,,PCA,randomized,,,,,,,,,,,,,,,True,,COMPLETE
652,652,0.7819835352292751,2024-05-01 06:38:38.583829,2024-05-01 06:38:38.852774,0 days 00:00:00.268945,,manhattan,7.0,,,Agglomerative,,,,,,,,,,,,,,,average,,,,1.0,none,,,,,,,2.0,9.994198042868458,,PCA,randomized,,,,,,,,,,,,,,,True,,COMPLETE
653,653,0.27076107263565063,2024-05-01 06:38:38.853872,2024-05-01 06:38:49.003335,0 days 00:00:10.149463,,manhattan,3.0,,,Agglomerative,,,,,,,,,,,,,,,average,,0.4,,,,,,,,,,,,,UMAP,,,,,,,,,,,,,jaccard,3.0,232.0,,,COMPLETE
654,654,0.8333109285250315,2024-05-01 06:38:49.004519,2024-05-01 06:38:49.261852,0 days 00:00:00.257333,,manhattan,4.0,,,Agglomerative,,,,,,,,,,,,,,,average,,,,1.0,none,,,,,,,3.0,5.29191790085386,,PCA,arpack,,,,,,,,,,,,,,,True,,COMPLETE
655,655,0.9518219362694045,2024-05-01 06:38:49.263026,2024-05-01 06:38:49.532205,0 days 00:00:00.269179,,manhattan,3.0,,,Agglomerative,,,,,,,,,,,,,,,average,,,,1.0,none,,,,,,,2.0,9.474251518893865,,PCA,randomized,,,,,,,,,,,,,,,True,,COMPLETE
656,656,0.8934726564036833,2024-05-01 06:38:49.533378,2024-05-01 06:38:49.824241,0 days 00:00:00.290863,,manhattan,4.0,,,Agglomerative,,,,,,,,,,,,,,,average,,,,1.0,none,,,,,,,3.0,9.702392465354958,,PCA,randomized,,,,,,,,,,,,,,,True,,COMPLETE
657,657,0.9518219362694045,2024-05-01 06:38:49.825406,2024-05-01 06:38:50.126423,0 days 00:00:00.301017,,manhattan,3.0,,,Agglomerative,,,,,,,,,,,,,,,average,,,,1.0,none,,,,,,,2.0,9.418532748222201,,PCA,randomized,,,,,,,,,,,,,,,True,,COMPLETE
658,658,0.9026755825363563,2024-05-01 06:38:50.127385,2024-05-01 06:38:50.433143,0 days 00:00:00.305758,,manhattan,3.0,,,Agglomerative,,,,,,,,,,,,,,,average,,,,18.0,none,,,,,,,3.0,4.605146133736434,,PCA,randomized,,,,,,,,,,,,,,,True,,COMPLETE
659,659,0.9518219362694045,2024-05-01 06:38:50.434084,2024-05-01 06:38:50.681403,0 days 00:00:00.247319,,manhattan,3.0,,,Agglomerative,,,,,,,,,,,,,,,average,,,,1.0,none,,,,,,,2.0,5.041218452886028,,PCA,randomized,,,,,,,,,,,,,,,True,,COMPLETE
660,660,0.16416652500629425,2024-05-01 06:38:50.682541,2024-05-01 06:42:50.761976,0 days 00:04:00.079435,,manhattan,3.0,,,Agglomerative,,,,,,,,,,,,,,,average,,,,,,,,,,,,,,32.25970290667806,t-SNE,,,,,,,11.682060848503076,pca,10.0,exact,braycurtis,19.0,,,,,,COMPLETE
661,661,-1.0,2024-05-01 06:42:50.763150,2024-05-01 06:42:50.914687,0 days 00:00:00.151537,,,,,,OPTICS,,,,,,,,,,,,,,,,10000.0,,,1.0,none,auto,65.0,xi,seuclidean,502.0,,3.0,9.78056604885297,,PCA,randomized,,,,,,,,,,,,,,,True,0.45,COMPLETE
662,662,0.45160149169249136,2024-05-01 06:42:50.915527,2024-05-01 06:42:51.207560,0 days 00:00:00.292033,,,,,,KMeans,,,,,,,,,,lloyd,random,19.0,18.0,1e-05,,,,,1.0,none,,,,,,,2.0,9.584497586638246,,PCA,randomized,,,,,,,,,,,,,,,True,,COMPLETE
663,663,0.8934726564036833,2024-05-01 06:42:51.208531,2024-05-01 06:42:51.461237,0 days 00:00:00.252706,,manhattan,4.0,,,Agglomerative,,,,,,,,,,,,,,,average,,,,1.0,none,,,,,,,3.0,9.821886070767562,,PCA,randomized,,,,,,,,,,,,,,,True,,COMPLETE
664,664,0.9476772559199801,2024-05-01 06:42:51.462382,2024-05-01 06:42:51.723809,0 days 00:00:00.261427,,manhattan,3.0,,,Agglomerative,,,,,,,,,,,,,,,average,,,,1.0,none,,,,,,,4.0,9.423366425950379,,PCA,randomized,,,,,,,,,,,,,,,True,,COMPLETE
665,665,0.6486588914330951,2024-05-01 06:42:51.724965,2024-05-01 06:42:52.050399,0 days 00:00:00.325434,,manhattan,12.0,,,Agglomerative,,,,,,,,,,,,,,,average,,,,8.0,none,,,,,,,2.0,9.985590078680323,,PCA,randomized,,,,,,,,,,,,,,,True,,COMPLETE
666,666,0.9267847662589,2024-05-01 06:42:52.052522,2024-05-01 06:42:52.304310,0 days 00:00:00.251788,,manhattan,3.0,,,Agglomerative,,,,,,,,,,,,,,,average,,,,1.0,none,,,,,,,3.0,9.660101654908699,,PCA,randomized,,,,,,,,,,,,,,,True,,COMPLETE
667,667,0.8861281821658908,2024-05-01 06:42:52.305496,2024-05-01 06:42:52.592350,0 days 00:00:00.286854,,manhattan,3.0,,,Agglomerative,,,,,,,,,,,,,,,average,,,,13.0,none,,,,,,,2.0,4.789837413112277,,PCA,randomized,,,,,,,,,,,,,,,True,,COMPLETE
668,668,0.8934726564036833,2024-05-01 06:42:52.593294,2024-05-01 06:42:52.851894,0 days 00:00:00.258600,,manhattan,4.0,,,Agglomerative,,,,,,,,,,,,,,,average,,,,1.0,none,,,,,,,3.0,9.792025391020898,,PCA,randomized,,,,,,,,,,,,,,,True,,COMPLETE
669,669,-1.0,2024-05-01 06:42:52.853018,2024-05-01 06:42:53.022934,0 days 00:00:00.169916,precomputed_nearest_neighbors,,,,discretize,Spectral,44.4995241198194,1.0,arpack,,,,,,,,,,,,,,,,1.0,none,,,,,,,2.0,4.329739047659747,,PCA,randomized,18.0,0.1,16.0,5.0,227.0,,,,,,,,,,True,,COMPLETE
670,670,0.7804104017223416,2024-05-01 06:42:53.023793,2024-05-01 06:42:53.293966,0 days 00:00:00.270173,,manhattan,13.0,,,Agglomerative,,,,,,,,,,,,,,,average,,,,1.0,none,,,,,,,4.0,4.104139240337069,,PCA,randomized,,,,,,,,,,,,,,,True,,COMPLETE
671,671,0.5272004481073361,2024-05-01 06:42:53.294910,2024-05-01 06:42:53.542904,0 days 00:00:00.247994,,,14.0,,,Agglomerative,,,,,,,,,,,,,,,ward,,,,1.0,none,,,,,,,3.0,9.58750085677056,,PCA,randomized,,,,,,,,,,,,,,,True,,COMPLETE
672,672,0.8891580490984491,2024-05-01 06:42:53.544057,2024-05-01 06:42:53.803733,0 days 00:00:00.259676,,manhattan,6.0,,,Agglomerative,,,,,,,,,,,,,,,average,,,,1.0,none,,,,,,,2.0,9.382155625063211,,PCA,randomized,,,,,,,,,,,,,,,True,,COMPLETE
673,673,0.9267847662589,2024-05-01 06:42:53.804913,2024-05-01 06:42:54.099339,0 days 00:00:00.294426,,manhattan,3.0,,,Agglomerative,,,,,,,,,,,,,,,average,,,,1.0,none,,,,,,,3.0,9.834039058812152,,PCA,randomized,,,,,,,,,,,,,,,True,,COMPLETE
674,674,0.8486088161210154,2024-05-01 06:42:54.100479,2024-05-01 06:42:54.385000,0 days 00:00:00.284521,,manhattan,3.0,,,Agglomerative,,,,,,,,,,,,,,,average,,,,1.0,QR,,,,,,,2.0,4.576683477393657,,PCA,randomized,,,,,,,,,,,,,,,True,,COMPLETE
675,675,0.5356924533843994,2024-05-01 06:42:54.386036,2024-05-01 06:43:06.120623,0 days 00:00:11.734587,,manhattan,4.0,,,Agglomerative,,,,,,,,,,,,,,,average,,0.05,,,,,,,,,,,,,UMAP,,,,,,,,,,,,,braycurtis,19.0,407.0,,,COMPLETE
676,676,-1.0,2024-05-01 06:43:06.123299,2024-05-01 06:43:06.267153,0 days 00:00:00.143854,,,,6.4,,HDBSCAN,,,,2.7,kd_tree,50.0,leaf,rogerstanimoto,487.0,,,,,,,,,20.0,1.0,none,,,,,,,3.0,9.611476148321236,,PCA,arpack,,,,,,,,,,,,,,,True,,COMPLETE
677,677,0.9518219362694045,2024-05-01 06:43:06.268052,2024-05-01 06:43:06.543948,0 days 00:00:00.275896,,manhattan,3.0,,,Agglomerative,,,,,,,,,,,,,,,average,,,,1.0,none,,,,,,,2.0,9.781250676513471,,PCA,randomized,,,,,,,,,,,,,,,True,,COMPLETE
678,678,0.9178560610036309,2024-05-01 06:43:06.544931,2024-05-01 06:43:06.852316,0 days 00:00:00.307385,,manhattan,3.0,,,Agglomerative,,,,,,,,,,,,,,,average,,,,17.0,none,,,,,,,3.0,4.982560829804064,,PCA,randomized,,,,,,,,,,,,,,,True,,COMPLETE
679,679,0.9476772559199801,2024-05-01 06:43:06.853503,2024-05-01 06:43:07.114067,0 days 00:00:00.260564,,manhattan,3.0,,,Agglomerative,,,,,,,,,,,,,,,average,,,,1.0,none,,,,,,,4.0,9.337975054986133,,PCA,randomized,,,,,,,,,,,,,,,True,,COMPLETE
680,680,0.9182648420948173,2024-05-01 06:43:07.115037,2024-05-01 06:43:07.438482,0 days 00:00:00.323445,,manhattan,2.0,,,Agglomerative,,,,,,,,,,,,,,,average,,,,1.0,none,,,,,,,14.0,9.991654490628365,,PCA,randomized,,,,,,,,,,,,,,,True,,COMPLETE
681,681,0.9518219362694045,2024-05-01 06:43:07.439489,2024-05-01 06:43:07.731927,0 days 00:00:00.292438,,manhattan,3.0,,,Agglomerative,,,,,,,,,,,,,,,average,,,,1.0,none,,,,,,,2.0,9.535807824855775,,PCA,randomized,,,,,,,,,,,,,,,True,,COMPLETE
682,682,0.5966528058052063,2024-05-01 06:43:07.733091,2024-05-01 06:43:14.186406,0 days 00:00:06.453315,,manhattan,2.0,,,Agglomerative,,,,,,,,,,,,,,,average,,,,,,,,,,,,,,38.80918264564575,t-SNE,,,,,,,5.132765634173336,random,100.0,barnes_hut,sokalsneath,1.0,,,,,,COMPLETE
683,683,0.9532357462135064,2024-05-01 06:43:14.187229,2024-05-01 06:43:14.427069,0 days 00:00:00.239840,,manhattan,2.0,,,Agglomerative,,,,,,,,,,,,,,,average,,,,1.0,none,,,,,,,3.0,9.803812885338115,,PCA,randomized,,,,,,,,,,,,,,,True,,COMPLETE
684,684,0.9472133311895985,2024-05-01 06:43:14.428053,2024-05-01 06:43:14.697939,0 days 00:00:00.269886,,manhattan,2.0,,,Agglomerative,,,,,,,,,,,,,,,average,,,,1.0,none,,,,,,,4.0,9.98942476321423,,PCA,randomized,,,,,,,,,,,,,,,True,,COMPLETE
685,685,0.9472133311895985,2024-05-01 06:43:14.698924,2024-05-01 06:43:14.973914,0 days 00:00:00.274990,,manhattan,2.0,,,Agglomerative,,,,,,,,,,,,,,,average,,,,1.0,none,,,,,,,4.0,9.76288103829699,,PCA,randomized,,,,,,,,,,,,,,,True,,COMPLETE
686,686,0.8307059102141564,2024-05-01 06:43:14.974885,2024-05-01 06:43:15.279488,0 days 00:00:00.304603,,manhattan,9.0,,,Agglomerative,,,,,,,,,,,,,,,average,,,,1.0,none,,,,,,,5.0,9.662838206395012,,PCA,randomized,,,,,,,,,,,,,,,True,,COMPLETE
