,number,value,datetime_start,datetime_complete,duration,params_affinity,params_agglo_metric,params_agglo_n,params_alpha,params_assign_lables,params_clusterer,params_coef0,params_degree,params_eigen_solver,params_epsilon,params_hdbscan_algo,params_hdbscan_leaf_size,params_hdbscan_method,params_hdbscan_metric,params_hdbscan_n,params_kmeans_algo,params_kmeans_init,params_kmeans_n,params_kmeans_n_init,params_kmeans_tol,params_linkage,params_max_eps,params_min_dist,params_min_samples,params_n_oversamples,params_normalizer,params_optics_algo,params_optics_leaf_size,params_optics_method,params_optics_metric,params_optics_n,params_p,params_pca_n,params_pca_tol,params_perplexity,params_reducer,params_solver,params_spec_cluster,params_spec_gamma,params_spec_n,params_spec_n_init,params_spec_n_neighbors,params_tightness,params_tsne_init,params_tsne_lr,params_tsne_method,params_tsne_metric,params_tsne_n,params_umap_metric,params_umap_n,params_umap_n_neighbors,params_whiten,params_xi,state
946,946,0.9517407922205964,2024-05-01 07:10:08.101687,2024-05-01 07:10:08.320556,0 days 00:00:00.218869,,l1,2.0,,,Agglomerative,,,,,,,,,,,,,,,single,,,,3.0,none,,,,,,,2.0,9.956341860935034,,PCA,randomized,,,,,,,,,,,,,,,True,,COMPLETE
947,947,0.03185754269361496,2024-05-01 07:10:08.321603,2024-05-01 07:10:17.532388,0 days 00:00:09.210785,,l1,3.0,,,Agglomerative,,,,,,,,,,,,,,,single,,0.9,,,,,,,,,,,,,UMAP,,,,,,,,,,,,,hamming,16.0,77.0,,,COMPLETE
948,948,0.964443639113474,2024-05-01 07:10:17.533703,2024-05-01 07:10:17.759632,0 days 00:00:00.225929,,l1,2.0,,,Agglomerative,,,,,,,,,,,,,,,single,,,,2.0,none,,,,,,,2.0,9.970595093497593,,PCA,randomized,,,,,,,,,,,,,,,True,,COMPLETE
949,949,0.9338827642391248,2024-05-01 07:10:17.760989,2024-05-01 07:10:18.022457,0 days 00:00:00.261468,,l1,3.0,,,Agglomerative,,,,,,,,,,,,,,,single,,,,2.0,none,,,,,,,2.0,9.972026821064468,,PCA,randomized,,,,,,,,,,,,,,,True,,COMPLETE
950,950,0.9517407922205964,2024-05-01 07:10:18.023562,2024-05-01 07:10:18.241297,0 days 00:00:00.217735,,l1,2.0,,,Agglomerative,,,,,,,,,,,,,,,single,,,,3.0,none,,,,,,,2.0,9.99189284205645,,PCA,randomized,,,,,,,,,,,,,,,True,,COMPLETE
951,951,-1.0,2024-05-01 07:10:18.242363,2024-05-01 07:10:18.346644,0 days 00:00:00.104281,,l1,2.0,,,Agglomerative,,,,,,,,,,,,,,,single,,,,,,,,,,,,,,18.314432917437095,t-SNE,,,,,,,8.379484426137633,pca,85.0,barnes_hut,wminkowski,1.0,,,,,,COMPLETE
952,952,-1.0,2024-05-01 07:10:18.347208,2024-05-01 07:10:19.631441,0 days 00:00:01.284233,,,,,,OPTICS,,,,,,,,,,,,,,,,10.0,,,2.0,none,brute,40.0,dbscan,canberra,137.0,,2.0,9.994846840631928,,PCA,randomized,,,,,,,,,,,,,,,True,0.2,COMPLETE
953,953,0.9517407922205964,2024-05-01 07:10:19.632341,2024-05-01 07:10:19.841900,0 days 00:00:00.209559,,l1,2.0,,,Agglomerative,,,,,,,,,,,,,,,single,,,,3.0,none,,,,,,,2.0,9.737378536656266,,PCA,randomized,,,,,,,,,,,,,,,True,,COMPLETE
954,954,0.964443639113474,2024-05-01 07:10:19.844687,2024-05-01 07:10:20.079450,0 days 00:00:00.234763,,l1,2.0,,,Agglomerative,,,,,,,,,,,,,,,single,,,,2.0,none,,,,,,,2.0,9.779217951014333,,PCA,randomized,,,,,,,,,,,,,,,True,,COMPLETE
955,955,0.3689543711839846,2024-05-01 07:10:20.080813,2024-05-01 07:10:20.268411,0 days 00:00:00.187598,,,,,,KMeans,,,,,,,,,,lloyd,k-means++,19.0,,0.001,,,,,3.0,QR,,,,,,,2.0,9.530877279710978,,PCA,randomized,,,,,,,,,,,,,,,True,,COMPLETE
956,956,0.9123251463359364,2024-05-01 07:10:20.269705,2024-05-01 07:10:20.616315,0 days 00:00:00.346610,,l1,2.0,,,Agglomerative,,,,,,,,,,,,,,,single,,,,2.0,auto,,,,,,,2.0,9.692627346735913,,PCA,randomized,,,,,,,,,,,,,,,True,,COMPLETE
957,957,0.8837019188525425,2024-05-01 07:10:20.617244,2024-05-01 07:10:20.818336,0 days 00:00:00.201092,,l1,3.0,,,Agglomerative,,,,,,,,,,,,,,,single,,,,3.0,none,,,,,,,2.0,9.530740087110498,,PCA,randomized,,,,,,,,,,,,,,,True,,COMPLETE
958,958,0.964443639113474,2024-05-01 07:10:20.820035,2024-05-01 07:10:21.040218,0 days 00:00:00.220183,,l1,2.0,,,Agglomerative,,,,,,,,,,,,,,,single,,,,2.0,none,,,,,,,2.0,9.766033729781437,,PCA,randomized,,,,,,,,,,,,,,,True,,COMPLETE
959,959,0.8837019188525425,2024-05-01 07:10:21.041290,2024-05-01 07:10:21.258834,0 days 00:00:00.217544,,l1,3.0,,,Agglomerative,,,,,,,,,,,,,,,single,,,,3.0,none,,,,,,,2.0,9.554041812666371,,PCA,randomized,,,,,,,,,,,,,,,True,,COMPLETE
960,960,0.9123251463359368,2024-05-01 07:10:21.259958,2024-05-01 07:10:21.471123,0 days 00:00:00.211165,,l1,2.0,,,Agglomerative,,,,,,,,,,,,,,,single,,,,2.0,none,,,,,,,2.0,9.675973579819702,,PCA,arpack,,,,,,,,,,,,,,,True,,COMPLETE
961,961,0.964443639113474,2024-05-01 07:10:21.472236,2024-05-01 07:10:21.686894,0 days 00:00:00.214658,,l1,2.0,,,Agglomerative,,,,,,,,,,,,,,,single,,,,2.0,none,,,,,,,2.0,9.499527626957303,,PCA,randomized,,,,,,,,,,,,,,,True,,COMPLETE
962,962,-1.0,2024-05-01 07:10:21.688170,2024-05-01 07:10:21.858970,0 days 00:00:00.170800,precomputed_nearest_neighbors,,,,kmeans,Spectral,55.59878908200002,1.0,amg,,,,,,,,,,,,,,,,3.0,none,,,,,,,2.0,9.455160041268728,,PCA,randomized,8.0,2.6,8.0,14.0,2.0,,,,,,,,,,True,,COMPLETE
963,963,0.9517407922205964,2024-05-01 07:10:21.860065,2024-05-01 07:10:22.110758,0 days 00:00:00.250693,,l1,2.0,,,Agglomerative,,,,,,,,,,,,,,,single,,,,3.0,none,,,,,,,2.0,9.409171450568365,,PCA,randomized,,,,,,,,,,,,,,,True,,COMPLETE
964,964,0.9338827642391248,2024-05-01 07:10:22.112020,2024-05-01 07:10:22.337815,0 days 00:00:00.225795,,l1,3.0,,,Agglomerative,,,,,,,,,,,,,,,single,,,,2.0,none,,,,,,,2.0,9.479369530211802,,PCA,randomized,,,,,,,,,,,,,,,True,,COMPLETE
965,965,0.964443639113474,2024-05-01 07:10:22.339126,2024-05-01 07:10:22.556901,0 days 00:00:00.217775,,l1,2.0,,,Agglomerative,,,,,,,,,,,,,,,single,,,,2.0,none,,,,,,,2.0,9.726508654033735,,PCA,randomized,,,,,,,,,,,,,,,True,,COMPLETE
966,966,0.9517407922205964,2024-05-01 07:10:22.558066,2024-05-01 07:10:22.780633,0 days 00:00:00.222567,,l1,2.0,,,Agglomerative,,,,,,,,,,,,,,,single,,,,3.0,none,,,,,,,2.0,9.426756756036893,,PCA,randomized,,,,,,,,,,,,,,,True,,COMPLETE
967,967,0.964443639113474,2024-05-01 07:10:22.781693,2024-05-01 07:10:23.043540,0 days 00:00:00.261847,,l1,2.0,,,Agglomerative,,,,,,,,,,,,,,,single,,,,2.0,none,,,,,,,2.0,9.534299604451435,,PCA,randomized,,,,,,,,,,,,,,,True,,COMPLETE
968,968,0.8837019188525425,2024-05-01 07:10:23.044621,2024-05-01 07:10:23.265410,0 days 00:00:00.220789,,l1,3.0,,,Agglomerative,,,,,,,,,,,,,,,single,,,,3.0,none,,,,,,,2.0,9.293622776147837,,PCA,randomized,,,,,,,,,,,,,,,True,,COMPLETE
969,969,0.964443639113474,2024-05-01 07:10:23.266511,2024-05-01 07:10:23.483724,0 days 00:00:00.217213,,l1,2.0,,,Agglomerative,,,,,,,,,,,,,,,single,,,,2.0,none,,,,,,,2.0,9.484714280166425,,PCA,randomized,,,,,,,,,,,,,,,True,,COMPLETE
970,970,0.9517407922205964,2024-05-01 07:10:23.484823,2024-05-01 07:10:23.724279,0 days 00:00:00.239456,,l1,2.0,,,Agglomerative,,,,,,,,,,,,,,,single,,,,3.0,none,,,,,,,2.0,9.54408514573248,,PCA,randomized,,,,,,,,,,,,,,,True,,COMPLETE
971,971,0.36558985710144043,2024-05-01 07:10:23.725382,2024-05-01 07:10:33.969489,0 days 00:00:10.244107,,l1,2.0,,,Agglomerative,,,,,,,,,,,,,,,single,,0.65,,,,,,,,,,,,,UMAP,,,,,,,,,,,,,correlation,14.0,112.0,,,COMPLETE
972,972,0.8837019188525425,2024-05-01 07:10:33.970534,2024-05-01 07:10:34.197970,0 days 00:00:00.227436,,l1,3.0,,,Agglomerative,,,,,,,,,,,,,,,single,,,,3.0,none,,,,,,,2.0,9.535612274894092,,PCA,randomized,,,,,,,,,,,,,,,True,,COMPLETE
973,973,-1.0,2024-05-01 07:10:34.199017,2024-05-01 07:10:34.388637,0 days 00:00:00.189620,,,,9.3,,HDBSCAN,,,,8.0,auto,60.0,eom,chebyshev,222.0,,,,,,,,,10.0,2.0,none,,,,,,,2.0,9.391076663575815,,PCA,randomized,,,,,,,,,,,,,,,True,,COMPLETE
974,974,0.964443639113474,2024-05-01 07:10:34.389550,2024-05-01 07:10:34.605011,0 days 00:00:00.215461,,l1,2.0,,,Agglomerative,,,,,,,,,,,,,,,single,,,,2.0,none,,,,,,,2.0,9.65573906935527,,PCA,randomized,,,,,,,,,,,,,,,True,,COMPLETE
975,975,0.9517407922205964,2024-05-01 07:10:34.606289,2024-05-01 07:10:34.844372,0 days 00:00:00.238083,,l1,2.0,,,Agglomerative,,,,,,,,,,,,,,,single,,,,3.0,none,,,,,,,2.0,9.64769165763765,,PCA,randomized,,,,,,,,,,,,,,,True,,COMPLETE
976,976,-0.12958034873008728,2024-05-01 07:10:34.845701,2024-05-01 07:12:28.818448,0 days 00:01:53.972747,,l1,3.0,,,Agglomerative,,,,,,,,,,,,,,,single,,,,,,,,,,,,,,49.27440539319087,t-SNE,,,,,,,9.90252257485356,random,50.0,exact,rogerstanimoto,4.0,,,,,,COMPLETE
977,977,0.964443639113474,2024-05-01 07:12:28.819896,2024-05-01 07:12:29.045135,0 days 00:00:00.225239,,l1,2.0,,,Agglomerative,,,,,,,,,,,,,,,single,,,,2.0,none,,,,,,,2.0,9.675672132290241,,PCA,randomized,,,,,,,,,,,,,,,True,,COMPLETE
978,978,0.8106367688771752,2024-05-01 07:12:29.046397,2024-05-01 07:12:29.261730,0 days 00:00:00.215333,,l1,9.0,,,Agglomerative,,,,,,,,,,,,,,,single,,,,3.0,none,,,,,,,2.0,9.686395678758391,,PCA,randomized,,,,,,,,,,,,,,,True,,COMPLETE
979,979,0.9517407922205964,2024-05-01 07:12:29.263030,2024-05-01 07:12:29.516752,0 days 00:00:00.253722,,l1,2.0,,,Agglomerative,,,,,,,,,,,,,,,single,,,,3.0,none,,,,,,,2.0,9.69093704152747,,PCA,randomized,,,,,,,,,,,,,,,True,,COMPLETE
980,980,0.8812365955580874,2024-05-01 07:12:29.517824,2024-05-01 07:12:29.738949,0 days 00:00:00.221125,,l1,12.0,,,Agglomerative,,,,,,,,,,,,,,,single,,,,2.0,none,,,,,,,2.0,9.708796313199512,,PCA,randomized,,,,,,,,,,,,,,,True,,COMPLETE
981,981,0.9123251463359364,2024-05-01 07:12:29.740091,2024-05-01 07:12:29.976071,0 days 00:00:00.235980,,l1,2.0,,,Agglomerative,,,,,,,,,,,,,,,single,,,,2.0,auto,,,,,,,2.0,9.501774767485214,,PCA,randomized,,,,,,,,,,,,,,,True,,COMPLETE
982,982,0.964443639113474,2024-05-01 07:12:29.977195,2024-05-01 07:12:30.217797,0 days 00:00:00.240602,,l1,2.0,,,Agglomerative,,,,,,,,,,,,,,,single,,,,2.0,none,,,,,,,2.0,9.757058547088523,,PCA,randomized,,,,,,,,,,,,,,,True,,COMPLETE
983,983,0.4742630882412834,2024-05-01 07:12:30.219088,2024-05-01 07:12:32.378518,0 days 00:00:02.159430,,,,,,OPTICS,,,,,,,,,,,,,,,,100.0,,,2.0,none,auto,25.0,xi,correlation,7.0,,2.0,9.794554317186844,,PCA,randomized,,,,,,,,,,,,,,,True,0.45,COMPLETE
984,984,0.9517407922205964,2024-05-01 07:12:32.379913,2024-05-01 07:12:32.692602,0 days 00:00:00.312689,,l1,2.0,,,Agglomerative,,,,,,,,,,,,,,,single,,,,3.0,none,,,,,,,2.0,9.756973916281668,,PCA,randomized,,,,,,,,,,,,,,,True,,COMPLETE
985,985,0.9338827642391248,2024-05-01 07:12:32.693920,2024-05-01 07:12:32.924593,0 days 00:00:00.230673,,l1,3.0,,,Agglomerative,,,,,,,,,,,,,,,single,,,,2.0,none,,,,,,,2.0,9.747720113621716,,PCA,randomized,,,,,,,,,,,,,,,True,,COMPLETE
986,986,0.3691286336336207,2024-05-01 07:12:32.926126,2024-05-01 07:12:33.185448,0 days 00:00:00.259322,,,,,,KMeans,,,,,,,,,,lloyd,random,14.0,18.0,0.01,,,,,2.0,QR,,,,,,,2.0,9.571056695185067,,PCA,randomized,,,,,,,,,,,,,,,True,,COMPLETE
987,987,0.8711113424165347,2024-05-01 07:12:33.186757,2024-05-01 07:12:33.399800,0 days 00:00:00.213043,,l1,16.0,,,Agglomerative,,,,,,,,,,,,,,,single,,,,2.0,none,,,,,,,2.0,9.797414882843979,,PCA,randomized,,,,,,,,,,,,,,,True,,COMPLETE
988,988,0.9123251463359368,2024-05-01 07:12:33.400890,2024-05-01 07:12:33.624201,0 days 00:00:00.223311,,l1,2.0,,,Agglomerative,,,,,,,,,,,,,,,single,,,,3.0,none,,,,,,,2.0,9.540260058096713,,PCA,arpack,,,,,,,,,,,,,,,True,,COMPLETE
989,989,0.9123251463359369,2024-05-01 07:12:33.625287,2024-05-01 07:12:33.925225,0 days 00:00:00.299938,,l1,2.0,,,Agglomerative,,,,,,,,,,,,,,,single,,,,2.0,none,,,,,,,2.0,9.807728906037063,,PCA,full,,,,,,,,,,,,,,,True,,COMPLETE
990,990,0.9517407922205964,2024-05-01 07:12:33.926418,2024-05-01 07:12:34.138991,0 days 00:00:00.212573,,l1,2.0,,,Agglomerative,,,,,,,,,,,,,,,single,,,,3.0,none,,,,,,,2.0,9.641145233701678,,PCA,randomized,,,,,,,,,,,,,,,True,,COMPLETE
991,991,0.3667189572874474,2024-05-01 07:12:34.140347,2024-05-01 07:12:34.789574,0 days 00:00:00.649227,nearest_neighbors,,,,discretize,Spectral,7.343078874883091,4.0,lobpcg,,,,,,,,,,,,,,,,2.0,none,,,,,,,2.0,0.6869202316799683,,PCA,randomized,15.0,7.6,11.0,12.0,412.0,,,,,,,,,,True,,COMPLETE
992,992,0.8837019188525425,2024-05-01 07:12:34.791630,2024-05-01 07:12:35.039947,0 days 00:00:00.248317,,l1,3.0,,,Agglomerative,,,,,,,,,,,,,,,single,,,,3.0,none,,,,,,,2.0,9.799635257886742,,PCA,randomized,,,,,,,,,,,,,,,True,,COMPLETE
993,993,-1.0,2024-05-01 07:12:35.041080,2024-05-01 07:12:35.140869,0 days 00:00:00.099789,,l1,2.0,,,Agglomerative,,,,,,,,,,,,,,,single,,0.2,,,,,,,,,,,,,UMAP,,,,,,,,,,,,,seuclidean,6.0,182.0,,,COMPLETE
994,994,0.964443639113474,2024-05-01 07:12:35.141645,2024-05-01 07:12:35.387046,0 days 00:00:00.245401,,l1,2.0,,,Agglomerative,,,,,,,,,,,,,,,single,,,,2.0,none,,,,,,,2.0,9.48626045147037,,PCA,randomized,,,,,,,,,,,,,,,True,,COMPLETE
995,995,0.9338827642391248,2024-05-01 07:12:35.389489,2024-05-01 07:12:35.613407,0 days 00:00:00.223918,,l1,3.0,,,Agglomerative,,,,,,,,,,,,,,,single,,,,2.0,none,,,,,,,2.0,9.648232883352426,,PCA,randomized,,,,,,,,,,,,,,,True,,COMPLETE
996,996,0.964443639113474,2024-05-01 07:12:35.614482,2024-05-01 07:12:35.831146,0 days 00:00:00.216664,,l1,2.0,,,Agglomerative,,,,,,,,,,,,,,,single,,,,2.0,none,,,,,,,2.0,1.2704464928479497,,PCA,randomized,,,,,,,,,,,,,,,True,,COMPLETE
997,997,0.964443639113474,2024-05-01 07:12:35.832282,2024-05-01 07:12:36.057547,0 days 00:00:00.225265,,l1,2.0,,,Agglomerative,,,,,,,,,,,,,,,single,,,,2.0,none,,,,,,,2.0,9.803021230861663,,PCA,randomized,,,,,,,,,,,,,,,True,,COMPLETE
998,998,0.9338827642391248,2024-05-01 07:12:36.058760,2024-05-01 07:12:36.283713,0 days 00:00:00.224953,,l1,3.0,,,Agglomerative,,,,,,,,,,,,,,,single,,,,2.0,none,,,,,,,2.0,9.461506423987238,,PCA,randomized,,,,,,,,,,,,,,,True,,COMPLETE
999,999,-1.0,2024-05-01 07:12:36.284959,2024-05-01 07:12:36.408789,0 days 00:00:00.123830,,,,2.1,,HDBSCAN,,,,0.6000000000000001,brute,75.0,leaf,russellrao,282.0,,,,,,,,,74.0,,,,,,,,,,,40.030743143381436,t-SNE,,,,,,,7.23484484769722,pca,95.0,barnes_hut,matching,2.0,,,,,,COMPLETE
