,number,value,datetime_start,datetime_complete,duration,params_affinity,params_agglo_metric,params_agglo_n,params_alpha,params_assign_lables,params_clusterer,params_coef0,params_degree,params_eigen_solver,params_epsilon,params_hdbscan_algo,params_hdbscan_leaf_size,params_hdbscan_method,params_hdbscan_metric,params_hdbscan_n,params_kmeans_algo,params_kmeans_init,params_kmeans_n,params_kmeans_n_init,params_kmeans_tol,params_linkage,params_max_eps,params_min_dist,params_min_samples,params_n_oversamples,params_normalizer,params_optics_algo,params_optics_leaf_size,params_optics_method,params_optics_metric,params_optics_n,params_p,params_pca_n,params_pca_tol,params_perplexity,params_reducer,params_solver,params_spec_cluster,params_spec_gamma,params_spec_n,params_spec_n_init,params_spec_n_neighbors,params_tightness,params_tsne_init,params_tsne_lr,params_tsne_method,params_tsne_metric,params_tsne_n,params_umap_metric,params_umap_n,params_umap_n_neighbors,params_whiten,params_xi,state
687,687,0.7509274322397108,2024-05-01 06:43:15.280658,2024-05-01 06:43:16.986024,0 days 00:00:01.705366,,,,,,OPTICS,,,,,,,,,,,,,,,,1.0,,,1.0,none,ball_tree,20.0,dbscan,l2,257.0,,3.0,9.361418539760756,,PCA,randomized,,,,,,,,,,,,,,,True,0.9500000000000001,COMPLETE
688,688,0.26179623056029055,2024-05-01 06:43:16.987030,2024-05-01 06:43:17.165950,0 days 00:00:00.178920,,,,,,KMeans,,,,,,,,,,elkan,k-means++,4.0,,1.0,,,,,1.0,none,,,,,,,3.0,9.805794266817273,,PCA,randomized,,,,,,,,,,,,,,,True,,COMPLETE
689,689,0.9510694119347141,2024-05-01 06:43:17.166935,2024-05-01 06:43:17.444335,0 days 00:00:00.277400,,manhattan,2.0,,,Agglomerative,,,,,,,,,,,,,,,average,,,,2.0,none,,,,,,,3.0,9.543239671293229,,PCA,randomized,,,,,,,,,,,,,,,True,,COMPLETE
690,690,0.9532357462135064,2024-05-01 06:43:17.445303,2024-05-01 06:43:17.698157,0 days 00:00:00.252854,,manhattan,2.0,,,Agglomerative,,,,,,,,,,,,,,,average,,,,1.0,none,,,,,,,3.0,9.846263873197575,,PCA,randomized,,,,,,,,,,,,,,,True,,COMPLETE
691,691,0.9472133311895985,2024-05-01 06:43:17.699169,2024-05-01 06:43:17.959649,0 days 00:00:00.260480,,manhattan,2.0,,,Agglomerative,,,,,,,,,,,,,,,average,,,,1.0,none,,,,,,,4.0,9.81743730940444,,PCA,randomized,,,,,,,,,,,,,,,True,,COMPLETE
692,692,0.9510694119347141,2024-05-01 06:43:17.960607,2024-05-01 06:43:18.221689,0 days 00:00:00.261082,,manhattan,2.0,,,Agglomerative,,,,,,,,,,,,,,,average,,,,2.0,none,,,,,,,3.0,9.982178980240825,,PCA,randomized,,,,,,,,,,,,,,,True,,COMPLETE
693,693,0.9532357462135064,2024-05-01 06:43:18.222655,2024-05-01 06:43:18.491616,0 days 00:00:00.268961,,manhattan,2.0,,,Agglomerative,,,,,,,,,,,,,,,average,,,,1.0,none,,,,,,,3.0,9.676508591412242,,PCA,randomized,,,,,,,,,,,,,,,True,,COMPLETE
694,694,0.9472133311895985,2024-05-01 06:43:18.492788,2024-05-01 06:43:18.750433,0 days 00:00:00.257645,,manhattan,2.0,,,Agglomerative,,,,,,,,,,,,,,,average,,,,1.0,none,,,,,,,4.0,9.5983746896834,,PCA,randomized,,,,,,,,,,,,,,,True,,COMPLETE
695,695,0.9365353598376864,2024-05-01 06:43:18.751431,2024-05-01 06:43:19.008990,0 days 00:00:00.257559,,,2.0,,,Agglomerative,,,,,,,,,,,,,,,ward,,,,2.0,none,,,,,,,3.0,9.362100075296683,,PCA,randomized,,,,,,,,,,,,,,,True,,COMPLETE
696,696,-1.0,2024-05-01 06:43:19.010142,2024-05-01 06:43:19.146914,0 days 00:00:00.136772,precomputed,,,,discretize,Spectral,55.90114243635981,4.0,arpack,,,,,,,,,,,,,,,,1.0,none,,,,,,,3.0,9.655588170094042,,PCA,randomized,16.0,3.6,3.0,8.0,62.0,,,,,,,,,,True,,COMPLETE
697,697,0.9472133311895985,2024-05-01 06:43:19.147767,2024-05-01 06:43:19.421706,0 days 00:00:00.273939,,manhattan,2.0,,,Agglomerative,,,,,,,,,,,,,,,average,,,,1.0,none,,,,,,,4.0,9.992763819378382,,PCA,randomized,,,,,,,,,,,,,,,True,,COMPLETE
698,698,0.9510694119347141,2024-05-01 06:43:19.422873,2024-05-01 06:43:19.706180,0 days 00:00:00.283307,,manhattan,2.0,,,Agglomerative,,,,,,,,,,,,,,,average,,,,2.0,none,,,,,,,3.0,9.49248080396694,,PCA,randomized,,,,,,,,,,,,,,,True,,COMPLETE
699,699,0.9532357462135064,2024-05-01 06:43:19.707703,2024-05-01 06:43:19.961225,0 days 00:00:00.253522,,manhattan,2.0,,,Agglomerative,,,,,,,,,,,,,,,average,,,,1.0,none,,,,,,,3.0,9.785387292276411,,PCA,randomized,,,,,,,,,,,,,,,True,,COMPLETE
700,700,0.8541802859088464,2024-05-01 06:43:19.962359,2024-05-01 06:43:20.212145,0 days 00:00:00.249786,,manhattan,2.0,,,Agglomerative,,,,,,,,,,,,,,,average,,,,1.0,QR,,,,,,,4.0,9.805904583656014,,PCA,randomized,,,,,,,,,,,,,,,True,,COMPLETE
701,701,0.3906885087490082,2024-05-01 06:43:20.213314,2024-05-01 06:43:27.186574,0 days 00:00:06.973260,,manhattan,2.0,,,Agglomerative,,,,,,,,,,,,,,,average,,0.0,,,,,,,,,,,,,UMAP,,,,,,,,,,,,,canberra,10.0,7.0,,,COMPLETE
702,702,-1.0,2024-05-01 06:43:27.187515,2024-05-01 06:43:27.348408,0 days 00:00:00.160893,,,,5.1,,HDBSCAN,,,,6.9,ball_tree,65.0,eom,mahalanobis,42.0,,,,,,,,,116.0,2.0,none,,,,,,,3.0,9.64629896644411,,PCA,arpack,,,,,,,,,,,,,,,True,,COMPLETE
703,703,0.9181809912865071,2024-05-01 06:43:27.349279,2024-05-01 06:43:27.690249,0 days 00:00:00.340970,,manhattan,2.0,,,Agglomerative,,,,,,,,,,,,,,,average,,,,14.0,none,,,,,,,3.0,9.312749629174515,,PCA,randomized,,,,,,,,,,,,,,,True,,COMPLETE
704,704,0.2749619781970978,2024-05-01 06:43:27.691702,2024-05-01 06:46:31.397062,0 days 00:03:03.705360,,manhattan,2.0,,,Agglomerative,,,,,,,,,,,,,,,average,,,,,,,,,,,,,,19.948160291018276,t-SNE,,,,,,,18.802189964276927,pca,25.0,exact,dice,9.0,,,,,,COMPLETE
705,705,0.9472133311895985,2024-05-01 06:46:31.398345,2024-05-01 06:46:31.703380,0 days 00:00:00.305035,,manhattan,2.0,,,Agglomerative,,,,,,,,,,,,,,,average,,,,1.0,none,,,,,,,4.0,9.810000309073619,,PCA,randomized,,,,,,,,,,,,,,,True,,COMPLETE
706,706,0.9532357462135064,2024-05-01 06:46:31.704574,2024-05-01 06:46:31.977078,0 days 00:00:00.272504,,manhattan,2.0,,,Agglomerative,,,,,,,,,,,,,,,average,,,,1.0,none,,,,,,,3.0,9.516340557438152,,PCA,randomized,,,,,,,,,,,,,,,True,,COMPLETE
707,707,0.9339659207700731,2024-05-01 06:46:31.978214,2024-05-01 06:46:32.235933,0 days 00:00:00.257719,,manhattan,2.0,,,Agglomerative,,,,,,,,,,,,,,,average,,,,2.0,none,,,,,,,4.0,9.542921801797485,,PCA,randomized,,,,,,,,,,,,,,,True,,COMPLETE
708,708,0.9532357462135064,2024-05-01 06:46:32.237131,2024-05-01 06:46:32.502936,0 days 00:00:00.265805,,manhattan,2.0,,,Agglomerative,,,,,,,,,,,,,,,average,,,,1.0,none,,,,,,,3.0,9.340826545977153,,PCA,randomized,,,,,,,,,,,,,,,True,,COMPLETE
709,709,0.9472133311895985,2024-05-01 06:46:32.504192,2024-05-01 06:46:32.759134,0 days 00:00:00.254942,,manhattan,2.0,,,Agglomerative,,,,,,,,,,,,,,,average,,,,1.0,none,,,,,,,4.0,9.446585558916796,,PCA,randomized,,,,,,,,,,,,,,,True,,COMPLETE
710,710,0.9317028900448022,2024-05-01 06:46:32.760328,2024-05-01 06:46:33.047948,0 days 00:00:00.287620,,manhattan,2.0,,,Agglomerative,,,,,,,,,,,,,,,average,,,,19.0,none,,,,,,,3.0,9.210886698217681,,PCA,randomized,,,,,,,,,,,,,,,True,,COMPLETE
711,711,0.9339659207700731,2024-05-01 06:46:33.049163,2024-05-01 06:46:33.351754,0 days 00:00:00.302591,,manhattan,2.0,,,Agglomerative,,,,,,,,,,,,,,,average,,,,2.0,none,,,,,,,4.0,9.257181369756529,,PCA,randomized,,,,,,,,,,,,,,,True,,COMPLETE
712,712,-1.0,2024-05-01 06:46:33.352923,2024-05-01 06:46:33.490098,0 days 00:00:00.137175,,,,,,OPTICS,,,,,,,,,,,,,,,,1000.0,,,1.0,none,kd_tree,95.0,xi,yule,107.0,,5.0,9.6346657270285,,PCA,randomized,,,,,,,,,,,,,,,True,0.8,COMPLETE
713,713,0.9532357462135064,2024-05-01 06:46:33.490969,2024-05-01 06:46:33.764365,0 days 00:00:00.273396,,manhattan,2.0,,,Agglomerative,,,,,,,,,,,,,,,average,,,,1.0,none,,,,,,,3.0,9.997663953758316,,PCA,randomized,,,,,,,,,,,,,,,True,,COMPLETE
714,714,0.9472133311895985,2024-05-01 06:46:33.765326,2024-05-01 06:46:34.044056,0 days 00:00:00.278730,,manhattan,2.0,,,Agglomerative,,,,,,,,,,,,,,,average,,,,1.0,none,,,,,,,4.0,9.82814266299303,,PCA,randomized,,,,,,,,,,,,,,,True,,COMPLETE
715,715,0.4473536259917891,2024-05-01 06:46:34.045200,2024-05-01 06:46:34.238319,0 days 00:00:00.193119,,,,,,KMeans,,,,,,,,,,elkan,random,6.0,4.0,0.1,,,,,2.0,none,,,,,,,3.0,9.41960396727057,,PCA,randomized,,,,,,,,,,,,,,,True,,COMPLETE
716,716,0.9532357462135064,2024-05-01 06:46:34.239558,2024-05-01 06:46:34.504406,0 days 00:00:00.264848,,manhattan,2.0,,,Agglomerative,,,,,,,,,,,,,,,average,,,,1.0,none,,,,,,,3.0,9.648224400511562,,PCA,randomized,,,,,,,,,,,,,,,True,,COMPLETE
717,717,0.9182565140400013,2024-05-01 06:46:34.505407,2024-05-01 06:46:34.806273,0 days 00:00:00.300866,,manhattan,2.0,,,Agglomerative,,,,,,,,,,,,,,,average,,,,9.0,none,,,,,,,3.0,9.613101561426163,,PCA,randomized,,,,,,,,,,,,,,,True,,COMPLETE
718,718,0.9472133311895985,2024-05-01 06:46:34.807268,2024-05-01 06:46:35.093269,0 days 00:00:00.286001,,manhattan,2.0,,,Agglomerative,,,,,,,,,,,,,,,average,,,,1.0,none,,,,,,,4.0,9.296744815964622,,PCA,randomized,,,,,,,,,,,,,,,True,,COMPLETE
719,719,0.9510694119347141,2024-05-01 06:46:35.094255,2024-05-01 06:46:35.343770,0 days 00:00:00.249515,,manhattan,2.0,,,Agglomerative,,,,,,,,,,,,,,,average,,,,2.0,none,,,,,,,3.0,9.822643175478918,,PCA,randomized,,,,,,,,,,,,,,,True,,COMPLETE
720,720,-1.0,2024-05-01 06:46:35.344748,2024-05-01 06:46:35.436709,0 days 00:00:00.091961,,manhattan,2.0,,,Agglomerative,,,,,,,,,,,,,,,average,,0.95,,,,,,,,,,,,,UMAP,,,,,,,,,,,,,seuclidean,15.0,177.0,,,COMPLETE
721,721,0.8881362060495269,2024-05-01 06:46:35.437245,2024-05-01 06:46:35.676449,0 days 00:00:00.239204,,,2.0,,,Agglomerative,,,,,,,,,,,,,,,ward,,,,1.0,none,,,,,,,4.0,9.485898770106242,,PCA,randomized,,,,,,,,,,,,,,,True,,COMPLETE
722,722,-1.0,2024-05-01 06:46:35.677623,2024-05-01 06:46:35.830668,0 days 00:00:00.153045,precomputed_nearest_neighbors,,,,cluster_qr,Spectral,21.994199130746328,5.0,amg,,,,,,,,,,,,,,,,1.0,none,,,,,,,3.0,9.96533751687553,,PCA,randomized,4.0,7.1,18.0,2.0,177.0,,,,,,,,,,True,,COMPLETE
723,723,0.8850874331520209,2024-05-01 06:46:35.833614,2024-05-01 06:46:36.207147,0 days 00:00:00.373533,,manhattan,2.0,,,Agglomerative,,,,,,,,,,,,,,,average,,,,2.0,none,,,,,,,3.0,9.993789601175257,,PCA,arpack,,,,,,,,,,,,,,,True,,COMPLETE
724,724,0.43804974919600026,2024-05-01 06:46:36.208302,2024-05-01 06:46:36.525422,0 days 00:00:00.317120,,cosine,2.0,,,Agglomerative,,,,,,,,,,,,,,,average,,,,1.0,none,,,,,,,4.0,9.64919964396611,,PCA,randomized,,,,,,,,,,,,,,,True,,COMPLETE
725,725,0.9532357462135064,2024-05-01 06:46:36.535615,2024-05-01 06:46:36.795791,0 days 00:00:00.260176,,manhattan,2.0,,,Agglomerative,,,,,,,,,,,,,,,average,,,,1.0,none,,,,,,,3.0,9.671725501922708,,PCA,randomized,,,,,,,,,,,,,,,True,,COMPLETE
726,726,0.9510694119347141,2024-05-01 06:46:36.796750,2024-05-01 06:46:37.059016,0 days 00:00:00.262266,,manhattan,2.0,,,Agglomerative,,,,,,,,,,,,,,,average,,,,2.0,none,,,,,,,3.0,9.297793104414092,,PCA,randomized,,,,,,,,,,,,,,,True,,COMPLETE
727,727,-1.0,2024-05-01 06:46:37.060072,2024-05-01 06:47:31.169133,0 days 00:00:54.109061,,manhattan,2.0,,,Agglomerative,,,,,,,,,,,,,,,average,,,,,,,,,,,,,,7.6413035862673695,t-SNE,,,,,,,10.75527300476981,pca,65.0,barnes_hut,mahalanobis,2.0,,,,,,COMPLETE
728,728,0.8541802859088464,2024-05-01 06:47:31.169944,2024-05-01 06:47:31.451841,0 days 00:00:00.281897,,manhattan,2.0,,,Agglomerative,,,,,,,,,,,,,,,average,,,,1.0,QR,,,,,,,4.0,9.540747264234557,,PCA,randomized,,,,,,,,,,,,,,,True,,COMPLETE
729,729,-1.0,2024-05-01 06:47:31.455797,2024-05-01 06:47:31.731823,0 days 00:00:00.276026,,,,1.1,,HDBSCAN,,,,3.5,auto,55.0,leaf,jaccard,332.0,,,,,,,,,184.0,1.0,none,,,,,,,3.0,9.688911246669331,,PCA,randomized,,,,,,,,,,,,,,,True,,COMPLETE
730,730,0.9532357462135064,2024-05-01 06:47:31.732600,2024-05-01 06:47:31.970723,0 days 00:00:00.238123,,manhattan,2.0,,,Agglomerative,,,,,,,,,,,,,,,average,,,,1.0,none,,,,,,,3.0,9.339906544761329,,PCA,randomized,,,,,,,,,,,,,,,True,,COMPLETE
731,731,0.9510694119347141,2024-05-01 06:47:31.973498,2024-05-01 06:47:32.252671,0 days 00:00:00.279173,,manhattan,2.0,,,Agglomerative,,,,,,,,,,,,,,,average,,,,2.0,none,,,,,,,3.0,9.153389582085898,,PCA,randomized,,,,,,,,,,,,,,,True,,COMPLETE
732,732,0.9472133311895985,2024-05-01 06:47:32.253850,2024-05-01 06:47:32.611238,0 days 00:00:00.357388,,manhattan,2.0,,,Agglomerative,,,,,,,,,,,,,,,average,,,,1.0,none,,,,,,,4.0,9.284417273663244,,PCA,randomized,,,,,,,,,,,,,,,True,,COMPLETE
733,733,0.9532357462135064,2024-05-01 06:47:32.612455,2024-05-01 06:47:32.849168,0 days 00:00:00.236713,,manhattan,2.0,,,Agglomerative,,,,,,,,,,,,,,,average,,,,1.0,none,,,,,,,3.0,9.427646635053978,,PCA,randomized,,,,,,,,,,,,,,,True,,COMPLETE
734,734,0.9510694119347141,2024-05-01 06:47:32.850140,2024-05-01 06:47:33.118004,0 days 00:00:00.267864,,manhattan,2.0,,,Agglomerative,,,,,,,,,,,,,,,average,,,,2.0,none,,,,,,,3.0,9.084102102538202,,PCA,randomized,,,,,,,,,,,,,,,True,,COMPLETE
735,735,0.9532357462135064,2024-05-01 06:47:33.119165,2024-05-01 06:47:33.385644,0 days 00:00:00.266479,,manhattan,2.0,,,Agglomerative,,,,,,,,,,,,,,,average,,,,1.0,none,,,,,,,3.0,9.479334590110131,,PCA,randomized,,,,,,,,,,,,,,,True,,COMPLETE
736,736,0.9532357462135064,2024-05-01 06:47:33.386810,2024-05-01 06:47:33.644273,0 days 00:00:00.257463,,manhattan,2.0,,,Agglomerative,,,,,,,,,,,,,,,average,,,,1.0,none,,,,,,,3.0,9.638252957250636,,PCA,randomized,,,,,,,,,,,,,,,True,,COMPLETE
737,737,0.9339659207700731,2024-05-01 06:47:33.646597,2024-05-01 06:47:33.910698,0 days 00:00:00.264101,,manhattan,2.0,,,Agglomerative,,,,,,,,,,,,,,,average,,,,2.0,none,,,,,,,4.0,9.338496743206836,,PCA,randomized,,,,,,,,,,,,,,,True,,COMPLETE
738,738,0.9532357462135064,2024-05-01 06:47:33.911713,2024-05-01 06:47:34.176435,0 days 00:00:00.264722,,manhattan,2.0,,,Agglomerative,,,,,,,,,,,,,,,average,,,,1.0,none,,,,,,,3.0,9.985205046504701,,PCA,randomized,,,,,,,,,,,,,,,True,,COMPLETE
739,739,-1.0,2024-05-01 06:47:34.177533,2024-05-01 06:47:35.685037,0 days 00:00:01.507504,,,,,,OPTICS,,,,,,,,,,,,,,,,inf,,,1.0,none,auto,70.0,dbscan,jaccard,447.0,,4.0,9.997836003957266,,PCA,randomized,,,,,,,,,,,,,,,True,0.1,COMPLETE
740,740,0.9510694119347141,2024-05-01 06:47:35.685835,2024-05-01 06:47:35.916366,0 days 00:00:00.230531,,manhattan,2.0,,,Agglomerative,,,,,,,,,,,,,,,average,,,,2.0,none,,,,,,,3.0,9.481132730710938,,PCA,randomized,,,,,,,,,,,,,,,True,,COMPLETE
741,741,0.9532357462135064,2024-05-01 06:47:35.917355,2024-05-01 06:47:36.183283,0 days 00:00:00.265928,,manhattan,2.0,,,Agglomerative,,,,,,,,,,,,,,,average,,,,1.0,none,,,,,,,3.0,9.062664639091151,,PCA,randomized,,,,,,,,,,,,,,,True,,COMPLETE
742,742,0.5262893887027595,2024-05-01 06:47:36.184280,2024-05-01 06:47:36.349888,0 days 00:00:00.165608,,,,,,KMeans,,,,,,,,,,lloyd,k-means++,16.0,,1e-05,,,,,1.0,none,,,,,,,4.0,9.652975933787687,,PCA,randomized,,,,,,,,,,,,,,,True,,COMPLETE
743,743,0.9510694119347141,2024-05-01 06:47:36.350900,2024-05-01 06:47:36.684782,0 days 00:00:00.333882,,manhattan,2.0,,,Agglomerative,,,,,,,,,,,,,,,average,,,,2.0,none,,,,,,,3.0,9.778571822264267,,PCA,randomized,,,,,,,,,,,,,,,True,,COMPLETE
744,744,0.9532357462135064,2024-05-01 06:47:36.685955,2024-05-01 06:47:36.970579,0 days 00:00:00.284624,,manhattan,2.0,,,Agglomerative,,,,,,,,,,,,,,,average,,,,1.0,none,,,,,,,3.0,9.268279994979515,,PCA,randomized,,,,,,,,,,,,,,,True,,COMPLETE
745,745,0.38957440853118896,2024-05-01 06:47:36.972033,2024-05-01 06:47:46.586871,0 days 00:00:09.614838,,manhattan,2.0,,,Agglomerative,,,,,,,,,,,,,,,average,,0.7000000000000001,,,,,,,,,,,,,UMAP,,,,,,,,,,,,,correlation,5.0,132.0,,,COMPLETE
746,746,0.9532357462135064,2024-05-01 06:47:46.587850,2024-05-01 06:47:46.901559,0 days 00:00:00.313709,,manhattan,2.0,,,Agglomerative,,,,,,,,,,,,,,,average,,,,1.0,none,,,,,,,3.0,9.50453672003825,,PCA,randomized,,,,,,,,,,,,,,,True,,COMPLETE
747,747,0.8850874331520209,2024-05-01 06:47:46.902955,2024-05-01 06:47:47.163738,0 days 00:00:00.260783,,manhattan,2.0,,,Agglomerative,,,,,,,,,,,,,,,average,,,,2.0,none,,,,,,,3.0,9.803205207299179,,PCA,arpack,,,,,,,,,,,,,,,True,,COMPLETE
748,748,0.9532357462135064,2024-05-01 06:47:47.164923,2024-05-01 06:47:47.433295,0 days 00:00:00.268372,,manhattan,2.0,,,Agglomerative,,,,,,,,,,,,,,,average,,,,1.0,none,,,,,,,3.0,9.662558043167378,,PCA,randomized,,,,,,,,,,,,,,,True,,COMPLETE
749,749,0.8881362060495269,2024-05-01 06:47:47.434276,2024-05-01 06:47:47.748930,0 days 00:00:00.314654,,,2.0,,,Agglomerative,,,,,,,,,,,,,,,ward,,,,1.0,none,,,,,,,4.0,9.990727324791843,,PCA,randomized,,,,,,,,,,,,,,,True,,COMPLETE
750,750,0.29369574785232544,2024-05-01 06:47:47.750093,2024-05-01 06:51:55.536303,0 days 00:04:07.786210,nearest_neighbors,,,,kmeans,Spectral,7.211464450787361,3.0,lobpcg,,,,,,,,,,,,,,,,,,,,,,,,,,46.83726712706468,t-SNE,,20.0,1.1,6.0,17.0,462.0,9.172747513184424,random,85.0,exact,chebyshev,20.0,,,,,,COMPLETE
751,751,0.885087433152021,2024-05-01 06:51:55.537417,2024-05-01 06:51:55.809069,0 days 00:00:00.271652,,manhattan,2.0,,,Agglomerative,,,,,,,,,,,,,,,average,,,,2.0,QR,,,,,,,3.0,9.342242676150434,,PCA,randomized,,,,,,,,,,,,,,,True,,COMPLETE
752,752,0.4137947058244148,2024-05-01 06:51:55.811050,2024-05-01 06:51:56.093286,0 days 00:00:00.282236,,cosine,2.0,,,Agglomerative,,,,,,,,,,,,,,,average,,,,1.0,none,,,,,,,3.0,9.657280008521486,,PCA,randomized,,,,,,,,,,,,,,,True,,COMPLETE
753,753,0.9472133311895985,2024-05-01 06:51:56.094451,2024-05-01 06:51:56.374656,0 days 00:00:00.280205,,manhattan,2.0,,,Agglomerative,,,,,,,,,,,,,,,average,,,,1.0,none,,,,,,,4.0,9.800926818852973,,PCA,randomized,,,,,,,,,,,,,,,True,,COMPLETE
754,754,0.9532357462135064,2024-05-01 06:51:56.375890,2024-05-01 06:51:56.648561,0 days 00:00:00.272671,,manhattan,2.0,,,Agglomerative,,,,,,,,,,,,,,,average,,,,1.0,none,,,,,,,3.0,9.486787808916661,,PCA,randomized,,,,,,,,,,,,,,,True,,COMPLETE
755,755,-1.0,2024-05-01 06:51:56.649549,2024-05-01 06:51:56.834200,0 days 00:00:00.184651,,,,0.2,,HDBSCAN,,,,9.1,brute,15.0,eom,yule,287.0,,,,,,,,,54.0,2.0,none,,,,,,,4.0,9.16465630410632,,PCA,randomized,,,,,,,,,,,,,,,True,,COMPLETE
756,756,0.9532357462135064,2024-05-01 06:51:56.846117,2024-05-01 06:51:57.187858,0 days 00:00:00.341741,,manhattan,2.0,,,Agglomerative,,,,,,,,,,,,,,,average,,,,1.0,none,,,,,,,3.0,9.998654603879674,,PCA,randomized,,,,,,,,,,,,,,,True,,COMPLETE
757,757,0.9510694119347141,2024-05-01 06:51:57.188842,2024-05-01 06:51:57.485777,0 days 00:00:00.296935,,manhattan,2.0,,,Agglomerative,,,,,,,,,,,,,,,average,,,,2.0,none,,,,,,,3.0,9.629130762855773,,PCA,randomized,,,,,,,,,,,,,,,True,,COMPLETE
758,758,0.9472133311895985,2024-05-01 06:51:57.486790,2024-05-01 06:51:57.745546,0 days 00:00:00.258756,,manhattan,2.0,,,Agglomerative,,,,,,,,,,,,,,,average,,,,1.0,none,,,,,,,4.0,9.803977251879127,,PCA,randomized,,,,,,,,,,,,,,,True,,COMPLETE
759,759,0.9532357462135064,2024-05-01 06:51:57.746551,2024-05-01 06:51:58.003094,0 days 00:00:00.256543,,manhattan,2.0,,,Agglomerative,,,,,,,,,,,,,,,average,,,,1.0,none,,,,,,,3.0,9.4498142680723,,PCA,randomized,,,,,,,,,,,,,,,True,,COMPLETE
760,760,0.9532357462135064,2024-05-01 06:51:58.004097,2024-05-01 06:51:58.259284,0 days 00:00:00.255187,,manhattan,2.0,,,Agglomerative,,,,,,,,,,,,,,,average,,,,1.0,none,,,,,,,3.0,9.265022833150418,,PCA,randomized,,,,,,,,,,,,,,,True,,COMPLETE
761,761,0.9510694119347141,2024-05-01 06:51:58.260249,2024-05-01 06:51:58.521188,0 days 00:00:00.260939,,manhattan,2.0,,,Agglomerative,,,,,,,,,,,,,,,average,,,,2.0,none,,,,,,,3.0,9.772885064874282,,PCA,randomized,,,,,,,,,,,,,,,True,,COMPLETE
762,762,0.9472133311895985,2024-05-01 06:51:58.522407,2024-05-01 06:51:58.785853,0 days 00:00:00.263446,,manhattan,2.0,,,Agglomerative,,,,,,,,,,,,,,,average,,,,1.0,none,,,,,,,4.0,9.639081965683788,,PCA,randomized,,,,,,,,,,,,,,,True,,COMPLETE
763,763,0.9532357462135064,2024-05-01 06:51:58.786847,2024-05-01 06:51:59.045783,0 days 00:00:00.258936,,manhattan,2.0,,,Agglomerative,,,,,,,,,,,,,,,average,,,,1.0,none,,,,,,,3.0,9.993806738110527,,PCA,randomized,,,,,,,,,,,,,,,True,,COMPLETE
764,764,0.9339659207700731,2024-05-01 06:51:59.046786,2024-05-01 06:51:59.356156,0 days 00:00:00.309370,,manhattan,2.0,,,Agglomerative,,,,,,,,,,,,,,,average,,,,2.0,none,,,,,,,4.0,9.02081324609267,,PCA,randomized,,,,,,,,,,,,,,,True,,COMPLETE
765,765,0.9462360800593757,2024-05-01 06:51:59.357308,2024-05-01 06:52:00.834228,0 days 00:00:01.476920,,,,,,OPTICS,,,,,,,,,,,,,,,,100.0,,,1.0,none,brute,15.0,xi,sqeuclidean,407.0,,3.0,9.465910829740533,,PCA,randomized,,,,,,,,,,,,,,,True,0.65,COMPLETE
766,766,0.9532357462135064,2024-05-01 06:52:00.835375,2024-05-01 06:52:01.092980,0 days 00:00:00.257605,,manhattan,2.0,,,Agglomerative,,,,,,,,,,,,,,,average,,,,1.0,none,,,,,,,3.0,9.818038438774293,,PCA,randomized,,,,,,,,,,,,,,,True,,COMPLETE
767,767,0.20889592170715332,2024-05-01 06:52:01.093979,2024-05-01 06:52:11.426076,0 days 00:00:10.332097,,manhattan,2.0,,,Agglomerative,,,,,,,,,,,,,,,average,,0.8500000000000001,,,,,,,,,,,,,UMAP,,,,,,,,,,,,,sokalmichener,8.0,337.0,,,COMPLETE
768,768,0.9510694119347141,2024-05-01 06:52:11.431829,2024-05-01 06:52:11.690380,0 days 00:00:00.258551,,manhattan,2.0,,,Agglomerative,,,,,,,,,,,,,,,average,,,,2.0,none,,,,,,,3.0,9.55419647784151,,PCA,randomized,,,,,,,,,,,,,,,True,,COMPLETE
769,769,0.6846872185403591,2024-05-01 06:52:11.691401,2024-05-01 06:52:11.979173,0 days 00:00:00.287772,,manhattan,20.0,,,Agglomerative,,,,,,,,,,,,,,,average,,,,1.0,none,,,,,,,3.0,9.311424113587316,,PCA,randomized,,,,,,,,,,,,,,,True,,COMPLETE
770,770,0.9532357462135064,2024-05-01 06:52:11.981291,2024-05-01 06:52:12.261370,0 days 00:00:00.280079,,manhattan,2.0,,,Agglomerative,,,,,,,,,,,,,,,average,,,,1.0,none,,,,,,,3.0,9.80583952544107,,PCA,randomized,,,,,,,,,,,,,,,True,,COMPLETE
771,771,-1.0,2024-05-01 06:52:12.262583,2024-05-01 06:52:12.353760,0 days 00:00:00.091177,,manhattan,2.0,,,Agglomerative,,,,,,,,,,,,,,,average,,,,,,,,,,,,,,33.66628320250601,t-SNE,,,,,,,7.006588966212832,pca,40.0,barnes_hut,haversine,1.0,,,,,,COMPLETE
772,772,0.35783222192479675,2024-05-01 06:52:12.354307,2024-05-01 06:52:12.537570,0 days 00:00:00.183263,,,,,,KMeans,,,,,,,,,,elkan,random,3.0,8.0,0.01,,,,,1.0,none,,,,,,,4.0,9.65029021870288,,PCA,arpack,,,,,,,,,,,,,,,True,,COMPLETE
