,number,value,datetime_start,datetime_complete,duration,params_affinity,params_agglo_metric,params_agglo_n,params_alpha,params_assign_lables,params_clusterer,params_coef0,params_degree,params_eigen_solver,params_epsilon,params_hdbscan_algo,params_hdbscan_leaf_size,params_hdbscan_method,params_hdbscan_metric,params_hdbscan_n,params_kmeans_algo,params_kmeans_init,params_kmeans_n,params_kmeans_n_init,params_kmeans_tol,params_linkage,params_max_eps,params_min_dist,params_min_samples,params_n_oversamples,params_normalizer,params_optics_algo,params_optics_leaf_size,params_optics_method,params_optics_metric,params_optics_n,params_p,params_pca_n,params_pca_tol,params_perplexity,params_reducer,params_solver,params_spec_cluster,params_spec_gamma,params_spec_n,params_spec_n_init,params_spec_n_neighbors,params_tightness,params_tsne_init,params_tsne_lr,params_tsne_method,params_tsne_metric,params_tsne_n,params_umap_metric,params_umap_n,params_umap_n_neighbors,params_whiten,params_xi,state
430,430,0.18032880127429962,2024-05-01 06:12:23.925998,2024-05-01 06:15:39.622311,0 days 00:03:15.696313,,euclidean,2.0,,,Agglomerative,,,,,,,,,,,,,,,complete,,,,,,,,,,,,,,23.080680078601347,t-SNE,,,,,,,6.367522711412858,random,90.0,exact,cosine,10.0,,,,,,COMPLETE
431,431,-1.0,2024-05-01 06:15:39.623436,2024-05-01 06:15:39.771368,0 days 00:00:00.147932,,,,5.6,,HDBSCAN,,,,1.4000000000000001,kd_tree,95.0,leaf,sokalmichener,197.0,,,,,,,,,38.0,3.0,none,,,,,,,18.0,9.370073730011796,,PCA,randomized,,,,,,,,,,,,,,,False,,COMPLETE
432,432,0.931311463780002,2024-05-01 06:15:39.773926,2024-05-01 06:15:40.108574,0 days 00:00:00.334648,,euclidean,2.0,,,Agglomerative,,,,,,,,,,,,,,,complete,,,,4.0,none,,,,,,,18.0,9.750108831600153,,PCA,randomized,,,,,,,,,,,,,,,False,,COMPLETE
433,433,0.9516445245031552,2024-05-01 06:15:40.109427,2024-05-01 06:15:40.349615,0 days 00:00:00.240188,,euclidean,2.0,,,Agglomerative,,,,,,,,,,,,,,,complete,,,,3.0,none,,,,,,,4.0,9.84328100930482,,PCA,randomized,,,,,,,,,,,,,,,False,,COMPLETE
434,434,0.9202009670544155,2024-05-01 06:15:40.350685,2024-05-01 06:15:40.619943,0 days 00:00:00.269258,,euclidean,3.0,,,Agglomerative,,,,,,,,,,,,,,,complete,,,,2.0,none,,,,,,,4.0,9.99728256515509,,PCA,randomized,,,,,,,,,,,,,,,False,,COMPLETE
435,435,0.9027885185953454,2024-05-01 06:15:40.620980,2024-05-01 06:15:40.909407,0 days 00:00:00.288427,,euclidean,3.0,,,Agglomerative,,,,,,,,,,,,,,,complete,,,,3.0,none,,,,,,,3.0,9.999322820517088,,PCA,arpack,,,,,,,,,,,,,,,False,,COMPLETE
436,436,0.9516454913654608,2024-05-01 06:15:40.910554,2024-05-01 06:15:41.153320,0 days 00:00:00.242766,,euclidean,2.0,,,Agglomerative,,,,,,,,,,,,,,,complete,,,,2.0,none,,,,,,,3.0,9.716498752279703,,PCA,randomized,,,,,,,,,,,,,,,False,,COMPLETE
437,437,0.9516454913654608,2024-05-01 06:15:41.154148,2024-05-01 06:15:41.414360,0 days 00:00:00.260212,,euclidean,2.0,,,Agglomerative,,,,,,,,,,,,,,,complete,,,,2.0,none,,,,,,,3.0,9.720737872701275,,PCA,randomized,,,,,,,,,,,,,,,False,,COMPLETE
438,438,0.903125576250099,2024-05-01 06:15:41.423229,2024-05-01 06:15:41.656155,0 days 00:00:00.232926,,euclidean,3.0,,,Agglomerative,,,,,,,,,,,,,,,complete,,,,2.0,none,,,,,,,3.0,9.710316089073682,,PCA,randomized,,,,,,,,,,,,,,,False,,COMPLETE
439,439,0.9313268547678085,2024-05-01 06:15:41.656985,2024-05-01 06:15:41.895320,0 days 00:00:00.238335,,euclidean,2.0,,,Agglomerative,,,,,,,,,,,,,,,complete,,,,2.0,none,,,,,,,4.0,6.651027985270798,,PCA,randomized,,,,,,,,,,,,,,,False,,COMPLETE
440,440,0.9365353598376864,2024-05-01 06:15:41.896175,2024-05-01 06:15:42.135664,0 days 00:00:00.239489,,euclidean,2.0,,,Agglomerative,,,,,,,,,,,,,,,complete,,,,2.0,none,,,,,,,3.0,6.774014705587658,,PCA,randomized,,,,,,,,,,,,,,,True,,COMPLETE
441,441,0.9516454913654608,2024-05-01 06:15:42.136503,2024-05-01 06:15:42.407930,0 days 00:00:00.271427,,euclidean,2.0,,,Agglomerative,,,,,,,,,,,,,,,complete,,,,2.0,none,,,,,,,3.0,9.742983104594824,,PCA,randomized,,,,,,,,,,,,,,,False,,COMPLETE
442,442,-1.0,2024-05-01 06:15:42.408771,2024-05-01 06:15:43.910787,0 days 00:00:01.502016,,,,,,OPTICS,,,,,,,,,,,,,,,,1000.0,,,2.0,none,ball_tree,85.0,dbscan,canberra,432.0,,3.0,9.793105256746493,,PCA,randomized,,,,,,,,,,,,,,,False,1.0,COMPLETE
443,443,0.9516454913654608,2024-05-01 06:15:43.911471,2024-05-01 06:15:44.125015,0 days 00:00:00.213544,,euclidean,2.0,,,Agglomerative,,,,,,,,,,,,,,,complete,,,,2.0,none,,,,,,,3.0,9.870036244318722,,PCA,randomized,,,,,,,,,,,,,,,False,,COMPLETE
444,444,0.6942604508938369,2024-05-01 06:15:44.125851,2024-05-01 06:15:44.278472,0 days 00:00:00.152621,,,,,,KMeans,,,,,,,,,,lloyd,k-means++,5.0,,0.1,,,,,2.0,none,,,,,,,3.0,9.99943224236297,,PCA,randomized,,,,,,,,,,,,,,,False,,COMPLETE
445,445,0.9031094187189573,2024-05-01 06:15:44.279489,2024-05-01 06:15:44.580468,0 days 00:00:00.300979,,euclidean,3.0,,,Agglomerative,,,,,,,,,,,,,,,complete,,,,19.0,none,,,,,,,4.0,9.830928987041723,,PCA,randomized,,,,,,,,,,,,,,,False,,COMPLETE
446,446,0.4278850853443146,2024-05-01 06:15:44.581523,2024-05-01 06:15:54.257834,0 days 00:00:09.676311,,euclidean,8.0,,,Agglomerative,,,,,,,,,,,,,,,complete,,0.05,,,,,,,,,,,,,UMAP,,,,,,,,,,,,,cosine,7.0,202.0,,,COMPLETE
447,447,0.9516454913654608,2024-05-01 06:15:54.258746,2024-05-01 06:15:54.513424,0 days 00:00:00.254678,,euclidean,2.0,,,Agglomerative,,,,,,,,,,,,,,,complete,,,,2.0,none,,,,,,,3.0,9.623153978313066,,PCA,randomized,,,,,,,,,,,,,,,False,,COMPLETE
448,448,0.903125576250099,2024-05-01 06:15:54.514308,2024-05-01 06:15:54.757753,0 days 00:00:00.243445,,euclidean,3.0,,,Agglomerative,,,,,,,,,,,,,,,complete,,,,2.0,none,,,,,,,3.0,9.57733390207656,,PCA,randomized,,,,,,,,,,,,,,,False,,COMPLETE
449,449,0.9313268547678085,2024-05-01 06:15:54.758634,2024-05-01 06:15:54.992761,0 days 00:00:00.234127,,euclidean,2.0,,,Agglomerative,,,,,,,,,,,,,,,complete,,,,2.0,none,,,,,,,4.0,9.60667101525015,,PCA,randomized,,,,,,,,,,,,,,,False,,COMPLETE
450,450,0.9516454913654608,2024-05-01 06:15:54.994011,2024-05-01 06:15:55.226921,0 days 00:00:00.232910,,euclidean,2.0,,,Agglomerative,,,,,,,,,,,,,,,complete,,,,2.0,none,,,,,,,3.0,9.872594961192569,,PCA,randomized,,,,,,,,,,,,,,,False,,COMPLETE
451,451,-1.0,2024-05-01 06:15:55.228009,2024-05-01 06:15:55.436632,0 days 00:00:00.208623,nearest_neighbors,,,,cluster_qr,Spectral,51.093868273531726,4.0,amg,,,,,,,,,,,,,,,,2.0,none,,,,,,,3.0,9.729680501466119,,PCA,randomized,18.0,1.6,16.0,8.0,297.0,,,,,,,,,,False,,COMPLETE
452,452,0.37329918146133423,2024-05-01 06:15:55.437531,2024-05-01 06:16:07.323539,0 days 00:00:11.886008,,euclidean,2.0,,,Agglomerative,,,,,,,,,,,,,,,complete,,,,,,,,,,,,,,37.432370987780835,t-SNE,,,,,,,15.024336041835602,pca,50.0,barnes_hut,canberra,2.0,,,,,,COMPLETE
453,453,0.903125576250099,2024-05-01 06:16:07.324391,2024-05-01 06:16:07.562126,0 days 00:00:00.237735,,euclidean,3.0,,,Agglomerative,,,,,,,,,,,,,,,complete,,,,2.0,none,,,,,,,3.0,9.991760913028855,,PCA,randomized,,,,,,,,,,,,,,,False,,COMPLETE
454,454,0.9516454913654608,2024-05-01 06:16:07.563222,2024-05-01 06:16:07.802701,0 days 00:00:00.239479,,euclidean,2.0,,,Agglomerative,,,,,,,,,,,,,,,average,,,,2.0,none,,,,,,,3.0,9.473613442758696,,PCA,randomized,,,,,,,,,,,,,,,False,,COMPLETE
455,455,0.5971417815788643,2024-05-01 06:16:07.803835,2024-05-01 06:16:08.077987,0 days 00:00:00.274152,,cosine,2.0,,,Agglomerative,,,,,,,,,,,,,,,average,,,,2.0,none,,,,,,,3.0,9.3430969667994,,PCA,randomized,,,,,,,,,,,,,,,False,,COMPLETE
456,456,0.9516454913654608,2024-05-01 06:16:08.078873,2024-05-01 06:16:08.384612,0 days 00:00:00.305739,,euclidean,2.0,,,Agglomerative,,,,,,,,,,,,,,,complete,,,,2.0,none,,,,,,,3.0,9.814957577276095,,PCA,randomized,,,,,,,,,,,,,,,False,,COMPLETE
457,457,0.9516454913654608,2024-05-01 06:16:08.385454,2024-05-01 06:16:08.619650,0 days 00:00:00.234196,,euclidean,2.0,,,Agglomerative,,,,,,,,,,,,,,,average,,,,2.0,none,,,,,,,3.0,9.559393304609005,,PCA,randomized,,,,,,,,,,,,,,,False,,COMPLETE
458,458,-1.0,2024-05-01 06:16:08.620684,2024-05-01 06:16:08.850454,0 days 00:00:00.229770,,,,3.1,,HDBSCAN,,,,4.6000000000000005,ball_tree,85.0,leaf,hamming,437.0,,,,,,,,,86.0,2.0,none,,,,,,,3.0,9.470620590689064,,PCA,randomized,,,,,,,,,,,,,,,False,,COMPLETE
459,459,0.9408074139129966,2024-05-01 06:16:08.851101,2024-05-01 06:16:09.060778,0 days 00:00:00.209677,,euclidean,2.0,,,Agglomerative,,,,,,,,,,,,,,,average,,,,2.0,none,,,,,,,4.0,9.587382468323407,,PCA,arpack,,,,,,,,,,,,,,,False,,COMPLETE
460,460,0.909350602576147,2024-05-01 06:16:09.061612,2024-05-01 06:16:09.318103,0 days 00:00:00.256491,,euclidean,3.0,,,Agglomerative,,,,,,,,,,,,,,,average,,,,2.0,none,,,,,,,3.0,9.843917777446507,,PCA,randomized,,,,,,,,,,,,,,,False,,COMPLETE
461,461,0.9516454913654608,2024-05-01 06:16:09.318952,2024-05-01 06:16:09.561116,0 days 00:00:00.242164,,euclidean,2.0,,,Agglomerative,,,,,,,,,,,,,,,average,,,,2.0,none,,,,,,,3.0,9.150145098647265,,PCA,randomized,,,,,,,,,,,,,,,False,,COMPLETE
462,462,0.9470230812782723,2024-05-01 06:16:09.562006,2024-05-01 06:16:09.803845,0 days 00:00:00.241839,,euclidean,3.0,,,Agglomerative,,,,,,,,,,,,,,,average,,,,2.0,none,,,,,,,3.0,9.076229119517981,,PCA,randomized,,,,,,,,,,,,,,,True,,COMPLETE
463,463,0.9516454913654608,2024-05-01 06:16:09.804711,2024-05-01 06:16:10.092251,0 days 00:00:00.287540,,euclidean,2.0,,,Agglomerative,,,,,,,,,,,,,,,average,,,,2.0,none,,,,,,,3.0,9.140949974006407,,PCA,randomized,,,,,,,,,,,,,,,False,,COMPLETE
464,464,0.9516454913654608,2024-05-01 06:16:10.093093,2024-05-01 06:16:10.370481,0 days 00:00:00.277388,,euclidean,2.0,,,Agglomerative,,,,,,,,,,,,,,,average,,,,2.0,none,,,,,,,3.0,9.182749448494954,,PCA,randomized,,,,,,,,,,,,,,,False,,COMPLETE
465,465,0.9516454913654608,2024-05-01 06:16:10.371559,2024-05-01 06:16:10.614389,0 days 00:00:00.242830,,euclidean,2.0,,,Agglomerative,,,,,,,,,,,,,,,average,,,,2.0,none,,,,,,,3.0,8.768409467902371,,PCA,randomized,,,,,,,,,,,,,,,False,,COMPLETE
466,466,0.909350602576147,2024-05-01 06:16:10.615801,2024-05-01 06:16:10.860567,0 days 00:00:00.244766,,euclidean,3.0,,,Agglomerative,,,,,,,,,,,,,,,average,,,,2.0,none,,,,,,,3.0,8.97109994677486,,PCA,randomized,,,,,,,,,,,,,,,False,,COMPLETE
467,467,0.9409883201893787,2024-05-01 06:16:10.861396,2024-05-01 06:16:11.194586,0 days 00:00:00.333190,,euclidean,2.0,,,Agglomerative,,,,,,,,,,,,,,,average,,,,2.0,none,,,,,,,4.0,9.376536278820929,,PCA,randomized,,,,,,,,,,,,,,,False,,COMPLETE
468,468,0.9516454913654608,2024-05-01 06:16:11.195440,2024-05-01 06:16:11.433963,0 days 00:00:00.238523,,euclidean,2.0,,,Agglomerative,,,,,,,,,,,,,,,average,,,,2.0,none,,,,,,,3.0,8.708456992096982,,PCA,randomized,,,,,,,,,,,,,,,False,,COMPLETE
469,469,-1.0,2024-05-01 06:16:11.434795,2024-05-01 06:16:22.833606,0 days 00:00:11.398811,,,,,,OPTICS,,,,,,,,,,,,,,,,10.0,0.30000000000000004,,,,auto,25.0,xi,l2,67.0,,,,,UMAP,,,,,,,,,,,,,dice,3.0,367.0,,0.15000000000000002,COMPLETE
470,470,0.9516454913654608,2024-05-01 06:16:22.834283,2024-05-01 06:16:23.050520,0 days 00:00:00.216237,,euclidean,2.0,,,Agglomerative,,,,,,,,,,,,,,,average,,,,2.0,none,,,,,,,3.0,8.80765280269254,,PCA,randomized,,,,,,,,,,,,,,,False,,COMPLETE
471,471,0.909350602576147,2024-05-01 06:16:23.051629,2024-05-01 06:16:23.292109,0 days 00:00:00.240480,,euclidean,3.0,,,Agglomerative,,,,,,,,,,,,,,,average,,,,2.0,none,,,,,,,3.0,8.557845730911122,,PCA,randomized,,,,,,,,,,,,,,,False,,COMPLETE
472,472,0.9409883201893787,2024-05-01 06:16:23.293150,2024-05-01 06:16:23.575722,0 days 00:00:00.282572,,euclidean,2.0,,,Agglomerative,,,,,,,,,,,,,,,average,,,,2.0,none,,,,,,,4.0,8.766688114996095,,PCA,randomized,,,,,,,,,,,,,,,False,,COMPLETE
473,473,0.8984758186193333,2024-05-01 06:16:23.577067,2024-05-01 06:16:23.818814,0 days 00:00:00.241747,,euclidean,4.0,,,Agglomerative,,,,,,,,,,,,,,,average,,,,2.0,none,,,,,,,3.0,9.14482320548223,,PCA,randomized,,,,,,,,,,,,,,,False,,COMPLETE
474,474,0.9516454913654608,2024-05-01 06:16:23.819945,2024-05-01 06:16:24.070114,0 days 00:00:00.250169,,euclidean,2.0,,,Agglomerative,,,,,,,,,,,,,,,average,,,,2.0,none,,,,,,,3.0,8.613907798043408,,PCA,randomized,,,,,,,,,,,,,,,False,,COMPLETE
475,475,0.5203473766370711,2024-05-01 06:16:24.070948,2024-05-01 06:16:24.275808,0 days 00:00:00.204860,,,,,,KMeans,,,,,,,,,,lloyd,random,11.0,15.0,1.0,,,,,2.0,none,,,,,,,3.0,8.690826227828325,,PCA,randomized,,,,,,,,,,,,,,,False,,COMPLETE
476,476,-1.0,2024-05-01 06:16:24.276887,2024-05-01 06:16:24.364037,0 days 00:00:00.087150,,euclidean,3.0,,,Agglomerative,,,,,,,,,,,,,,,average,,,,,,,,,,,,,,28.885734358241375,t-SNE,,,,,,,17.902274235646033,pca,40.0,barnes_hut,wminkowski,2.0,,,,,,COMPLETE
477,477,0.9516454913654608,2024-05-01 06:16:24.364534,2024-05-01 06:16:24.630610,0 days 00:00:00.266076,,euclidean,2.0,,,Agglomerative,,,,,,,,,,,,,,,average,,,,2.0,none,,,,,,,3.0,8.845491174438726,,PCA,randomized,,,,,,,,,,,,,,,False,,COMPLETE
478,478,0.9516454913654608,2024-05-01 06:16:24.631724,2024-05-01 06:16:24.927787,0 days 00:00:00.296063,,euclidean,2.0,,,Agglomerative,,,,,,,,,,,,,,,average,,,,2.0,none,,,,,,,3.0,8.842175771692562,,PCA,randomized,,,,,,,,,,,,,,,False,,COMPLETE
479,479,-1.0,2024-05-01 06:16:24.928791,2024-05-01 06:16:25.048673,0 days 00:00:00.119882,precomputed_nearest_neighbors,,,,kmeans,Spectral,13.691120970202562,3.0,lobpcg,,,,,,,,,,,,,,,,2.0,none,,,,,,,3.0,8.894741666046995,,PCA,randomized,4.0,8.6,18.0,18.0,52.0,,,,,,,,,,False,,COMPLETE
480,480,0.909350602576147,2024-05-01 06:16:25.049507,2024-05-01 06:16:25.337246,0 days 00:00:00.287739,,euclidean,3.0,,,Agglomerative,,,,,,,,,,,,,,,average,,,,2.0,none,,,,,,,3.0,8.69535138302171,,PCA,randomized,,,,,,,,,,,,,,,False,,COMPLETE
481,481,0.9516454913654608,2024-05-01 06:16:25.343516,2024-05-01 06:16:25.613991,0 days 00:00:00.270475,,euclidean,2.0,,,Agglomerative,,,,,,,,,,,,,,,average,,,,2.0,none,,,,,,,3.0,8.737899226905386,,PCA,randomized,,,,,,,,,,,,,,,False,,COMPLETE
482,482,0.9409883201893787,2024-05-01 06:16:25.615080,2024-05-01 06:16:25.869593,0 days 00:00:00.254513,,euclidean,2.0,,,Agglomerative,,,,,,,,,,,,,,,average,,,,2.0,none,,,,,,,4.0,8.414854842078856,,PCA,randomized,,,,,,,,,,,,,,,False,,COMPLETE
483,483,0.5971417815788643,2024-05-01 06:16:25.871383,2024-05-01 06:16:26.139788,0 days 00:00:00.268405,,cosine,2.0,,,Agglomerative,,,,,,,,,,,,,,,average,,,,2.0,none,,,,,,,3.0,9.019248354491879,,PCA,randomized,,,,,,,,,,,,,,,False,,COMPLETE
484,484,0.9408074139129966,2024-05-01 06:16:26.140634,2024-05-01 06:16:26.373678,0 days 00:00:00.233044,,euclidean,2.0,,,Agglomerative,,,,,,,,,,,,,,,average,,,,2.0,none,,,,,,,4.0,8.857450027434565,,PCA,arpack,,,,,,,,,,,,,,,False,,COMPLETE
485,485,0.9470230812782723,2024-05-01 06:16:26.374560,2024-05-01 06:16:26.673883,0 days 00:00:00.299323,,euclidean,3.0,,,Agglomerative,,,,,,,,,,,,,,,average,,,,2.0,none,,,,,,,3.0,8.524785959204563,,PCA,randomized,,,,,,,,,,,,,,,True,,COMPLETE
486,486,-1.0,2024-05-01 06:16:26.674745,2024-05-01 06:16:26.793635,0 days 00:00:00.118890,,,,6.8,,HDBSCAN,,,,6.4,auto,70.0,eom,mahalanobis,327.0,,,,,,,,,160.0,2.0,none,,,,,,,3.0,9.176153241425023,,PCA,randomized,,,,,,,,,,,,,,,False,,COMPLETE
487,487,0.9409843377279941,2024-05-01 06:16:26.794339,2024-05-01 06:16:27.080307,0 days 00:00:00.285968,,euclidean,2.0,,,Agglomerative,,,,,,,,,,,,,,,average,,,,14.0,none,,,,,,,3.0,9.251758889655953,,PCA,randomized,,,,,,,,,,,,,,,False,,COMPLETE
488,488,0.909350602576147,2024-05-01 06:16:27.081173,2024-05-01 06:16:27.322405,0 days 00:00:00.241232,,euclidean,3.0,,,Agglomerative,,,,,,,,,,,,,,,average,,,,2.0,none,,,,,,,3.0,8.815033323260248,,PCA,randomized,,,,,,,,,,,,,,,False,,COMPLETE
489,489,0.9409883201893787,2024-05-01 06:16:27.323475,2024-05-01 06:16:27.610357,0 days 00:00:00.286882,,euclidean,2.0,,,Agglomerative,,,,,,,,,,,,,,,average,,,,2.0,none,,,,,,,4.0,9.113740665089544,,PCA,randomized,,,,,,,,,,,,,,,False,,COMPLETE
490,490,0.9409919273550493,2024-05-01 06:16:27.611439,2024-05-01 06:16:27.883593,0 days 00:00:00.272154,,euclidean,2.0,,,Agglomerative,,,,,,,,,,,,,,,average,,,,1.0,none,,,,,,,3.0,8.652265236831326,,PCA,randomized,,,,,,,,,,,,,,,False,,COMPLETE
491,491,0.9516454913654608,2024-05-01 06:16:27.884753,2024-05-01 06:16:28.126106,0 days 00:00:00.241353,,euclidean,2.0,,,Agglomerative,,,,,,,,,,,,,,,average,,,,2.0,none,,,,,,,3.0,8.923390283392884,,PCA,randomized,,,,,,,,,,,,,,,False,,COMPLETE
492,492,0.7964585582446276,2024-05-01 06:16:28.126965,2024-05-01 06:16:28.364636,0 days 00:00:00.237671,,euclidean,6.0,,,Agglomerative,,,,,,,,,,,,,,,average,,,,1.0,none,,,,,,,4.0,9.426660564031055,,PCA,randomized,,,,,,,,,,,,,,,False,,COMPLETE
493,493,-1.0,2024-05-01 06:16:28.365511,2024-05-01 06:16:28.505904,0 days 00:00:00.140393,,euclidean,3.0,,,Agglomerative,,,,,,,,,,,,,,,average,,0.9,,,,,,,,,,,,,UMAP,,,,,,,,,,,,,haversine,20.0,142.0,,,COMPLETE
494,494,0.9516454913654608,2024-05-01 06:16:28.506697,2024-05-01 06:16:28.733662,0 days 00:00:00.226965,,euclidean,2.0,,,Agglomerative,,,,,,,,,,,,,,,average,,,,2.0,none,,,,,,,3.0,9.224128361638266,,PCA,randomized,,,,,,,,,,,,,,,False,,COMPLETE
495,495,0.9516454913654608,2024-05-01 06:16:28.734542,2024-05-01 06:16:29.022818,0 days 00:00:00.288276,,euclidean,2.0,,,Agglomerative,,,,,,,,,,,,,,,average,,,,2.0,none,,,,,,,3.0,8.452184936457561,,PCA,randomized,,,,,,,,,,,,,,,False,,COMPLETE
496,496,0.9279692571854983,2024-05-01 06:16:29.023718,2024-05-01 06:16:29.266004,0 days 00:00:00.242286,,euclidean,3.0,,,Agglomerative,,,,,,,,,,,,,,,average,,,,1.0,none,,,,,,,3.0,9.02916062910152,,PCA,randomized,,,,,,,,,,,,,,,False,,COMPLETE
497,497,-1.0,2024-05-01 06:16:29.266877,2024-05-01 06:16:30.784862,0 days 00:00:01.517985,,,,,,OPTICS,,,,,,,,,,,,,,,,10000.0,,,2.0,none,ball_tree,55.0,xi,hamming,232.0,,4.0,9.368224097214751,,PCA,randomized,,,,,,,,,,,,,,,False,0.35000000000000003,COMPLETE
498,498,0.8221326872623386,2024-05-01 06:16:30.785552,2024-05-01 06:16:31.045102,0 days 00:00:00.259550,,euclidean,5.0,,,Agglomerative,,,,,,,,,,,,,,,average,,,,1.0,none,,,,,,,3.0,8.800246095203743,,PCA,randomized,,,,,,,,,,,,,,,False,,COMPLETE
499,499,0.07365913689136505,2024-05-01 06:16:31.051067,2024-05-01 06:19:10.731709,0 days 00:02:39.680642,,,,,,KMeans,,,,,,,,,,elkan,k-means++,15.0,,0.1,,,,,,,,,,,,,,,45.825649253586704,t-SNE,,,,,,,9.929458527495372,random,20.0,exact,seuclidean,12.0,,,,,,COMPLETE
500,500,0.9516454913654608,2024-05-01 06:19:10.732626,2024-05-01 06:19:10.983419,0 days 00:00:00.250793,,euclidean,2.0,,,Agglomerative,,,,,,,,,,,,,,,average,,,,2.0,none,,,,,,,3.0,9.550595527861717,,PCA,randomized,,,,,,,,,,,,,,,False,,COMPLETE
501,501,0.9516454908965979,2024-05-01 06:19:10.984511,2024-05-01 06:19:11.264128,0 days 00:00:00.279617,,euclidean,2.0,,,Agglomerative,,,,,,,,,,,,,,,average,,,,1.0,none,,,,,,,4.0,9.269271661195393,,PCA,randomized,,,,,,,,,,,,,,,False,,COMPLETE
502,502,0.909350602576147,2024-05-01 06:19:11.265217,2024-05-01 06:19:11.568978,0 days 00:00:00.303761,,euclidean,3.0,,,Agglomerative,,,,,,,,,,,,,,,average,,,,2.0,none,,,,,,,3.0,9.015288326783423,,PCA,randomized,,,,,,,,,,,,,,,False,,COMPLETE
503,503,0.9516454913654608,2024-05-01 06:19:11.569832,2024-05-01 06:19:11.858105,0 days 00:00:00.288273,,euclidean,2.0,,,Agglomerative,,,,,,,,,,,,,,,average,,,,2.0,none,,,,,,,3.0,8.573674955083549,,PCA,randomized,,,,,,,,,,,,,,,False,,COMPLETE
504,504,0.9409878399453685,2024-05-01 06:19:11.858953,2024-05-01 06:19:12.109377,0 days 00:00:00.250424,,euclidean,2.0,,,Agglomerative,,,,,,,,,,,,,,,average,,,,8.0,none,,,,,,,3.0,9.555952662012162,,PCA,randomized,,,,,,,,,,,,,,,False,,COMPLETE
505,505,0.9516454908965979,2024-05-01 06:19:12.110437,2024-05-01 06:19:12.411900,0 days 00:00:00.301463,,euclidean,2.0,,,Agglomerative,,,,,,,,,,,,,,,average,,,,1.0,none,,,,,,,4.0,9.249125708127062,,PCA,randomized,,,,,,,,,,,,,,,False,,COMPLETE
506,506,-1.0,2024-05-01 06:19:12.413008,2024-05-01 06:19:12.532142,0 days 00:00:00.119134,precomputed_nearest_neighbors,,,,discretize,Spectral,89.67141198311384,2.0,arpack,,,,,,,,,,,,,,,,2.0,none,,,,,,,3.0,8.721246428600613,,PCA,randomized,12.0,5.1,10.0,4.0,167.0,,,,,,,,,,True,,COMPLETE
507,507,0.951501073393289,2024-05-01 06:19:12.532877,2024-05-01 06:19:12.785585,0 days 00:00:00.252708,,euclidean,2.0,,,Agglomerative,,,,,,,,,,,,,,,average,,,,1.0,none,,,,,,,3.0,9.497970830767008,,PCA,arpack,,,,,,,,,,,,,,,False,,COMPLETE
508,508,0.927964590138478,2024-05-01 06:19:12.786657,2024-05-01 06:19:13.035126,0 days 00:00:00.248469,,euclidean,3.0,,,Agglomerative,,,,,,,,,,,,,,,average,,,,2.0,none,,,,,,,4.0,8.986766714265222,,PCA,randomized,,,,,,,,,,,,,,,False,,COMPLETE
509,509,0.9516454913654608,2024-05-01 06:19:13.036177,2024-05-01 06:19:13.277030,0 days 00:00:00.240853,,euclidean,2.0,,,Agglomerative,,,,,,,,,,,,,,,average,,,,2.0,none,,,,,,,3.0,9.741170771908067,,PCA,randomized,,,,,,,,,,,,,,,False,,COMPLETE
510,510,0.6091847080134138,2024-05-01 06:19:13.277881,2024-05-01 06:19:13.511520,0 days 00:00:00.233639,,euclidean,19.0,,,Agglomerative,,,,,,,,,,,,,,,average,,,,1.0,none,,,,,,,3.0,9.330869354476386,,PCA,randomized,,,,,,,,,,,,,,,False,,COMPLETE
511,511,0.9516454913654608,2024-05-01 06:19:13.512397,2024-05-01 06:19:13.839652,0 days 00:00:00.327255,,euclidean,2.0,,,Agglomerative,,,,,,,,,,,,,,,average,,,,2.0,none,,,,,,,3.0,9.710706451438758,,PCA,randomized,,,,,,,,,,,,,,,False,,COMPLETE
512,512,0.9093506015986997,2024-05-01 06:19:13.840732,2024-05-01 06:19:14.088227,0 days 00:00:00.247495,,euclidean,3.0,,,Agglomerative,,,,,,,,,,,,,,,average,,,,1.0,none,,,,,,,4.0,9.105579393427226,,PCA,randomized,,,,,,,,,,,,,,,False,,COMPLETE
513,513,0.9516454913654608,2024-05-01 06:19:14.089090,2024-05-01 06:19:14.341365,0 days 00:00:00.252275,,euclidean,2.0,,,Agglomerative,,,,,,,,,,,,,,,average,,,,2.0,none,,,,,,,3.0,8.808958074447707,,PCA,randomized,,,,,,,,,,,,,,,False,,COMPLETE
514,514,-1.0,2024-05-01 06:19:14.342505,2024-05-01 06:19:14.463309,0 days 00:00:00.120804,,,,4.7,,HDBSCAN,,,,9.700000000000001,brute,45.0,leaf,sqeuclidean,162.0,,,,,,,,,120.0,1.0,none,,,,,,,4.0,8.550177687517577,,PCA,randomized,,,,,,,,,,,,,,,False,,COMPLETE
