,number,value,datetime_start,datetime_complete,duration,params_affinity,params_agglo_metric,params_agglo_n,params_alpha,params_assign_lables,params_clusterer,params_coef0,params_degree,params_eigen_solver,params_epsilon,params_hdbscan_algo,params_hdbscan_leaf_size,params_hdbscan_method,params_hdbscan_metric,params_hdbscan_n,params_kmeans_algo,params_kmeans_init,params_kmeans_n,params_kmeans_n_init,params_kmeans_tol,params_linkage,params_max_eps,params_min_dist,params_min_samples,params_n_oversamples,params_normalizer,params_optics_algo,params_optics_leaf_size,params_optics_method,params_optics_metric,params_optics_n,params_p,params_pca_n,params_pca_tol,params_perplexity,params_reducer,params_solver,params_spec_cluster,params_spec_gamma,params_spec_n,params_spec_n_init,params_spec_n_neighbors,params_tightness,params_tsne_init,params_tsne_lr,params_tsne_method,params_tsne_metric,params_tsne_n,params_umap_metric,params_umap_n,params_umap_n_neighbors,params_whiten,params_xi,state
773,773,0.9510694119347141,2024-05-01 06:52:12.538596,2024-05-01 06:52:12.790561,0 days 00:00:00.251965,,manhattan,2.0,,,Agglomerative,,,,,,,,,,,,,,,average,,,,2.0,none,,,,,,,3.0,9.993321661386979,,PCA,randomized,,,,,,,,,,,,,,,True,,COMPLETE
774,774,0.8881362060495269,2024-05-01 06:52:12.791588,2024-05-01 06:52:13.045942,0 days 00:00:00.254354,,,2.0,,,Agglomerative,,,,,,,,,,,,,,,ward,,,,1.0,none,,,,,,,4.0,9.052885198588886,,PCA,randomized,,,,,,,,,,,,,,,True,,COMPLETE
775,775,-1.0,2024-05-01 06:52:13.046930,2024-05-01 06:52:13.189504,0 days 00:00:00.142574,precomputed,,,,discretize,Spectral,91.96250100152476,1.0,arpack,,,,,,,,,,,,,,,,1.0,none,,,,,,,3.0,9.472865357250832,,PCA,randomized,10.0,9.6,14.0,11.0,367.0,,,,,,,,,,True,,COMPLETE
776,776,0.885087433152021,2024-05-01 06:52:13.190287,2024-05-01 06:52:13.458441,0 days 00:00:00.268154,,manhattan,2.0,,,Agglomerative,,,,,,,,,,,,,,,average,,,,2.0,QR,,,,,,,3.0,9.77251422509282,,PCA,randomized,,,,,,,,,,,,,,,True,,COMPLETE
777,777,0.9472133311895985,2024-05-01 06:52:13.459936,2024-05-01 06:52:13.776612,0 days 00:00:00.316676,,manhattan,2.0,,,Agglomerative,,,,,,,,,,,,,,,average,,,,1.0,none,,,,,,,4.0,9.240461625315554,,PCA,randomized,,,,,,,,,,,,,,,True,,COMPLETE
778,778,0.9532357462135064,2024-05-01 06:52:13.777786,2024-05-01 06:52:14.103665,0 days 00:00:00.325879,,manhattan,2.0,,,Agglomerative,,,,,,,,,,,,,,,average,,,,1.0,none,,,,,,,3.0,9.625907817060792,,PCA,randomized,,,,,,,,,,,,,,,True,,COMPLETE
779,779,0.9510694119347141,2024-05-01 06:52:14.104878,2024-05-01 06:52:14.369420,0 days 00:00:00.264542,,manhattan,2.0,,,Agglomerative,,,,,,,,,,,,,,,average,,,,2.0,none,,,,,,,3.0,9.823920675301816,,PCA,randomized,,,,,,,,,,,,,,,True,,COMPLETE
780,780,0.4137947058244148,2024-05-01 06:52:14.370459,2024-05-01 06:52:14.611235,0 days 00:00:00.240776,,cosine,2.0,,,Agglomerative,,,,,,,,,,,,,,,average,,,,1.0,none,,,,,,,3.0,9.998809721118372,,PCA,randomized,,,,,,,,,,,,,,,True,,COMPLETE
781,781,0.9510694119347141,2024-05-01 06:52:14.612280,2024-05-01 06:52:14.865586,0 days 00:00:00.253306,,manhattan,2.0,,,Agglomerative,,,,,,,,,,,,,,,average,,,,2.0,none,,,,,,,3.0,9.410347333157658,,PCA,randomized,,,,,,,,,,,,,,,True,,COMPLETE
782,782,0.9472133311895985,2024-05-01 06:52:14.866582,2024-05-01 06:52:15.121731,0 days 00:00:00.255149,,manhattan,2.0,,,Agglomerative,,,,,,,,,,,,,,,average,,,,1.0,none,,,,,,,4.0,9.604266898995071,,PCA,randomized,,,,,,,,,,,,,,,True,,COMPLETE
783,783,0.9532357462135064,2024-05-01 06:52:15.122990,2024-05-01 06:52:15.412445,0 days 00:00:00.289455,,manhattan,2.0,,,Agglomerative,,,,,,,,,,,,,,,average,,,,1.0,none,,,,,,,3.0,9.77637502568862,,PCA,randomized,,,,,,,,,,,,,,,True,,COMPLETE
784,784,0.9532357462135064,2024-05-01 06:52:15.413644,2024-05-01 06:52:15.664639,0 days 00:00:00.250995,,manhattan,2.0,,,Agglomerative,,,,,,,,,,,,,,,average,,,,1.0,none,,,,,,,3.0,9.37605538658495,,PCA,randomized,,,,,,,,,,,,,,,True,,COMPLETE
785,785,-1.0,2024-05-01 06:52:15.665844,2024-05-01 06:52:15.810301,0 days 00:00:00.144457,,,,8.9,,HDBSCAN,,,,2.2,kd_tree,100.0,leaf,dice,232.0,,,,,,,,,20.0,2.0,none,,,,,,,4.0,9.142164651941016,,PCA,randomized,,,,,,,,,,,,,,,True,,COMPLETE
786,786,0.9472133311895985,2024-05-01 06:52:15.811938,2024-05-01 06:52:16.112086,0 days 00:00:00.300148,,manhattan,2.0,,,Agglomerative,,,,,,,,,,,,,,,average,,,,1.0,none,,,,,,,4.0,9.566698485280194,,PCA,randomized,,,,,,,,,,,,,,,True,,COMPLETE
787,787,0.3110695779323578,2024-05-01 06:52:16.113115,2024-05-01 06:52:27.306202,0 days 00:00:11.193087,,manhattan,2.0,,,Agglomerative,,,,,,,,,,,,,,,average,,0.35000000000000003,,,,,,,,,,,,,UMAP,,,,,,,,,,,,,rogerstanimoto,12.0,277.0,,,COMPLETE
788,788,0.9532357462135064,2024-05-01 06:52:27.307211,2024-05-01 06:52:27.592610,0 days 00:00:00.285399,,manhattan,2.0,,,Agglomerative,,,,,,,,,,,,,,,average,,,,1.0,none,,,,,,,3.0,9.793425028315824,,PCA,randomized,,,,,,,,,,,,,,,True,,COMPLETE
789,789,0.9510694119347141,2024-05-01 06:52:27.593822,2024-05-01 06:52:27.844588,0 days 00:00:00.250766,,manhattan,2.0,,,Agglomerative,,,,,,,,,,,,,,,average,,,,2.0,none,,,,,,,3.0,9.457074922469443,,PCA,randomized,,,,,,,,,,,,,,,True,,COMPLETE
790,790,0.9472133311895985,2024-05-01 06:52:27.845603,2024-05-01 06:52:28.094476,0 days 00:00:00.248873,,manhattan,2.0,,,Agglomerative,,,,,,,,,,,,,,,average,,,,1.0,none,,,,,,,4.0,9.9952513978608,,PCA,randomized,,,,,,,,,,,,,,,True,,COMPLETE
791,791,-1.0,2024-05-01 06:52:28.095505,2024-05-01 06:52:29.609202,0 days 00:00:01.513697,,,,,,OPTICS,,,,,,,,,,,,,,,,10000.0,,,1.0,none,ball_tree,50.0,dbscan,l1,47.0,,3.0,9.663039377347161,,PCA,randomized,,,,,,,,,,,,,,,True,0.9,COMPLETE
792,792,0.9532357462135064,2024-05-01 06:52:29.610098,2024-05-01 06:52:29.841982,0 days 00:00:00.231884,,manhattan,2.0,,,Agglomerative,,,,,,,,,,,,,,,average,,,,1.0,none,,,,,,,3.0,9.260985456732671,,PCA,randomized,,,,,,,,,,,,,,,True,,COMPLETE
793,793,0.1415962278842926,2024-05-01 06:52:29.843018,2024-05-01 06:56:26.561975,0 days 00:03:56.718957,,manhattan,2.0,,,Agglomerative,,,,,,,,,,,,,,,average,,,,,,,,,,,,,,43.31283404331302,t-SNE,,,,,,,5.8529301719269275,random,30.0,exact,l2,18.0,,,,,,COMPLETE
794,794,0.7838755724000561,2024-05-01 06:56:26.563251,2024-05-01 06:56:26.748667,0 days 00:00:00.185416,,,,,,KMeans,,,,,,,,,,lloyd,k-means++,9.0,,0.001,,,,,2.0,none,,,,,,,3.0,9.81894272693241,,PCA,randomized,,,,,,,,,,,,,,,True,,COMPLETE
795,795,0.9251483978905561,2024-05-01 06:56:26.749880,2024-05-01 06:56:27.089608,0 days 00:00:00.339728,,manhattan,2.0,,,Agglomerative,,,,,,,,,,,,,,,average,,,,1.0,none,,,,,,,10.0,9.52489023216613,,PCA,randomized,,,,,,,,,,,,,,,True,,COMPLETE
796,796,0.8037629470778751,2024-05-01 06:56:27.090612,2024-05-01 06:56:27.348472,0 days 00:00:00.257860,,manhattan,17.0,,,Agglomerative,,,,,,,,,,,,,,,average,,,,2.0,none,,,,,,,3.0,9.793497654075411,,PCA,randomized,,,,,,,,,,,,,,,True,,COMPLETE
797,797,0.8547519566331472,2024-05-01 06:56:27.349477,2024-05-01 06:56:27.650968,0 days 00:00:00.301491,,manhattan,2.0,,,Agglomerative,,,,,,,,,,,,,,,average,,,,1.0,none,,,,,,,5.0,9.995559476235872,,PCA,arpack,,,,,,,,,,,,,,,True,,COMPLETE
798,798,0.9472133311895985,2024-05-01 06:56:27.652972,2024-05-01 06:56:27.900038,0 days 00:00:00.247066,,manhattan,2.0,,,Agglomerative,,,,,,,,,,,,,,,average,,,,1.0,none,,,,,,,4.0,9.656326485367492,,PCA,randomized,,,,,,,,,,,,,,,True,,COMPLETE
799,799,0.6893597852495075,2024-05-01 06:56:27.901090,2024-05-01 06:56:28.224779,0 days 00:00:00.323689,,manhattan,2.0,,,Agglomerative,,,,,,,,,,,,,,,average,,,,1.0,QR,,,,,,,13.0,9.028883018198139,,PCA,randomized,,,,,,,,,,,,,,,True,,COMPLETE
800,800,0.9365353598376864,2024-05-01 06:56:28.225767,2024-05-01 06:56:28.481556,0 days 00:00:00.255789,,,2.0,,,Agglomerative,,,,,,,,,,,,,,,ward,,,,2.0,none,,,,,,,3.0,9.38580332662147,,PCA,randomized,,,,,,,,,,,,,,,True,,COMPLETE
801,801,-1.0,2024-05-01 06:56:28.482543,2024-05-01 06:56:28.750735,0 days 00:00:00.268192,rbf,,,,cluster_qr,Spectral,70.12161705713984,5.0,amg,,,,,,,,,,,,,,,,2.0,none,,,,,,,3.0,9.802967500316344,,PCA,randomized,15.0,5.1,2.0,19.0,22.0,,,,,,,,,,True,,COMPLETE
802,802,0.9472133311895985,2024-05-01 06:56:28.751649,2024-05-01 06:56:29.029097,0 days 00:00:00.277448,,manhattan,2.0,,,Agglomerative,,,,,,,,,,,,,,,average,,,,1.0,none,,,,,,,4.0,9.590373879031093,,PCA,randomized,,,,,,,,,,,,,,,True,,COMPLETE
803,803,0.9532357462135064,2024-05-01 06:56:29.030085,2024-05-01 06:56:29.333762,0 days 00:00:00.303677,,manhattan,2.0,,,Agglomerative,,,,,,,,,,,,,,,average,,,,1.0,none,,,,,,,3.0,9.276352004526437,,PCA,randomized,,,,,,,,,,,,,,,True,,COMPLETE
804,804,0.9472133311895985,2024-05-01 06:56:29.339266,2024-05-01 06:56:29.621162,0 days 00:00:00.281896,,manhattan,2.0,,,Agglomerative,,,,,,,,,,,,,,,average,,,,1.0,none,,,,,,,4.0,9.836246514344172,,PCA,randomized,,,,,,,,,,,,,,,True,,COMPLETE
805,805,0.9455314530538197,2024-05-01 06:56:29.622139,2024-05-01 06:56:29.916035,0 days 00:00:00.293896,,manhattan,2.0,,,Agglomerative,,,,,,,,,,,,,,,average,,,,2.0,none,,,,,,,6.0,9.473496469361885,,PCA,randomized,,,,,,,,,,,,,,,True,,COMPLETE
806,806,0.9532357462135064,2024-05-01 06:56:29.917018,2024-05-01 06:56:30.163816,0 days 00:00:00.246798,,manhattan,2.0,,,Agglomerative,,,,,,,,,,,,,,,average,,,,1.0,none,,,,,,,3.0,9.639546923352853,,PCA,randomized,,,,,,,,,,,,,,,True,,COMPLETE
807,807,-1.0,2024-05-01 06:56:30.164803,2024-05-01 06:56:30.427740,0 days 00:00:00.262937,,,,3.3000000000000003,,HDBSCAN,,,,4.0,ball_tree,30.0,eom,sokalsneath,2.0,,,,,,,,,32.0,1.0,none,,,,,,,3.0,9.116619497568834,,PCA,randomized,,,,,,,,,,,,,,,True,,COMPLETE
808,808,0.9532357462135064,2024-05-01 06:56:30.428411,2024-05-01 06:56:30.656772,0 days 00:00:00.228361,,manhattan,2.0,,,Agglomerative,,,,,,,,,,,,,,,average,,,,1.0,none,,,,,,,3.0,9.99414620125259,,PCA,randomized,,,,,,,,,,,,,,,True,,COMPLETE
809,809,0.12532220067486982,2024-05-01 06:56:30.657969,2024-05-01 06:56:30.914770,0 days 00:00:00.256801,,cosine,2.0,,,Agglomerative,,,,,,,,,,,,,,,average,,,,2.0,none,,,,,,,4.0,9.799469599152212,,PCA,randomized,,,,,,,,,,,,,,,True,,COMPLETE
810,810,0.440958708524704,2024-05-01 06:56:30.915981,2024-05-01 06:56:39.503756,0 days 00:00:08.587775,,manhattan,2.0,,,Agglomerative,,,,,,,,,,,,,,,average,,0.6000000000000001,,,,,,,,,,,,,UMAP,,,,,,,,,,,,,euclidean,2.0,237.0,,,COMPLETE
811,811,0.9532357462135064,2024-05-01 06:56:39.504725,2024-05-01 06:56:39.775975,0 days 00:00:00.271250,,manhattan,2.0,,,Agglomerative,,,,,,,,,,,,,,,average,,,,1.0,none,,,,,,,3.0,9.393631472059116,,PCA,randomized,,,,,,,,,,,,,,,True,,COMPLETE
812,812,0.9532357462135064,2024-05-01 06:56:39.777025,2024-05-01 06:56:40.067965,0 days 00:00:00.290940,,manhattan,2.0,,,Agglomerative,,,,,,,,,,,,,,,average,,,,1.0,none,,,,,,,3.0,9.64268893473365,,PCA,randomized,,,,,,,,,,,,,,,True,,COMPLETE
813,813,0.7519709743848537,2024-05-01 06:56:40.068959,2024-05-01 06:56:40.391406,0 days 00:00:00.322447,,manhattan,8.0,,,Agglomerative,,,,,,,,,,,,,,,average,,,,9.0,none,,,,,,,3.0,9.825274562672137,,PCA,randomized,,,,,,,,,,,,,,,True,,COMPLETE
814,814,0.6991442951460113,2024-05-01 06:56:40.392391,2024-05-01 06:56:40.701749,0 days 00:00:00.309358,,manhattan,16.0,,,Agglomerative,,,,,,,,,,,,,,,average,,,,2.0,none,,,,,,,4.0,9.490006072543109,,PCA,randomized,,,,,,,,,,,,,,,True,,COMPLETE
815,815,0.2996649742126465,2024-05-01 06:56:40.702755,2024-05-01 06:56:51.361349,0 days 00:00:10.658594,,l1,2.0,,,Agglomerative,,,,,,,,,,,,,,,average,,,,,,,,,,,,,,13.549623756362692,t-SNE,,,,,,,16.56242544927005,pca,20.0,barnes_hut,jaccard,2.0,,,,,,COMPLETE
816,816,0.9532357462135064,2024-05-01 06:56:51.372589,2024-05-01 06:56:51.640547,0 days 00:00:00.267958,,manhattan,2.0,,,Agglomerative,,,,,,,,,,,,,,,average,,,,1.0,none,,,,,,,3.0,9.213909040581255,,PCA,randomized,,,,,,,,,,,,,,,True,,COMPLETE
817,817,-1.0,2024-05-01 06:56:51.641820,2024-05-01 06:56:51.773471,0 days 00:00:00.131651,,,,,,OPTICS,,,,,,,,,,,,,,,,10.0,,,1.0,none,kd_tree,35.0,xi,sokalmichener,192.0,,3.0,9.674759177224567,,PCA,randomized,,,,,,,,,,,,,,,True,0.5,COMPLETE
818,818,0.9532357462135064,2024-05-01 06:56:51.774203,2024-05-01 06:56:52.045775,0 days 00:00:00.271572,,manhattan,2.0,,,Agglomerative,,,,,,,,,,,,,,,average,,,,1.0,none,,,,,,,3.0,9.998227933112029,,PCA,randomized,,,,,,,,,,,,,,,True,,COMPLETE
819,819,0.9339659207700731,2024-05-01 06:56:52.046782,2024-05-01 06:56:52.313012,0 days 00:00:00.266230,,manhattan,2.0,,,Agglomerative,,,,,,,,,,,,,,,average,,,,2.0,none,,,,,,,4.0,8.965587792228247,,PCA,randomized,,,,,,,,,,,,,,,True,,COMPLETE
820,820,0.3540823434967555,2024-05-01 06:56:52.314189,2024-05-01 06:56:52.698011,0 days 00:00:00.383822,,,,,,KMeans,,,,,,,,,,elkan,random,16.0,13.0,1e-05,,,,,1.0,none,,,,,,,3.0,9.48241951154825,,PCA,arpack,,,,,,,,,,,,,,,True,,COMPLETE
821,821,0.9036561553303653,2024-05-01 06:56:52.699274,2024-05-01 06:56:53.018266,0 days 00:00:00.318992,,manhattan,2.0,,,Agglomerative,,,,,,,,,,,,,,,average,,,,10.0,none,,,,,,,9.0,9.81083655266483,,PCA,randomized,,,,,,,,,,,,,,,True,,COMPLETE
822,822,0.9532357462135064,2024-05-01 06:56:53.019311,2024-05-01 06:56:53.304565,0 days 00:00:00.285254,,manhattan,2.0,,,Agglomerative,,,,,,,,,,,,,,,average,,,,1.0,none,,,,,,,3.0,9.308634513425115,,PCA,randomized,,,,,,,,,,,,,,,True,,COMPLETE
823,823,0.4659321764703445,2024-05-01 06:56:53.305554,2024-05-01 06:56:53.567433,0 days 00:00:00.261879,,manhattan,18.0,,,Agglomerative,,,,,,,,,,,,,,,average,,,,2.0,QR,,,,,,,4.0,9.650524152348998,,PCA,randomized,,,,,,,,,,,,,,,True,,COMPLETE
824,824,0.9532357462135064,2024-05-01 06:56:53.568652,2024-05-01 06:56:53.870423,0 days 00:00:00.301771,,manhattan,2.0,,,Agglomerative,,,,,,,,,,,,,,,average,,,,1.0,none,,,,,,,3.0,9.842052456707393,,PCA,randomized,,,,,,,,,,,,,,,True,,COMPLETE
825,825,0.9532357462135064,2024-05-01 06:56:53.875164,2024-05-01 06:56:54.132201,0 days 00:00:00.257037,,manhattan,2.0,,,Agglomerative,,,,,,,,,,,,,,,average,,,,1.0,none,,,,,,,3.0,9.5519481038044,,PCA,randomized,,,,,,,,,,,,,,,True,,COMPLETE
826,826,0.8930099637136419,2024-05-01 06:56:54.133224,2024-05-01 06:56:54.406276,0 days 00:00:00.273052,,,2.0,,,Agglomerative,,,,,,,,,,,,,,,ward,,,,2.0,none,,,,,,,4.0,9.825177474006349,,PCA,randomized,,,,,,,,,,,,,,,True,,COMPLETE
827,827,0.9532357462135064,2024-05-01 06:56:54.407486,2024-05-01 06:56:54.681354,0 days 00:00:00.273868,,manhattan,2.0,,,Agglomerative,,,,,,,,,,,,,,,average,,,,1.0,none,,,,,,,3.0,9.346116778828105,,PCA,randomized,,,,,,,,,,,,,,,True,,COMPLETE
828,828,0.9267847662589,2024-05-01 06:56:54.682399,2024-05-01 06:56:54.938511,0 days 00:00:00.256112,,manhattan,3.0,,,Agglomerative,,,,,,,,,,,,,,,average,,,,1.0,none,,,,,,,3.0,9.998803964963201,,PCA,randomized,,,,,,,,,,,,,,,True,,COMPLETE
829,829,-1.0,2024-05-01 06:56:54.939530,2024-05-01 06:56:55.085414,0 days 00:00:00.145884,precomputed_nearest_neighbors,,,,kmeans,Spectral,45.549419458925556,2.0,lobpcg,,,,,,,,,,,,,,,,2.0,none,,,,,,,3.0,9.649293669582875,,PCA,randomized,6.0,0.6,10.0,15.0,87.0,,,,,,,,,,True,,COMPLETE
830,830,0.9472133311895985,2024-05-01 06:56:55.086244,2024-05-01 06:56:55.366432,0 days 00:00:00.280188,,manhattan,2.0,,,Agglomerative,,,,,,,,,,,,,,,average,,,,1.0,none,,,,,,,4.0,9.496112474595066,,PCA,randomized,,,,,,,,,,,,,,,True,,COMPLETE
831,831,0.9345204260182611,2024-05-01 06:56:55.367477,2024-05-01 06:56:55.681529,0 days 00:00:00.314052,,manhattan,2.0,,,Agglomerative,,,,,,,,,,,,,,,average,,,,2.0,none,,,,,,,5.0,9.164993971017816,,PCA,randomized,,,,,,,,,,,,,,,True,,COMPLETE
832,832,0.9532357462135064,2024-05-01 06:56:55.682525,2024-05-01 06:56:55.940378,0 days 00:00:00.257853,,manhattan,2.0,,,Agglomerative,,,,,,,,,,,,,,,average,,,,1.0,none,,,,,,,3.0,9.718973712822113,,PCA,randomized,,,,,,,,,,,,,,,True,,COMPLETE
833,833,-1.0,2024-05-01 06:56:55.941387,2024-05-01 06:56:56.079664,0 days 00:00:00.138277,,,,8.1,,HDBSCAN,,,,8.4,auto,95.0,leaf,correlation,422.0,,,,,,,,,190.0,1.0,none,,,,,,,4.0,9.994458625597503,,PCA,randomized,,,,,,,,,,,,,,,True,,COMPLETE
834,834,0.21775999665260315,2024-05-01 06:56:56.080413,2024-05-01 06:57:08.332331,0 days 00:00:12.251918,,manhattan,3.0,,,Agglomerative,,,,,,,,,,,,,,,average,,0.25,,,,,,,,,,,,,UMAP,,,,,,,,,,,,,sokalsneath,7.0,427.0,,,COMPLETE
835,835,0.7872044118903797,2024-05-01 06:57:08.333320,2024-05-01 06:57:08.708555,0 days 00:00:00.375235,,manhattan,14.0,,,Agglomerative,,,,,,,,,,,,,,,average,,,,1.0,none,,,,,,,3.0,9.368684246794592,,PCA,randomized,,,,,,,,,,,,,,,True,,COMPLETE
836,836,0.9510694119347141,2024-05-01 06:57:08.709583,2024-05-01 06:57:08.972283,0 days 00:00:00.262700,,manhattan,2.0,,,Agglomerative,,,,,,,,,,,,,,,average,,,,2.0,none,,,,,,,3.0,9.637244055385452,,PCA,randomized,,,,,,,,,,,,,,,True,,COMPLETE
837,837,0.9267847662589,2024-05-01 06:57:08.973528,2024-05-01 06:57:09.242058,0 days 00:00:00.268530,,manhattan,3.0,,,Agglomerative,,,,,,,,,,,,,,,average,,,,1.0,none,,,,,,,3.0,9.745245082960853,,PCA,randomized,,,,,,,,,,,,,,,True,,COMPLETE
838,838,0.3274626135826111,2024-05-01 06:57:09.243173,2024-05-01 07:00:38.936341,0 days 00:03:29.693168,,cosine,2.0,,,Agglomerative,,,,,,,,,,,,,,,average,,,,,,,,,,,,,,30.125066437665087,t-SNE,,,,,,,19.14663448564654,random,75.0,exact,sokalmichener,13.0,,,,,,COMPLETE
839,839,0.8685409171954397,2024-05-01 07:00:38.937364,2024-05-01 07:00:39.246514,0 days 00:00:00.309150,,manhattan,6.0,,,Agglomerative,,,,,,,,,,,,,,,average,,,,1.0,none,,,,,,,4.0,8.975704518220331,,PCA,randomized,,,,,,,,,,,,,,,True,,COMPLETE
840,840,0.8850874331520209,2024-05-01 07:00:39.249626,2024-05-01 07:00:39.484247,0 days 00:00:00.234621,,manhattan,2.0,,,Agglomerative,,,,,,,,,,,,,,,average,,,,17.0,none,,,,,,,3.0,9.83241359181968,,PCA,arpack,,,,,,,,,,,,,,,True,,COMPLETE
841,841,0.9470230812782723,2024-05-01 07:00:39.485264,2024-05-01 07:00:39.743339,0 days 00:00:00.258075,,manhattan,3.0,,,Agglomerative,,,,,,,,,,,,,,,average,,,,2.0,none,,,,,,,3.0,9.471469368750377,,PCA,randomized,,,,,,,,,,,,,,,True,,COMPLETE
842,842,0.9472133311895985,2024-05-01 07:00:39.744346,2024-05-01 07:00:40.035110,0 days 00:00:00.290764,,manhattan,2.0,,,Agglomerative,,,,,,,,,,,,,,,average,,,,1.0,none,,,,,,,4.0,9.264914342045856,,PCA,randomized,,,,,,,,,,,,,,,True,,COMPLETE
843,843,-1.0,2024-05-01 07:00:40.036169,2024-05-01 07:00:41.544425,0 days 00:00:01.508256,,,,,,OPTICS,,,,,,,,,,,,,,,,1.0,,,1.0,none,brute,100.0,dbscan,sokalsneath,472.0,,3.0,9.626200581676553,,PCA,randomized,,,,,,,,,,,,,,,True,0.8500000000000001,COMPLETE
844,844,0.9532357462135064,2024-05-01 07:00:41.545259,2024-05-01 07:00:41.780005,0 days 00:00:00.234746,,l1,2.0,,,Agglomerative,,,,,,,,,,,,,,,average,,,,1.0,none,,,,,,,3.0,9.784874671162669,,PCA,randomized,,,,,,,,,,,,,,,True,,COMPLETE
845,845,0.9470230812782723,2024-05-01 07:00:41.781017,2024-05-01 07:00:42.048377,0 days 00:00:00.267360,,manhattan,3.0,,,Agglomerative,,,,,,,,,,,,,,,average,,,,2.0,none,,,,,,,3.0,9.50502891476256,,PCA,randomized,,,,,,,,,,,,,,,True,,COMPLETE
846,846,0.44171672020436425,2024-05-01 07:00:42.049610,2024-05-01 07:00:42.215214,0 days 00:00:00.165604,,,,,,KMeans,,,,,,,,,,lloyd,k-means++,10.0,,0.0001,,,,,1.0,none,,,,,,,4.0,9.857581775674364,,PCA,randomized,,,,,,,,,,,,,,,True,,COMPLETE
847,847,0.9182648420948173,2024-05-01 07:00:42.216494,2024-05-01 07:00:42.562324,0 days 00:00:00.345830,,manhattan,2.0,,,Agglomerative,,,,,,,,,,,,,,,average,,,,1.0,none,,,,,,,14.0,9.997866714872137,,PCA,randomized,,,,,,,,,,,,,,,True,,COMPLETE
848,848,0.885087433152021,2024-05-01 07:00:42.563587,2024-05-01 07:00:42.818320,0 days 00:00:00.254733,,manhattan,2.0,,,Agglomerative,,,,,,,,,,,,,,,average,,,,2.0,QR,,,,,,,3.0,9.99829411061159,,PCA,randomized,,,,,,,,,,,,,,,True,,COMPLETE
849,849,0.9532357462135064,2024-05-01 07:00:42.819741,2024-05-01 07:00:43.082921,0 days 00:00:00.263180,,manhattan,2.0,,,Agglomerative,,,,,,,,,,,,,,,average,,,,1.0,none,,,,,,,3.0,9.129684273964108,,PCA,randomized,,,,,,,,,,,,,,,True,,COMPLETE
850,850,0.6731618443728996,2024-05-01 07:00:43.084202,2024-05-01 07:00:43.372683,0 days 00:00:00.288481,,manhattan,15.0,,,Agglomerative,,,,,,,,,,,,,,,average,,,,1.0,none,,,,,,,3.0,9.598533854158283,,PCA,randomized,,,,,,,,,,,,,,,True,,COMPLETE
851,851,0.891864467872394,2024-05-01 07:00:43.373895,2024-05-01 07:00:43.629238,0 days 00:00:00.255343,,manhattan,3.0,,,Agglomerative,,,,,,,,,,,,,,,average,,,,8.0,none,,,,,,,4.0,9.36109565687676,,PCA,randomized,,,,,,,,,,,,,,,True,,COMPLETE
852,852,0.8425796129715827,2024-05-01 07:00:43.630477,2024-05-01 07:00:43.959757,0 days 00:00:00.329280,,,2.0,,,Agglomerative,,,,,,,,,,,,,,,ward,,,,2.0,auto,,,,,,,3.0,9.696865346356343,,PCA,randomized,,,,,,,,,,,,,,,True,,COMPLETE
853,853,-1.0,2024-05-01 07:00:43.960912,2024-05-01 07:00:54.020652,0 days 00:00:10.059740,precomputed,,,,cluster_qr,Spectral,30.505993174631925,4.0,arpack,,,,,,,,,,,,,,0.45,,,,,,,,,,,,,UMAP,,3.0,6.6,5.0,9.0,247.0,,,,,,,chebyshev,15.0,207.0,,,COMPLETE
854,854,0.7956898583934716,2024-05-01 07:00:54.021821,2024-05-01 07:00:54.272370,0 days 00:00:00.250549,,l2,11.0,,,Agglomerative,,,,,,,,,,,,,,,average,,,,1.0,none,,,,,,,3.0,9.47474178679479,,PCA,randomized,,,,,,,,,,,,,,,True,,COMPLETE
855,855,0.9472133311895985,2024-05-01 07:00:54.273374,2024-05-01 07:00:54.533730,0 days 00:00:00.260356,,manhattan,2.0,,,Agglomerative,,,,,,,,,,,,,,,average,,,,1.0,none,,,,,,,4.0,9.810221470826315,,PCA,randomized,,,,,,,,,,,,,,,True,,COMPLETE
856,856,0.9470230812782723,2024-05-01 07:00:54.534731,2024-05-01 07:00:54.833918,0 days 00:00:00.299187,,manhattan,3.0,,,Agglomerative,,,,,,,,,,,,,,,average,,,,2.0,none,,,,,,,3.0,9.199408317610482,,PCA,randomized,,,,,,,,,,,,,,,True,,COMPLETE
857,857,0.9472133311895985,2024-05-01 07:00:54.835084,2024-05-01 07:00:55.170446,0 days 00:00:00.335362,,manhattan,2.0,,,Agglomerative,,,,,,,,,,,,,,,average,,,,1.0,none,,,,,,,4.0,9.99940701710452,,PCA,randomized,,,,,,,,,,,,,,,True,,COMPLETE
858,858,0.9510694119347141,2024-05-01 07:00:55.171689,2024-05-01 07:00:55.504413,0 days 00:00:00.332724,,manhattan,2.0,,,Agglomerative,,,,,,,,,,,,,,,average,,,,2.0,none,,,,,,,3.0,9.654408316301835,,PCA,randomized,,,,,,,,,,,,,,,True,,COMPLETE
