,number,value,datetime_start,datetime_complete,duration,params_affinity,params_agglo_metric,params_agglo_n,params_alpha,params_assign_lables,params_clusterer,params_coef0,params_degree,params_eigen_solver,params_epsilon,params_hdbscan_algo,params_hdbscan_leaf_size,params_hdbscan_method,params_hdbscan_metric,params_hdbscan_n,params_kmeans_algo,params_kmeans_init,params_kmeans_n,params_kmeans_n_init,params_kmeans_tol,params_linkage,params_max_eps,params_min_dist,params_min_samples,params_n_oversamples,params_normalizer,params_optics_algo,params_optics_leaf_size,params_optics_method,params_optics_metric,params_optics_n,params_p,params_pca_n,params_pca_tol,params_perplexity,params_reducer,params_solver,params_spec_cluster,params_spec_gamma,params_spec_n,params_spec_n_init,params_spec_n_neighbors,params_tightness,params_tsne_init,params_tsne_lr,params_tsne_method,params_tsne_metric,params_tsne_n,params_umap_metric,params_umap_n,params_umap_n_neighbors,params_whiten,params_xi,state
260,260,0.14760999381542206,2024-05-01 06:00:09.302011,2024-05-01 06:00:20.176016,0 days 00:00:10.874005,,l1,3.0,,,Agglomerative,,,,,,,,,,,,,,,complete,,0.8,,,,,,,,,,,,,UMAP,,,,,,,,,,,,,russellrao,8.0,302.0,,,COMPLETE
261,261,0.9515244109188539,2024-05-01 06:00:20.176956,2024-05-01 06:00:20.450336,0 days 00:00:00.273380,,euclidean,2.0,,,Agglomerative,,,,,,,,,,,,,,,complete,,,,18.0,auto,,,,,,,2.0,8.265040724155703,,PCA,randomized,,,,,,,,,,,,,,,False,,COMPLETE
262,262,0.501017666477256,2024-05-01 06:00:20.451443,2024-05-01 06:00:20.698243,0 days 00:00:00.246800,,euclidean,12.0,,,Agglomerative,,,,,,,,,,,,,,,complete,,,,2.0,auto,,,,,,,2.0,6.851677816838989,,PCA,randomized,,,,,,,,,,,,,,,True,,COMPLETE
263,263,0.9515244109188539,2024-05-01 06:00:20.699311,2024-05-01 06:00:20.958281,0 days 00:00:00.258970,,euclidean,2.0,,,Agglomerative,,,,,,,,,,,,,,,complete,,,,1.0,auto,,,,,,,2.0,8.909166001126245,,PCA,randomized,,,,,,,,,,,,,,,False,,COMPLETE
264,264,0.9028471814918176,2024-05-01 06:00:20.959093,2024-05-01 06:00:21.212888,0 days 00:00:00.253795,,l1,3.0,,,Agglomerative,,,,,,,,,,,,,,,complete,,,,1.0,auto,,,,,,,2.0,7.476204916984566,,PCA,randomized,,,,,,,,,,,,,,,False,,COMPLETE
265,265,-1.0,2024-05-01 06:00:21.213691,2024-05-01 06:00:21.448766,0 days 00:00:00.235075,,,,2.6,,HDBSCAN,,,,1.4000000000000001,ball_tree,35.0,eom,russellrao,392.0,,,,,,,,,132.0,2.0,auto,,,,,,,2.0,8.011448958030257,,PCA,randomized,,,,,,,,,,,,,,,False,,COMPLETE
266,266,-1.0,2024-05-01 06:00:21.449380,2024-05-01 06:00:21.521133,0 days 00:00:00.071753,,euclidean,2.0,,,Agglomerative,,,,,,,,,,,,,,,complete,,,,,,,,,,,,,,11.608232330464672,t-SNE,,,,,,,18.6093397680138,random,10.0,barnes_hut,matching,2.0,,,,,,COMPLETE
267,267,0.9515244109188539,2024-05-01 06:00:21.521619,2024-05-01 06:00:21.719630,0 days 00:00:00.198011,,euclidean,2.0,,,Agglomerative,,,,,,,,,,,,,,,complete,,,,1.0,auto,,,,,,,2.0,6.501573611195365,,PCA,randomized,,,,,,,,,,,,,,,False,,COMPLETE
268,268,0.9028471814918176,2024-05-01 06:00:21.720428,2024-05-01 06:00:21.949940,0 days 00:00:00.229512,,euclidean,3.0,,,Agglomerative,,,,,,,,,,,,,,,complete,,,,1.0,auto,,,,,,,2.0,7.818093557605088,,PCA,randomized,,,,,,,,,,,,,,,False,,COMPLETE
269,269,0.9515244109188539,2024-05-01 06:00:21.950930,2024-05-01 06:00:22.218218,0 days 00:00:00.267288,,l1,2.0,,,Agglomerative,,,,,,,,,,,,,,,complete,,,,1.0,auto,,,,,,,2.0,7.346534674172242,,PCA,randomized,,,,,,,,,,,,,,,False,,COMPLETE
270,270,0.9515244109188539,2024-05-01 06:00:22.219274,2024-05-01 06:00:22.442872,0 days 00:00:00.223598,,euclidean,2.0,,,Agglomerative,,,,,,,,,,,,,,,complete,,,,2.0,auto,,,,,,,2.0,8.153230211043239,,PCA,randomized,,,,,,,,,,,,,,,False,,COMPLETE
271,271,0.9515244109188539,2024-05-01 06:00:22.443896,2024-05-01 06:00:22.665381,0 days 00:00:00.221485,,euclidean,2.0,,,Agglomerative,,,,,,,,,,,,,,,complete,,,,1.0,auto,,,,,,,2.0,6.6500775821541405,,PCA,randomized,,,,,,,,,,,,,,,False,,COMPLETE
272,272,0.9028471814918175,2024-05-01 06:00:22.666410,2024-05-01 06:00:22.884766,0 days 00:00:00.218356,,euclidean,3.0,,,Agglomerative,,,,,,,,,,,,,,,complete,,,,2.0,auto,,,,,,,2.0,7.567199172444343,,PCA,randomized,,,,,,,,,,,,,,,False,,COMPLETE
273,273,0.9515244109188539,2024-05-01 06:00:22.885822,2024-05-01 06:00:23.106585,0 days 00:00:00.220763,,l1,2.0,,,Agglomerative,,,,,,,,,,,,,,,complete,,,,1.0,auto,,,,,,,2.0,8.57089333414421,,PCA,randomized,,,,,,,,,,,,,,,False,,COMPLETE
274,274,0.7833935172876452,2024-05-01 06:00:23.107618,2024-05-01 06:00:23.363575,0 days 00:00:00.255957,,euclidean,6.0,,,Agglomerative,,,,,,,,,,,,,,,complete,,,,2.0,auto,,,,,,,2.0,7.1615113869181055,,PCA,randomized,,,,,,,,,,,,,,,False,,COMPLETE
275,275,0.9515244109188539,2024-05-01 06:00:23.364370,2024-05-01 06:00:23.579803,0 days 00:00:00.215433,,euclidean,2.0,,,Agglomerative,,,,,,,,,,,,,,,complete,,,,1.0,auto,,,,,,,2.0,7.89078026529793,,PCA,randomized,,,,,,,,,,,,,,,False,,COMPLETE
276,276,-1.0,2024-05-01 06:00:23.580578,2024-05-01 06:00:24.814480,0 days 00:00:01.233902,,,,,,OPTICS,,,,,,,,,,,,,,,,1.0,,,1.0,auto,brute,60.0,dbscan,braycurtis,92.0,,2.0,8.372396301786768,,PCA,randomized,,,,,,,,,,,,,,,False,0.2,COMPLETE
277,277,0.1593667007997048,2024-05-01 06:00:24.815094,2024-05-01 06:00:25.040950,0 days 00:00:00.225856,,cosine,3.0,,,Agglomerative,,,,,,,,,,,,,,,complete,,,,1.0,auto,,,,,,,2.0,6.882088764025055,,PCA,randomized,,,,,,,,,,,,,,,False,,COMPLETE
278,278,0.9516454913654608,2024-05-01 06:00:25.041991,2024-05-01 06:00:25.306849,0 days 00:00:00.264858,,euclidean,2.0,,,Agglomerative,,,,,,,,,,,,,,,complete,,,,2.0,none,,,,,,,3.0,7.643081790359536,,PCA,randomized,,,,,,,,,,,,,,,False,,COMPLETE
279,279,0.9515010733932888,2024-05-01 06:00:25.307950,2024-05-01 06:00:25.562310,0 days 00:00:00.254360,,euclidean,2.0,,,Agglomerative,,,,,,,,,,,,,,,complete,,,,2.0,auto,,,,,,,3.0,7.682347913094487,,PCA,randomized,,,,,,,,,,,,,,,False,,COMPLETE
280,280,0.8973879029370778,2024-05-01 06:00:25.563075,2024-05-01 06:00:25.715474,0 days 00:00:00.152399,,,,,,KMeans,,,,,,,,,,elkan,k-means++,2.0,,0.1,,,,,2.0,none,,,,,,,3.0,7.376415873975688,,PCA,randomized,,,,,,,,,,,,,,,False,,COMPLETE
281,281,0.9031218863871514,2024-05-01 06:00:25.716298,2024-05-01 06:00:25.944704,0 days 00:00:00.228406,,euclidean,3.0,,,Agglomerative,,,,,,,,,,,,,,,complete,,,,1.0,none,,,,,,,2.0,8.920096579526422,,PCA,randomized,,,,,,,,,,,,,,,False,,COMPLETE
282,282,0.3087359666824341,2024-05-01 06:00:25.945511,2024-05-01 06:00:37.731116,0 days 00:00:11.785605,,euclidean,2.0,,,Agglomerative,,,,,,,,,,,,,,,average,,0.5,,,,,,,,,,,,,UMAP,,,,,,,,,,,,,yule,5.0,437.0,,,COMPLETE
283,283,0.8833523614567398,2024-05-01 06:00:37.731918,2024-05-01 06:00:37.950015,0 days 00:00:00.218097,,euclidean,2.0,,,Agglomerative,,,,,,,,,,,,,,,complete,,,,1.0,auto,,,,,,,2.0,7.514350078501396,,PCA,randomized,,,,,,,,,,,,,,,True,,COMPLETE
284,284,0.9516454913654608,2024-05-01 06:00:37.950786,2024-05-01 06:00:38.166922,0 days 00:00:00.216136,,euclidean,2.0,,,Agglomerative,,,,,,,,,,,,,,,complete,,,,2.0,none,,,,,,,3.0,7.030764911914464,,PCA,randomized,,,,,,,,,,,,,,,False,,COMPLETE
285,285,-1.0,2024-05-01 06:00:38.167775,2024-05-01 06:00:38.326924,0 days 00:00:00.159149,nearest_neighbors,,,,cluster_qr,Spectral,82.29797830271494,2.0,amg,,,,,,,,,,,,,,,,2.0,LU,,,,,,,3.0,7.112679581974746,,PCA,randomized,2.0,2.6,6.0,17.0,117.0,,,,,,,,,,False,,COMPLETE
286,286,0.903125576250099,2024-05-01 06:00:38.327764,2024-05-01 06:00:38.553375,0 days 00:00:00.225611,,euclidean,3.0,,,Agglomerative,,,,,,,,,,,,,,,complete,,,,2.0,none,,,,,,,3.0,6.945196075371512,,PCA,randomized,,,,,,,,,,,,,,,False,,COMPLETE
287,287,0.931144213141198,2024-05-01 06:00:38.554203,2024-05-01 06:00:38.786917,0 days 00:00:00.232714,,,2.0,,,Agglomerative,,,,,,,,,,,,,,,ward,,,,1.0,LU,,,,,,,2.0,6.412399147097657,,PCA,randomized,,,,,,,,,,,,,,,False,,COMPLETE
288,288,0.6075599789619446,2024-05-01 06:00:38.790765,2024-05-01 06:00:45.413005,0 days 00:00:06.622240,,euclidean,2.0,,,Agglomerative,,,,,,,,,,,,,,,complete,,,,,,,,,,,,,,42.133491116294834,t-SNE,,,,,,,10.686820776816829,pca,70.0,barnes_hut,l1,1.0,,,,,,COMPLETE
289,289,0.9516470634351011,2024-05-01 06:00:45.413820,2024-05-01 06:00:45.612194,0 days 00:00:00.198374,,euclidean,2.0,,,Agglomerative,,,,,,,,,,,,,,,complete,,,,1.0,none,,,,,,,3.0,6.697817299511454,,PCA,randomized,,,,,,,,,,,,,,,False,,COMPLETE
290,290,0.9027885185953334,2024-05-01 06:00:45.612977,2024-05-01 06:00:45.863919,0 days 00:00:00.250942,,euclidean,3.0,,,Agglomerative,,,,,,,,,,,,,,,complete,,,,2.0,LU,,,,,,,3.0,6.598826902541419,,PCA,randomized,,,,,,,,,,,,,,,False,,COMPLETE
291,291,0.9516470634351011,2024-05-01 06:00:45.864717,2024-05-01 06:00:46.075451,0 days 00:00:00.210734,,euclidean,2.0,,,Agglomerative,,,,,,,,,,,,,,,complete,,,,1.0,none,,,,,,,3.0,7.1770579543179736,,PCA,randomized,,,,,,,,,,,,,,,False,,COMPLETE
292,292,0.9516470634351011,2024-05-01 06:00:46.076273,2024-05-01 06:00:46.293176,0 days 00:00:00.216903,,euclidean,2.0,,,Agglomerative,,,,,,,,,,,,,,,complete,,,,1.0,none,,,,,,,3.0,6.78611058381881,,PCA,randomized,,,,,,,,,,,,,,,False,,COMPLETE
293,293,-1.0,2024-05-01 06:00:46.293964,2024-05-01 06:00:46.409652,0 days 00:00:00.115688,,,,9.4,,HDBSCAN,,,,4.0,brute,80.0,eom,cosine,102.0,,,,,,,,,180.0,2.0,none,,,,,,,3.0,6.788046909899576,,PCA,randomized,,,,,,,,,,,,,,,False,,COMPLETE
294,294,0.9027885185953454,2024-05-01 06:00:46.410358,2024-05-01 06:00:46.631421,0 days 00:00:00.221063,,euclidean,3.0,,,Agglomerative,,,,,,,,,,,,,,,complete,,,,1.0,none,,,,,,,3.0,7.244908025903408,,PCA,arpack,,,,,,,,,,,,,,,False,,COMPLETE
295,295,0.9516470634351011,2024-05-01 06:00:46.632447,2024-05-01 06:00:46.845475,0 days 00:00:00.213028,,euclidean,2.0,,,Agglomerative,,,,,,,,,,,,,,,complete,,,,1.0,none,,,,,,,3.0,6.71618089410898,,PCA,randomized,,,,,,,,,,,,,,,False,,COMPLETE
296,296,0.903125576250099,2024-05-01 06:00:46.846506,2024-05-01 06:00:47.065200,0 days 00:00:00.218694,,euclidean,3.0,,,Agglomerative,,,,,,,,,,,,,,,complete,,,,2.0,none,,,,,,,3.0,6.7096960524617355,,PCA,randomized,,,,,,,,,,,,,,,False,,COMPLETE
297,297,0.9516470634351011,2024-05-01 06:00:47.066235,2024-05-01 06:00:47.301383,0 days 00:00:00.235148,,euclidean,2.0,,,Agglomerative,,,,,,,,,,,,,,,complete,,,,1.0,none,,,,,,,3.0,7.0064836433256525,,PCA,randomized,,,,,,,,,,,,,,,False,,COMPLETE
298,298,0.9516411415105895,2024-05-01 06:00:47.302399,2024-05-01 06:00:47.554883,0 days 00:00:00.252484,,euclidean,2.0,,,Agglomerative,,,,,,,,,,,,,,,complete,,,,1.0,none,,,,,,,16.0,6.990625537289493,,PCA,randomized,,,,,,,,,,,,,,,False,,COMPLETE
299,299,0.9516384601598673,2024-05-01 06:00:47.555701,2024-05-01 06:00:47.866971,0 days 00:00:00.311270,,euclidean,2.0,,,Agglomerative,,,,,,,,,,,,,,,complete,,,,2.0,none,,,,,,,17.0,7.080199756434065,,PCA,randomized,,,,,,,,,,,,,,,False,,COMPLETE
300,300,0.9516384601598673,2024-05-01 06:00:47.867822,2024-05-01 06:00:48.160262,0 days 00:00:00.292440,,euclidean,2.0,,,Agglomerative,,,,,,,,,,,,,,,complete,,,,2.0,none,,,,,,,17.0,6.988430327066783,,PCA,randomized,,,,,,,,,,,,,,,False,,COMPLETE
301,301,0.9031105263318425,2024-05-01 06:00:48.161312,2024-05-01 06:00:48.482403,0 days 00:00:00.321091,,euclidean,3.0,,,Agglomerative,,,,,,,,,,,,,,,complete,,,,2.0,none,,,,,,,18.0,6.985644829472029,,PCA,randomized,,,,,,,,,,,,,,,False,,COMPLETE
302,302,0.9516400754974011,2024-05-01 06:00:48.483261,2024-05-01 06:00:48.794953,0 days 00:00:00.311692,,euclidean,2.0,,,Agglomerative,,,,,,,,,,,,,,,complete,,,,2.0,none,,,,,,,18.0,6.8466588816982235,,PCA,randomized,,,,,,,,,,,,,,,False,,COMPLETE
303,303,0.9516400754974011,2024-05-01 06:00:48.796662,2024-05-01 06:00:49.088380,0 days 00:00:00.291718,,euclidean,2.0,,,Agglomerative,,,,,,,,,,,,,,,complete,,,,2.0,none,,,,,,,18.0,6.560661281444938,,PCA,randomized,,,,,,,,,,,,,,,False,,COMPLETE
304,304,0.9516400756107257,2024-05-01 06:00:49.089418,2024-05-01 06:00:49.370141,0 days 00:00:00.280723,,euclidean,2.0,,,Agglomerative,,,,,,,,,,,,,,,complete,,,,3.0,none,,,,,,,17.0,6.519188122519983,,PCA,randomized,,,,,,,,,,,,,,,False,,COMPLETE
305,305,-1.0,2024-05-01 06:00:49.371135,2024-05-01 06:01:01.012917,0 days 00:00:11.641782,,,,,,OPTICS,,,,,,,,,,,,,,,,10.0,0.30000000000000004,,,,auto,35.0,xi,manhattan,217.0,9.0,,,,UMAP,,,,,,,,,,,,,dice,12.0,87.0,,0.55,COMPLETE
306,306,0.19653901413943095,2024-05-01 06:01:01.013564,2024-05-01 06:01:01.251879,0 days 00:00:00.238315,,,,,,KMeans,,,,,,,,,,elkan,random,20.0,6.0,0.01,,,,,3.0,none,,,,,,,17.0,6.470218191654098,,PCA,randomized,,,,,,,,,,,,,,,True,,COMPLETE
307,307,0.903113007747847,2024-05-01 06:01:01.252716,2024-05-01 06:01:01.541558,0 days 00:00:00.288842,,euclidean,3.0,,,Agglomerative,,,,,,,,,,,,,,,complete,,,,3.0,none,,,,,,,18.0,6.7901523111435855,,PCA,randomized,,,,,,,,,,,,,,,False,,COMPLETE
308,308,0.9313244890645854,2024-05-01 06:01:01.542521,2024-05-01 06:01:01.816419,0 days 00:00:00.273898,,euclidean,2.0,,,Agglomerative,,,,,,,,,,,,,,,complete,,,,2.0,none,,,,,,,16.0,6.610590109765918,,PCA,randomized,,,,,,,,,,,,,,,False,,COMPLETE
309,309,0.9409824985352865,2024-05-01 06:01:01.817239,2024-05-01 06:01:02.077905,0 days 00:00:00.260666,,euclidean,2.0,,,Agglomerative,,,,,,,,,,,,,,,average,,,,2.0,none,,,,,,,18.0,6.976271639331359,,PCA,randomized,,,,,,,,,,,,,,,False,,COMPLETE
310,310,0.903106909776608,2024-05-01 06:01:02.078753,2024-05-01 06:01:02.355391,0 days 00:00:00.276638,,euclidean,3.0,,,Agglomerative,,,,,,,,,,,,,,,complete,,,,2.0,none,,,,,,,17.0,6.256690957029565,,PCA,randomized,,,,,,,,,,,,,,,False,,COMPLETE
311,311,0.5571108250301084,2024-05-01 06:01:02.356448,2024-05-01 06:01:02.616420,0 days 00:00:00.259972,,euclidean,15.0,,,Agglomerative,,,,,,,,,,,,,,,complete,,,,2.0,none,,,,,,,16.0,6.824391973958313,,PCA,arpack,,,,,,,,,,,,,,,False,,COMPLETE
312,312,0.21897302567958832,2024-05-01 06:01:02.617479,2024-05-01 06:04:17.767800,0 days 00:03:15.150321,,euclidean,4.0,,,Agglomerative,,,,,,,,,,,,,,,complete,,,,,,,,,,,,,,36.5183549789294,t-SNE,,,,,,,7.747067917234845,random,30.0,exact,hamming,10.0,,,,,,COMPLETE
313,313,0.9516400756107257,2024-05-01 06:04:17.768903,2024-05-01 06:04:18.015836,0 days 00:00:00.246933,,euclidean,2.0,,,Agglomerative,,,,,,,,,,,,,,,complete,,,,3.0,none,,,,,,,17.0,6.422372159518151,,PCA,randomized,,,,,,,,,,,,,,,False,,COMPLETE
314,314,-1.0,2024-05-01 06:04:18.016848,2024-05-01 06:04:18.142261,0 days 00:00:00.125413,precomputed_nearest_neighbors,,,,discretize,Spectral,65.03589078979462,3.0,arpack,,,,,,,,,,,,,,,,3.0,none,,,,,,,19.0,6.429210307716001,,PCA,randomized,5.0,6.1,17.0,13.0,397.0,,,,,,,,,,False,,COMPLETE
315,315,0.9516400756107257,2024-05-01 06:04:18.143101,2024-05-01 06:04:18.443392,0 days 00:00:00.300291,,euclidean,2.0,,,Agglomerative,,,,,,,,,,,,,,,complete,,,,3.0,none,,,,,,,17.0,7.097892434623397,,PCA,randomized,,,,,,,,,,,,,,,False,,COMPLETE
316,316,0.931318742603618,2024-05-01 06:04:18.444422,2024-05-01 06:04:18.690718,0 days 00:00:00.246296,,,2.0,,,Agglomerative,,,,,,,,,,,,,,,ward,,,,3.0,none,,,,,,,17.0,7.068859619297755,,PCA,randomized,,,,,,,,,,,,,,,False,,COMPLETE
317,317,0.6793404706902774,2024-05-01 06:04:18.691826,2024-05-01 06:04:19.018794,0 days 00:00:00.326968,,euclidean,9.0,,,Agglomerative,,,,,,,,,,,,,,,complete,,,,3.0,none,,,,,,,18.0,6.5369287235624265,,PCA,randomized,,,,,,,,,,,,,,,False,,COMPLETE
318,318,0.9516384603251191,2024-05-01 06:04:19.019619,2024-05-01 06:04:19.339833,0 days 00:00:00.320214,,euclidean,2.0,,,Agglomerative,,,,,,,,,,,,,,,complete,,,,3.0,none,,,,,,,16.0,6.714780605151835,,PCA,randomized,,,,,,,,,,,,,,,False,,COMPLETE
319,319,0.9031069101721442,2024-05-01 06:04:19.340670,2024-05-01 06:04:19.671119,0 days 00:00:00.330449,,euclidean,3.0,,,Agglomerative,,,,,,,,,,,,,,,complete,,,,3.0,none,,,,,,,16.0,7.138865372447167,,PCA,randomized,,,,,,,,,,,,,,,False,,COMPLETE
320,320,0.5768961181177782,2024-05-01 06:04:19.672193,2024-05-01 06:04:20.038693,0 days 00:00:00.366500,,,,5.8,,HDBSCAN,,,,5.1000000000000005,ball_tree,10.0,leaf,braycurtis,292.0,,,,,,,,,76.0,3.0,none,,,,,,,17.0,6.863745692594854,,PCA,randomized,,,,,,,,,,,,,,,False,,COMPLETE
321,321,0.9313244892414259,2024-05-01 06:04:20.039829,2024-05-01 06:04:20.323602,0 days 00:00:00.283773,,euclidean,2.0,,,Agglomerative,,,,,,,,,,,,,,,complete,,,,3.0,none,,,,,,,15.0,6.267344935160124,,PCA,randomized,,,,,,,,,,,,,,,False,,COMPLETE
322,322,0.9516384601598673,2024-05-01 06:04:20.324698,2024-05-01 06:04:20.583291,0 days 00:00:00.258593,,euclidean,2.0,,,Agglomerative,,,,,,,,,,,,,,,complete,,,,2.0,none,,,,,,,17.0,6.795124788451062,,PCA,randomized,,,,,,,,,,,,,,,False,,COMPLETE
323,323,0.9031105265837848,2024-05-01 06:04:20.584084,2024-05-01 06:04:20.866547,0 days 00:00:00.282463,,euclidean,3.0,,,Agglomerative,,,,,,,,,,,,,,,complete,,,,3.0,none,,,,,,,17.0,6.702109171519016,,PCA,randomized,,,,,,,,,,,,,,,False,,COMPLETE
324,324,0.9516384601598673,2024-05-01 06:04:20.867424,2024-05-01 06:04:21.118970,0 days 00:00:00.251546,,euclidean,2.0,,,Agglomerative,,,,,,,,,,,,,,,complete,,,,2.0,none,,,,,,,17.0,6.952595476410969,,PCA,randomized,,,,,,,,,,,,,,,False,,COMPLETE
325,325,0.9516400754974011,2024-05-01 06:04:21.120011,2024-05-01 06:04:21.381445,0 days 00:00:00.261434,,euclidean,2.0,,,Agglomerative,,,,,,,,,,,,,,,complete,,,,2.0,none,,,,,,,18.0,6.4721513049825,,PCA,randomized,,,,,,,,,,,,,,,False,,COMPLETE
326,326,0.9313114633961626,2024-05-01 06:04:21.382266,2024-05-01 06:04:21.657020,0 days 00:00:00.274754,,euclidean,2.0,,,Agglomerative,,,,,,,,,,,,,,,complete,,,,3.0,none,,,,,,,19.0,6.925890769029241,,PCA,randomized,,,,,,,,,,,,,,,False,,COMPLETE
327,327,0.903106909776608,2024-05-01 06:04:21.658046,2024-05-01 06:04:21.946310,0 days 00:00:00.288264,,euclidean,3.0,,,Agglomerative,,,,,,,,,,,,,,,complete,,,,2.0,none,,,,,,,17.0,6.416543970961702,,PCA,randomized,,,,,,,,,,,,,,,False,,COMPLETE
328,328,0.9516400754974011,2024-05-01 06:04:21.947113,2024-05-01 06:04:22.239465,0 days 00:00:00.292352,,euclidean,2.0,,,Agglomerative,,,,,,,,,,,,,,,complete,,,,2.0,none,,,,,,,18.0,6.7916101770697175,,PCA,randomized,,,,,,,,,,,,,,,False,,COMPLETE
329,329,0.8978960616588052,2024-05-01 06:04:22.240270,2024-05-01 06:04:22.495388,0 days 00:00:00.255118,,euclidean,2.0,,,Agglomerative,,,,,,,,,,,,,,,complete,,,,2.0,none,,,,,,,18.0,6.726870124261543,,PCA,randomized,,,,,,,,,,,,,,,True,,COMPLETE
330,330,0.2699195146560669,2024-05-01 06:04:22.496183,2024-05-01 06:04:33.830725,0 days 00:00:11.334542,,euclidean,2.0,,,Agglomerative,,,,,,,,,,,,,,,complete,,0.55,,,,,,,,,,,,,UMAP,,,,,,,,,,,,,jaccard,18.0,157.0,,,COMPLETE
331,331,0.9031069101721442,2024-05-01 06:04:33.831542,2024-05-01 06:04:34.098573,0 days 00:00:00.267031,,euclidean,3.0,,,Agglomerative,,,,,,,,,,,,,,,complete,,,,3.0,none,,,,,,,16.0,6.228092215510197,,PCA,randomized,,,,,,,,,,,,,,,False,,COMPLETE
332,332,-1.0,2024-05-01 06:04:34.101045,2024-05-01 06:04:35.539229,0 days 00:00:01.438184,,,,,,OPTICS,,,,,,,,,,,,,,,,inf,,,2.0,none,ball_tree,20.0,xi,sokalmichener,77.0,,18.0,6.468296819923399,,PCA,randomized,,,,,,,,,,,,,,,False,0.8,COMPLETE
333,333,0.9516384601598673,2024-05-01 06:04:35.539873,2024-05-01 06:04:35.851233,0 days 00:00:00.311360,,euclidean,2.0,,,Agglomerative,,,,,,,,,,,,,,,complete,,,,2.0,none,,,,,,,17.0,6.920620924656739,,PCA,randomized,,,,,,,,,,,,,,,False,,COMPLETE
334,334,0.9516400756107257,2024-05-01 06:04:35.852070,2024-05-01 06:04:36.131063,0 days 00:00:00.278993,,euclidean,2.0,,,Agglomerative,,,,,,,,,,,,,,,complete,,,,3.0,none,,,,,,,17.0,6.928047404772187,,PCA,randomized,,,,,,,,,,,,,,,False,,COMPLETE
335,335,0.597064755371399,2024-05-01 06:04:36.132203,2024-05-01 06:04:36.428595,0 days 00:00:00.296392,,cosine,2.0,,,Agglomerative,,,,,,,,,,,,,,,complete,,,,3.0,none,,,,,,,17.0,6.99831132568997,,PCA,randomized,,,,,,,,,,,,,,,False,,COMPLETE
336,336,0.554575609592947,2024-05-01 06:04:36.429643,2024-05-01 06:04:36.583422,0 days 00:00:00.153779,,,,,,KMeans,,,,,,,,,,lloyd,k-means++,15.0,,0.0001,,,,,3.0,none,,,,,,,17.0,6.921184558479628,,PCA,randomized,,,,,,,,,,,,,,,False,,COMPLETE
337,337,0.07644852250814438,2024-05-01 06:04:36.584603,2024-05-01 06:08:10.928646,0 days 00:03:34.344043,,euclidean,3.0,,,Agglomerative,,,,,,,,,,,,,,,complete,,,,,,,,,,,,,,11.295003595214425,t-SNE,,,,,,,13.907738856756568,random,45.0,exact,sqeuclidean,16.0,,,,,,COMPLETE
338,338,0.9516406481139925,2024-05-01 06:08:10.929456,2024-05-01 06:08:11.188554,0 days 00:00:00.259098,,euclidean,2.0,,,Agglomerative,,,,,,,,,,,,,,,complete,,,,3.0,none,,,,,,,18.0,7.216478766234719,,PCA,randomized,,,,,,,,,,,,,,,False,,COMPLETE
339,339,0.9516406481139925,2024-05-01 06:08:11.189606,2024-05-01 06:08:11.445623,0 days 00:00:00.256017,,euclidean,2.0,,,Agglomerative,,,,,,,,,,,,,,,complete,,,,3.0,none,,,,,,,18.0,7.181934154545005,,PCA,randomized,,,,,,,,,,,,,,,False,,COMPLETE
340,340,0.9279535743016021,2024-05-01 06:08:11.446654,2024-05-01 06:08:11.750102,0 days 00:00:00.303448,,euclidean,3.0,,,Agglomerative,,,,,,,,,,,,,,,average,,,,4.0,none,,,,,,,19.0,7.24730395835889,,PCA,randomized,,,,,,,,,,,,,,,False,,COMPLETE
341,341,0.9516406481139925,2024-05-01 06:08:11.751166,2024-05-01 06:08:12.052359,0 days 00:00:00.301193,,euclidean,2.0,,,Agglomerative,,,,,,,,,,,,,,,complete,,,,3.0,none,,,,,,,18.0,7.130365128653121,,PCA,randomized,,,,,,,,,,,,,,,False,,COMPLETE
342,342,0.9313210964053721,2024-05-01 06:08:12.053456,2024-05-01 06:08:12.383071,0 days 00:00:00.329615,,,2.0,,,Agglomerative,,,,,,,,,,,,,,,ward,,,,3.0,none,,,,,,,18.0,7.132453426659169,,PCA,randomized,,,,,,,,,,,,,,,False,,COMPLETE
343,343,0.19969741006795816,2024-05-01 06:08:12.383879,2024-05-01 06:08:16.037095,0 days 00:00:03.653216,rbf,,,,kmeans,Spectral,38.47902164374573,1.0,lobpcg,,,,,,,,,,,,,,,,4.0,none,,,,,,,18.0,7.071192159830679,,PCA,randomized,18.0,8.1,9.0,12.0,67.0,,,,,,,,,,False,,COMPLETE
344,344,0.9516400756107257,2024-05-01 06:08:16.038140,2024-05-01 06:08:16.307024,0 days 00:00:00.268884,,euclidean,2.0,,,Agglomerative,,,,,,,,,,,,,,,complete,,,,3.0,none,,,,,,,17.0,7.29270701007239,,PCA,randomized,,,,,,,,,,,,,,,False,,COMPLETE
