,number,value,datetime_start,datetime_complete,duration,params_affinity,params_agglo_metric,params_agglo_n,params_alpha,params_assign_lables,params_clusterer,params_coef0,params_degree,params_eigen_solver,params_epsilon,params_hdbscan_algo,params_hdbscan_leaf_size,params_hdbscan_method,params_hdbscan_metric,params_hdbscan_n,params_kmeans_algo,params_kmeans_init,params_kmeans_n,params_kmeans_n_init,params_kmeans_tol,params_linkage,params_max_eps,params_min_dist,params_min_samples,params_n_oversamples,params_normalizer,params_optics_algo,params_optics_leaf_size,params_optics_method,params_optics_metric,params_optics_n,params_p,params_pca_n,params_pca_tol,params_perplexity,params_reducer,params_solver,params_spec_cluster,params_spec_gamma,params_spec_n,params_spec_n_init,params_spec_n_neighbors,params_tightness,params_tsne_init,params_tsne_lr,params_tsne_method,params_tsne_metric,params_tsne_n,params_umap_metric,params_umap_n,params_umap_n_neighbors,params_whiten,params_xi,state
345,345,0.9516406481139925,2024-05-01 06:08:16.308065,2024-05-01 06:08:16.567213,0 days 00:00:00.259148,,euclidean,2.0,,,Agglomerative,,,,,,,,,,,,,,,complete,,,,3.0,none,,,,,,,18.0,7.288176731267845,,PCA,randomized,,,,,,,,,,,,,,,False,,COMPLETE
346,346,0.8752634580191535,2024-05-01 06:08:16.568210,2024-05-01 06:08:16.853654,0 days 00:00:00.285444,,euclidean,4.0,,,Agglomerative,,,,,,,,,,,,,,,complete,,,,3.0,none,,,,,,,18.0,7.2975694837865515,,PCA,randomized,,,,,,,,,,,,,,,False,,COMPLETE
347,347,0.903113007747847,2024-05-01 06:08:16.854452,2024-05-01 06:08:17.122075,0 days 00:00:00.267623,,euclidean,3.0,,,Agglomerative,,,,,,,,,,,,,,,complete,,,,3.0,none,,,,,,,18.0,7.2849382722612726,,PCA,randomized,,,,,,,,,,,,,,,False,,COMPLETE
348,348,0.9313114633961626,2024-05-01 06:08:17.123164,2024-05-01 06:08:17.476944,0 days 00:00:00.353780,,euclidean,2.0,,,Agglomerative,,,,,,,,,,,,,,,complete,,,,3.0,none,,,,,,,19.0,7.123945506772253,,PCA,randomized,,,,,,,,,,,,,,,False,,COMPLETE
349,349,0.6538397927687215,2024-05-01 06:08:17.478041,2024-05-01 06:08:17.767999,0 days 00:00:00.289958,,euclidean,10.0,,,Agglomerative,,,,,,,,,,,,,,,complete,,,,4.0,none,,,,,,,16.0,7.252121889321497,,PCA,randomized,,,,,,,,,,,,,,,False,,COMPLETE
350,350,-1.0,2024-05-01 06:08:17.768786,2024-05-01 06:08:18.050055,0 days 00:00:00.281269,,,,2.2,,HDBSCAN,,,,7.300000000000001,auto,65.0,leaf,cityblock,432.0,,,,,,,,,122.0,3.0,none,,,,,,,18.0,6.819351236487887,,PCA,randomized,,,,,,,,,,,,,,,False,,COMPLETE
351,351,0.9516393467041664,2024-05-01 06:08:18.050919,2024-05-01 06:08:18.282290,0 days 00:00:00.231371,,euclidean,2.0,,,Agglomerative,,,,,,,,,,,,,,,complete,,,,4.0,none,,,,,,,19.0,6.542549264565294,,PCA,randomized,,,,,,,,,,,,,,,False,,COMPLETE
352,352,0.883520689871585,2024-05-01 06:08:18.283128,2024-05-01 06:08:18.546262,0 days 00:00:00.263134,,euclidean,3.0,,,Agglomerative,,,,,,,,,,,,,,,complete,,,,4.0,none,,,,,,,19.0,6.560144782860481,,PCA,randomized,,,,,,,,,,,,,,,True,,COMPLETE
353,353,0.931311463780002,2024-05-01 06:08:18.547071,2024-05-01 06:08:18.845570,0 days 00:00:00.298499,,euclidean,2.0,,,Agglomerative,,,,,,,,,,,,,,,complete,,,,4.0,none,,,,,,,18.0,7.063984967350629,,PCA,randomized,,,,,,,,,,,,,,,False,,COMPLETE
354,354,0.3769861161708832,2024-05-01 06:08:18.846357,2024-05-01 06:08:29.319757,0 days 00:00:10.473400,,euclidean,2.0,,,Agglomerative,,,,,,,,,,,,,,,complete,,0.8500000000000001,,,,,,,,,,,,,UMAP,,,,,,,,,,,,,cosine,9.0,322.0,,,COMPLETE
355,355,0.9516393466577223,2024-05-01 06:08:29.320859,2024-05-01 06:08:29.574502,0 days 00:00:00.253643,,euclidean,2.0,,,Agglomerative,,,,,,,,,,,,,,,complete,,,,3.0,none,,,,,,,20.0,7.35377660481311,,PCA,randomized,,,,,,,,,,,,,,,False,,COMPLETE
356,356,0.7023505867265535,2024-05-01 06:08:29.575580,2024-05-01 06:08:29.877433,0 days 00:00:00.301853,,euclidean,7.0,,,Agglomerative,,,,,,,,,,,,,,,complete,,,,3.0,none,,,,,,,19.0,7.332678398304226,,PCA,randomized,,,,,,,,,,,,,,,False,,COMPLETE
357,357,0.9031093834900557,2024-05-01 06:08:29.878447,2024-05-01 06:08:30.188182,0 days 00:00:00.309735,,euclidean,3.0,,,Agglomerative,,,,,,,,,,,,,,,complete,,,,3.0,none,,,,,,,20.0,7.305497832156314,,PCA,randomized,,,,,,,,,,,,,,,False,,COMPLETE
358,358,0.9313114633961626,2024-05-01 06:08:30.189233,2024-05-01 06:08:30.478958,0 days 00:00:00.289725,,euclidean,2.0,,,Agglomerative,,,,,,,,,,,,,,,complete,,,,3.0,none,,,,,,,19.0,6.5673744211658445,,PCA,randomized,,,,,,,,,,,,,,,False,,COMPLETE
359,359,0.9516384606899491,2024-05-01 06:08:30.480058,2024-05-01 06:08:30.733053,0 days 00:00:00.252995,,euclidean,2.0,,,Agglomerative,,,,,,,,,,,,,,,complete,,,,4.0,none,,,,,,,15.0,7.135373724661654,,PCA,randomized,,,,,,,,,,,,,,,False,,COMPLETE
360,360,0.903106911034047,2024-05-01 06:08:30.733908,2024-05-01 06:08:31.020663,0 days 00:00:00.286755,,euclidean,3.0,,,Agglomerative,,,,,,,,,,,,,,,complete,,,,4.0,none,,,,,,,15.0,6.417829678919796,,PCA,randomized,,,,,,,,,,,,,,,False,,COMPLETE
361,361,-1.0,2024-05-01 06:08:31.021490,2024-05-01 06:08:42.946117,0 days 00:00:11.924627,,,,,,OPTICS,,,,,,,,,,,,,,,,1000.0,,,,,kd_tree,90.0,dbscan,russellrao,367.0,,,,44.53234216982232,t-SNE,,,,,,,17.03364640638129,pca,90.0,barnes_hut,sokalsneath,2.0,,,,,0.35000000000000003,COMPLETE
362,362,0.9313129838432099,2024-05-01 06:08:42.946793,2024-05-01 06:08:43.170383,0 days 00:00:00.223590,,euclidean,2.0,,,Agglomerative,,,,,,,,,,,,,,,complete,,,,4.0,none,,,,,,,20.0,6.806203692031218,,PCA,randomized,,,,,,,,,,,,,,,False,,COMPLETE
363,363,0.5867024370131124,2024-05-01 06:08:43.171487,2024-05-01 06:08:43.340527,0 days 00:00:00.169040,,,,,,KMeans,,,,,,,,,,elkan,k-means++,8.0,,0.001,,,,,3.0,none,,,,,,,18.0,7.37753630858857,,PCA,randomized,,,,,,,,,,,,,,,False,,COMPLETE
364,364,0.951499513513284,2024-05-01 06:08:43.341631,2024-05-01 06:08:43.584248,0 days 00:00:00.242617,,euclidean,2.0,,,Agglomerative,,,,,,,,,,,,,,,complete,,,,3.0,none,,,,,,,16.0,6.71989896528032,,PCA,arpack,,,,,,,,,,,,,,,False,,COMPLETE
365,365,0.1369863586974801,2024-05-01 06:08:43.585285,2024-05-01 06:08:43.828957,0 days 00:00:00.243672,,cosine,3.0,,,Agglomerative,,,,,,,,,,,,,,,complete,,,,3.0,none,,,,,,,18.0,7.168120476920693,,PCA,randomized,,,,,,,,,,,,,,,False,,COMPLETE
366,366,0.9313129838432099,2024-05-01 06:08:43.829972,2024-05-01 06:08:44.132785,0 days 00:00:00.302813,,euclidean,2.0,,,Agglomerative,,,,,,,,,,,,,,,complete,,,,4.0,none,,,,,,,20.0,6.95257772207546,,PCA,randomized,,,,,,,,,,,,,,,False,,COMPLETE
367,367,0.7915381791180314,2024-05-01 06:08:44.133891,2024-05-01 06:08:44.415098,0 days 00:00:00.281207,,euclidean,5.0,,,Agglomerative,,,,,,,,,,,,,,,complete,,,,4.0,none,,,,,,,18.0,6.427557770820522,,PCA,randomized,,,,,,,,,,,,,,,False,,COMPLETE
368,368,0.9409824986650555,2024-05-01 06:08:44.416174,2024-05-01 06:08:44.687447,0 days 00:00:00.271273,,euclidean,2.0,,,Agglomerative,,,,,,,,,,,,,,,average,,,,3.0,none,,,,,,,17.0,6.61961125067034,,PCA,randomized,,,,,,,,,,,,,,,False,,COMPLETE
369,369,0.9516384603251191,2024-05-01 06:08:44.688493,2024-05-01 06:08:45.078449,0 days 00:00:00.389956,,euclidean,2.0,,,Agglomerative,,,,,,,,,,,,,,,complete,,,,3.0,none,,,,,,,16.0,7.371147129569025,,PCA,randomized,,,,,,,,,,,,,,,False,,COMPLETE
370,370,-1.0,2024-05-01 06:08:45.083480,2024-05-01 06:08:45.206154,0 days 00:00:00.122674,precomputed,,,,cluster_qr,Spectral,14.24948174377495,5.0,lobpcg,,,,,,,,,,,,,,,,3.0,none,,,,,,,19.0,7.1744179607917715,,PCA,randomized,14.0,5.6,4.0,7.0,332.0,,,,,,,,,,False,,COMPLETE
371,371,0.9031093841290714,2024-05-01 06:08:45.207592,2024-05-01 06:08:45.560778,0 days 00:00:00.353186,,euclidean,3.0,,,Agglomerative,,,,,,,,,,,,,,,complete,,,,5.0,none,,,,,,,18.0,6.882348944309332,,PCA,randomized,,,,,,,,,,,,,,,False,,COMPLETE
372,372,0.9313114633961626,2024-05-01 06:08:45.561641,2024-05-01 06:08:45.849186,0 days 00:00:00.287545,,euclidean,2.0,,,Agglomerative,,,,,,,,,,,,,,,complete,,,,3.0,none,,,,,,,19.0,6.69609670642471,,PCA,randomized,,,,,,,,,,,,,,,False,,COMPLETE
373,373,0.9313145218780539,2024-05-01 06:08:45.850004,2024-05-01 06:08:46.114235,0 days 00:00:00.264231,,,2.0,,,Agglomerative,,,,,,,,,,,,,,,ward,,,,16.0,none,,,,,,,15.0,7.445641830161968,,PCA,randomized,,,,,,,,,,,,,,,False,,COMPLETE
374,374,0.9201825094279797,2024-05-01 06:08:46.115392,2024-05-01 06:08:46.367272,0 days 00:00:00.251880,,euclidean,3.0,,,Agglomerative,,,,,,,,,,,,,,,complete,,,,4.0,none,,,,,,,18.0,7.135728258736685,,PCA,randomized,,,,,,,,,,,,,,,False,,COMPLETE
375,375,0.7592237811347758,2024-05-01 06:08:46.368319,2024-05-01 06:08:46.672594,0 days 00:00:00.304275,,euclidean,11.0,,,Agglomerative,,,,,,,,,,,,,,,complete,,,,5.0,none,,,,,,,17.0,6.326936566315559,,PCA,randomized,,,,,,,,,,,,,,,True,,COMPLETE
376,376,0.5577641914149273,2024-05-01 06:08:46.673399,2024-05-01 06:08:46.920300,0 days 00:00:00.246901,,euclidean,19.0,,,Agglomerative,,,,,,,,,,,,,,,complete,,,,3.0,none,,,,,,,16.0,6.950869823341231,,PCA,randomized,,,,,,,,,,,,,,,False,,COMPLETE
377,377,-0.10381446778774261,2024-05-01 06:08:46.921116,2024-05-01 06:08:56.203042,0 days 00:00:09.281926,,,,8.0,,HDBSCAN,,,,2.0,kd_tree,45.0,eom,euclidean,187.0,,,,,,,,0.6000000000000001,2.0,,,,,,,,,,,,UMAP,,,,,,,,,,,,,chebyshev,4.0,457.0,,,COMPLETE
378,378,0.9516406481139925,2024-05-01 06:08:56.204243,2024-05-01 06:08:56.544154,0 days 00:00:00.339911,,euclidean,2.0,,,Agglomerative,,,,,,,,,,,,,,,complete,,,,3.0,none,,,,,,,18.0,6.604831291155036,,PCA,randomized,,,,,,,,,,,,,,,False,,COMPLETE
379,379,0.9516406481139925,2024-05-01 06:08:56.545165,2024-05-01 06:08:56.856637,0 days 00:00:00.311472,,euclidean,2.0,,,Agglomerative,,,,,,,,,,,,,,,complete,,,,3.0,none,,,,,,,18.0,6.5156184294917,,PCA,randomized,,,,,,,,,,,,,,,False,,COMPLETE
380,380,0.9516406481139925,2024-05-01 06:08:56.857664,2024-05-01 06:08:57.130264,0 days 00:00:00.272600,,euclidean,2.0,,,Agglomerative,,,,,,,,,,,,,,,complete,,,,3.0,none,,,,,,,18.0,6.490149312744634,,PCA,randomized,,,,,,,,,,,,,,,False,,COMPLETE
381,381,0.9516406481139925,2024-05-01 06:08:57.131067,2024-05-01 06:08:57.445088,0 days 00:00:00.314021,,euclidean,2.0,,,Agglomerative,,,,,,,,,,,,,,,complete,,,,3.0,none,,,,,,,18.0,6.119198061478051,,PCA,randomized,,,,,,,,,,,,,,,False,,COMPLETE
382,382,0.9031105263318425,2024-05-01 06:08:57.445908,2024-05-01 06:08:57.695645,0 days 00:00:00.249737,,euclidean,3.0,,,Agglomerative,,,,,,,,,,,,,,,complete,,,,2.0,none,,,,,,,18.0,6.135027588687301,,PCA,randomized,,,,,,,,,,,,,,,False,,COMPLETE
383,383,0.9516406481139925,2024-05-01 06:08:57.696460,2024-05-01 06:08:57.948924,0 days 00:00:00.252464,,euclidean,2.0,,,Agglomerative,,,,,,,,,,,,,,,complete,,,,3.0,none,,,,,,,18.0,6.516198435974885,,PCA,randomized,,,,,,,,,,,,,,,False,,COMPLETE
384,384,0.5237375497817993,2024-05-01 06:08:57.949743,2024-05-01 06:09:04.648083,0 days 00:00:06.698340,,euclidean,2.0,,,Agglomerative,,,,,,,,,,,,,,,complete,,,,,,,,,,,,,,33.263603600935255,t-SNE,,,,,,,19.76255461356652,random,60.0,barnes_hut,yule,1.0,,,,,,COMPLETE
385,385,0.903113007747847,2024-05-01 06:09:04.648754,2024-05-01 06:09:04.877080,0 days 00:00:00.228326,,euclidean,3.0,,,Agglomerative,,,,,,,,,,,,,,,complete,,,,3.0,none,,,,,,,18.0,6.306370399687655,,PCA,randomized,,,,,,,,,,,,,,,False,,COMPLETE
386,386,0.9516406481139925,2024-05-01 06:09:04.878101,2024-05-01 06:09:05.132274,0 days 00:00:00.254173,,euclidean,2.0,,,Agglomerative,,,,,,,,,,,,,,,complete,,,,3.0,none,,,,,,,18.0,9.71759705663807,,PCA,randomized,,,,,,,,,,,,,,,False,,COMPLETE
387,387,0.951499384693912,2024-05-01 06:09:05.133275,2024-05-01 06:09:05.386965,0 days 00:00:00.253690,,euclidean,2.0,,,Agglomerative,,,,,,,,,,,,,,,complete,,,,3.0,none,,,,,,,18.0,9.97809147936406,,PCA,arpack,,,,,,,,,,,,,,,False,,COMPLETE
388,388,-1.0,2024-05-01 06:09:05.392076,2024-05-01 06:09:05.567435,0 days 00:00:00.175359,,,,,,OPTICS,,,,,,,,,,,,,,,,100.0,,,3.0,none,kd_tree,60.0,xi,yule,222.0,,17.0,6.120341580894495,,PCA,randomized,,,,,,,,,,,,,,,False,0.1,COMPLETE
389,389,0.903113007747847,2024-05-01 06:09:05.569934,2024-05-01 06:09:05.860326,0 days 00:00:00.290392,,euclidean,3.0,,,Agglomerative,,,,,,,,,,,,,,,complete,,,,3.0,none,,,,,,,18.0,6.338551085005789,,PCA,randomized,,,,,,,,,,,,,,,False,,COMPLETE
390,390,0.9516406481139925,2024-05-01 06:09:05.861354,2024-05-01 06:09:06.119035,0 days 00:00:00.257681,,euclidean,2.0,,,Agglomerative,,,,,,,,,,,,,,,complete,,,,3.0,none,,,,,,,18.0,6.443879687427236,,PCA,randomized,,,,,,,,,,,,,,,False,,COMPLETE
391,391,0.5564818102358936,2024-05-01 06:09:06.120092,2024-05-01 06:09:06.537272,0 days 00:00:00.417180,,,,,,KMeans,,,,,,,,,,lloyd,random,11.0,15.0,1e-06,,,,,3.0,none,,,,,,,17.0,6.580429490917784,,PCA,randomized,,,,,,,,,,,,,,,False,,COMPLETE
392,392,0.8752634580191535,2024-05-01 06:09:06.538110,2024-05-01 06:09:06.796158,0 days 00:00:00.258048,,euclidean,4.0,,,Agglomerative,,,,,,,,,,,,,,,complete,,,,3.0,none,,,,,,,18.0,6.174321838297966,,PCA,randomized,,,,,,,,,,,,,,,False,,COMPLETE
393,393,0.9516406482949871,2024-05-01 06:09:06.797206,2024-05-01 06:09:07.125323,0 days 00:00:00.328117,,euclidean,2.0,,,Agglomerative,,,,,,,,,,,,,,,complete,,,,4.0,none,,,,,,,17.0,6.94152983217669,,PCA,randomized,,,,,,,,,,,,,,,False,,COMPLETE
394,394,-0.1970602199486458,2024-05-01 06:09:07.126330,2024-05-01 06:09:07.441211,0 days 00:00:00.314881,,cosine,3.0,,,Agglomerative,,,,,,,,,,,,,,,complete,,,,4.0,none,,,,,,,17.0,6.972527628758989,,PCA,randomized,,,,,,,,,,,,,,,False,,COMPLETE
395,395,0.9516406482949871,2024-05-01 06:09:07.442302,2024-05-01 06:09:07.762827,0 days 00:00:00.320525,,euclidean,2.0,,,Agglomerative,,,,,,,,,,,,,,,complete,,,,4.0,none,,,,,,,17.0,9.954293086557348,,PCA,randomized,,,,,,,,,,,,,,,False,,COMPLETE
396,396,0.9091204082920435,2024-05-01 06:09:07.763866,2024-05-01 06:09:08.060853,0 days 00:00:00.296987,,euclidean,2.0,,,Agglomerative,,,,,,,,,,,,,,,average,,,,4.0,none,,,,,,,17.0,9.796708924707012,,PCA,randomized,,,,,,,,,,,,,,,True,,COMPLETE
397,397,-1.0,2024-05-01 06:09:08.061866,2024-05-01 06:09:08.379083,0 days 00:00:00.317217,rbf,,,,discretize,Spectral,81.99078467115896,1.0,amg,,,,,,,,,,,,,,,,4.0,none,,,,,,,19.0,9.377497713750182,,PCA,randomized,11.0,3.6,8.0,3.0,442.0,,,,,,,,,,False,,COMPLETE
398,398,0.9516406482949871,2024-05-01 06:09:08.379817,2024-05-01 06:09:08.644319,0 days 00:00:00.264502,,euclidean,2.0,,,Agglomerative,,,,,,,,,,,,,,,complete,,,,4.0,none,,,,,,,17.0,9.148761545884994,,PCA,randomized,,,,,,,,,,,,,,,False,,COMPLETE
399,399,0.9031093841290714,2024-05-01 06:09:08.645330,2024-05-01 06:09:08.907036,0 days 00:00:00.261706,,euclidean,3.0,,,Agglomerative,,,,,,,,,,,,,,,complete,,,,5.0,none,,,,,,,18.0,8.965045269917635,,PCA,randomized,,,,,,,,,,,,,,,False,,COMPLETE
400,400,0.2321067899465561,2024-05-01 06:09:08.907867,2024-05-01 06:09:19.745612,0 days 00:00:10.837745,,euclidean,2.0,,,Agglomerative,,,,,,,,,,,,,,,complete,,0.4,,,,,,,,,,,,,UMAP,,,,,,,,,,,,,hamming,14.0,262.0,,,COMPLETE
401,401,0.9313210966804831,2024-05-01 06:09:19.746677,2024-05-01 06:09:20.016145,0 days 00:00:00.269468,,,2.0,,,Agglomerative,,,,,,,,,,,,,,,ward,,,,4.0,none,,,,,,,17.0,9.864082637053237,,PCA,randomized,,,,,,,,,,,,,,,False,,COMPLETE
402,402,0.9201825094279797,2024-05-01 06:09:20.017196,2024-05-01 06:09:20.274493,0 days 00:00:00.257297,,euclidean,3.0,,,Agglomerative,,,,,,,,,,,,,,,complete,,,,4.0,none,,,,,,,18.0,9.377939423436526,,PCA,randomized,,,,,,,,,,,,,,,False,,COMPLETE
403,403,0.9516393467041664,2024-05-01 06:09:20.275549,2024-05-01 06:09:20.557478,0 days 00:00:00.281929,,euclidean,2.0,,,Agglomerative,,,,,,,,,,,,,,,complete,,,,4.0,none,,,,,,,19.0,6.354708372563654,,PCA,randomized,,,,,,,,,,,,,,,False,,COMPLETE
404,404,0.9516393469025506,2024-05-01 06:09:20.558490,2024-05-01 06:09:20.907162,0 days 00:00:00.348672,,euclidean,2.0,,,Agglomerative,,,,,,,,,,,,,,,complete,,,,5.0,none,,,,,,,18.0,9.64773573316988,,PCA,randomized,,,,,,,,,,,,,,,False,,COMPLETE
405,405,-1.0,2024-05-01 06:09:20.908072,2024-05-01 06:09:21.155672,0 days 00:00:00.247600,,,,1.3000000000000003,,HDBSCAN,,,,8.5,brute,25.0,eom,minkowski,322.0,,,,,,,,,170.0,4.0,none,,,,,,,17.0,9.969081533194215,,PCA,randomized,,,,,,,,,,,,,,,False,,COMPLETE
406,406,0.6286350462772448,2024-05-01 06:09:21.156334,2024-05-01 06:09:21.386761,0 days 00:00:00.230427,,euclidean,12.0,,,Agglomerative,,,,,,,,,,,,,,,complete,,,,3.0,none,,,,,,,18.0,9.240032917177782,,PCA,randomized,,,,,,,,,,,,,,,False,,COMPLETE
407,407,0.9516400756107257,2024-05-01 06:09:21.387852,2024-05-01 06:09:21.683609,0 days 00:00:00.295757,,euclidean,2.0,,,Agglomerative,,,,,,,,,,,,,,,complete,,,,3.0,none,,,,,,,17.0,9.648453547680717,,PCA,randomized,,,,,,,,,,,,,,,False,,COMPLETE
408,408,0.1436697095632553,2024-05-01 06:09:21.684650,2024-05-01 06:12:08.971818,0 days 00:02:47.287168,,euclidean,3.0,,,Agglomerative,,,,,,,,,,,,,,,complete,,,,,,,,,,,,,,17.177987290427037,t-SNE,,,,,,,12.6604665941588,pca,25.0,exact,nan_euclidean,5.0,,,,,,COMPLETE
409,409,0.9516406481139925,2024-05-01 06:12:08.972979,2024-05-01 06:12:09.291170,0 days 00:00:00.318191,,euclidean,2.0,,,Agglomerative,,,,,,,,,,,,,,,complete,,,,3.0,none,,,,,,,18.0,9.472693579331642,,PCA,randomized,,,,,,,,,,,,,,,False,,COMPLETE
410,410,0.931311463780002,2024-05-01 06:12:09.292043,2024-05-01 06:12:09.583506,0 days 00:00:00.291463,,euclidean,2.0,,,Agglomerative,,,,,,,,,,,,,,,complete,,,,4.0,none,,,,,,,18.0,9.6557341968678,,PCA,randomized,,,,,,,,,,,,,,,False,,COMPLETE
411,411,0.9311036667964678,2024-05-01 06:12:09.584337,2024-05-01 06:12:09.865646,0 days 00:00:00.281309,,euclidean,2.0,,,Agglomerative,,,,,,,,,,,,,,,complete,,,,3.0,none,,,,,,,19.0,9.516892540408367,,PCA,arpack,,,,,,,,,,,,,,,False,,COMPLETE
412,412,0.8333834562075759,2024-05-01 06:12:09.866808,2024-05-01 06:12:10.195620,0 days 00:00:00.328812,,euclidean,4.0,,,Agglomerative,,,,,,,,,,,,,,,complete,,,,4.0,none,,,,,,,18.0,9.500405774530304,,PCA,randomized,,,,,,,,,,,,,,,False,,COMPLETE
413,413,0.9516406481139925,2024-05-01 06:12:10.196751,2024-05-01 06:12:10.547206,0 days 00:00:00.350455,,euclidean,2.0,,,Agglomerative,,,,,,,,,,,,,,,complete,,,,3.0,none,,,,,,,18.0,9.79497106294836,,PCA,randomized,,,,,,,,,,,,,,,False,,COMPLETE
414,414,0.5540384781357721,2024-05-01 06:12:10.548057,2024-05-01 06:12:10.802546,0 days 00:00:00.254489,,euclidean,16.0,,,Agglomerative,,,,,,,,,,,,,,,complete,,,,3.0,none,,,,,,,19.0,9.750910902739198,,PCA,randomized,,,,,,,,,,,,,,,False,,COMPLETE
415,415,-1.0,2024-05-01 06:12:10.803746,2024-05-01 06:12:10.954357,0 days 00:00:00.150611,,,,,,OPTICS,,,,,,,,,,,,,,,,10000.0,,,20.0,none,brute,40.0,dbscan,mahalanobis,287.0,,18.0,9.478833427051331,,PCA,randomized,,,,,,,,,,,,,,,False,0.55,COMPLETE
416,416,0.903113007747847,2024-05-01 06:12:10.955957,2024-05-01 06:12:11.259952,0 days 00:00:00.303995,,euclidean,3.0,,,Agglomerative,,,,,,,,,,,,,,,complete,,,,3.0,none,,,,,,,18.0,9.610633504333673,,PCA,randomized,,,,,,,,,,,,,,,False,,COMPLETE
417,417,0.662065308506338,2024-05-01 06:12:11.260809,2024-05-01 06:12:11.541689,0 days 00:00:00.280880,,,,,,KMeans,,,,,,,,,,elkan,random,4.0,5.0,1e-05,,,,,3.0,none,,,,,,,19.0,9.211449588009218,,PCA,randomized,,,,,,,,,,,,,,,False,,COMPLETE
418,418,0.931311463780002,2024-05-01 06:12:11.542717,2024-05-01 06:12:11.791444,0 days 00:00:00.248727,,euclidean,2.0,,,Agglomerative,,,,,,,,,,,,,,,complete,,,,4.0,none,,,,,,,18.0,9.13873539188704,,PCA,randomized,,,,,,,,,,,,,,,False,,COMPLETE
419,419,0.8811892109117707,2024-05-01 06:12:11.792269,2024-05-01 06:12:12.056502,0 days 00:00:00.264233,,euclidean,3.0,,,Agglomerative,,,,,,,,,,,,,,,complete,,,,2.0,none,,,,,,,18.0,9.840036268607646,,PCA,randomized,,,,,,,,,,,,,,,True,,COMPLETE
420,420,0.9516406481139925,2024-05-01 06:12:12.057559,2024-05-01 06:12:12.318111,0 days 00:00:00.260552,,euclidean,2.0,,,Agglomerative,,,,,,,,,,,,,,,complete,,,,3.0,none,,,,,,,18.0,9.384905328840997,,PCA,randomized,,,,,,,,,,,,,,,False,,COMPLETE
421,421,0.931311463780002,2024-05-01 06:12:12.318940,2024-05-01 06:12:12.582142,0 days 00:00:00.263202,,euclidean,2.0,,,Agglomerative,,,,,,,,,,,,,,,complete,,,,4.0,none,,,,,,,18.0,9.774375941437306,,PCA,randomized,,,,,,,,,,,,,,,False,,COMPLETE
422,422,0.951640648027545,2024-05-01 06:12:12.583198,2024-05-01 06:12:12.875841,0 days 00:00:00.292643,,euclidean,2.0,,,Agglomerative,,,,,,,,,,,,,,,complete,,,,2.0,none,,,,,,,19.0,9.32590532297654,,PCA,randomized,,,,,,,,,,,,,,,False,,COMPLETE
423,423,0.903113007747847,2024-05-01 06:12:12.876685,2024-05-01 06:12:13.184045,0 days 00:00:00.307360,,euclidean,3.0,,,Agglomerative,,,,,,,,,,,,,,,complete,,,,3.0,none,,,,,,,18.0,9.94521639211292,,PCA,randomized,,,,,,,,,,,,,,,False,,COMPLETE
424,424,0.46455928683280945,2024-05-01 06:12:13.184915,2024-05-01 06:12:22.526038,0 days 00:00:09.341123,,cosine,13.0,,,Agglomerative,,,,,,,,,,,,,,,complete,,0.15000000000000002,,,,,,,,,,,,,UMAP,,,,,,,,,,,,,sokalsneath,17.0,42.0,,,COMPLETE
425,425,-1.0,2024-05-01 06:12:22.526861,2024-05-01 06:12:22.677391,0 days 00:00:00.150530,precomputed,,,,kmeans,Spectral,38.85731675586672,2.0,arpack,,,,,,,,,,,,,,,,4.0,none,,,,,,,18.0,9.175843976686739,,PCA,randomized,8.0,8.1,13.0,11.0,227.0,,,,,,,,,,False,,COMPLETE
426,426,0.951640648027545,2024-05-01 06:12:22.678889,2024-05-01 06:12:23.025798,0 days 00:00:00.346909,,euclidean,2.0,,,Agglomerative,,,,,,,,,,,,,,,complete,,,,2.0,none,,,,,,,19.0,9.02002983464493,,PCA,randomized,,,,,,,,,,,,,,,False,,COMPLETE
427,427,0.9516393469025506,2024-05-01 06:12:23.026645,2024-05-01 06:12:23.362637,0 days 00:00:00.335992,,euclidean,2.0,,,Agglomerative,,,,,,,,,,,,,,,complete,,,,5.0,none,,,,,,,18.0,9.596832615119622,,PCA,randomized,,,,,,,,,,,,,,,False,,COMPLETE
428,428,0.7260552782886545,2024-05-01 06:12:23.363488,2024-05-01 06:12:23.658558,0 days 00:00:00.295070,,,3.0,,,Agglomerative,,,,,,,,,,,,,,,ward,,,,3.0,none,,,,,,,18.0,9.553625286894619,,PCA,randomized,,,,,,,,,,,,,,,False,,COMPLETE
429,429,0.951640648027545,2024-05-01 06:12:23.659414,2024-05-01 06:12:23.924944,0 days 00:00:00.265530,,euclidean,2.0,,,Agglomerative,,,,,,,,,,,,,,,average,,,,2.0,none,,,,,,,19.0,8.816781906310785,,PCA,randomized,,,,,,,,,,,,,,,False,,COMPLETE
