,number,value,datetime_start,datetime_complete,duration,params_affinity,params_agglo_metric,params_agglo_n,params_alpha,params_assign_lables,params_clusterer,params_coef0,params_degree,params_eigen_solver,params_epsilon,params_hdbscan_algo,params_hdbscan_leaf_size,params_hdbscan_method,params_hdbscan_metric,params_hdbscan_n,params_kmeans_algo,params_kmeans_init,params_kmeans_n,params_kmeans_n_init,params_kmeans_tol,params_linkage,params_max_eps,params_min_dist,params_min_samples,params_n_oversamples,params_normalizer,params_optics_algo,params_optics_leaf_size,params_optics_method,params_optics_metric,params_optics_n,params_p,params_pca_n,params_pca_tol,params_perplexity,params_reducer,params_solver,params_spec_cluster,params_spec_gamma,params_spec_n,params_spec_n_init,params_spec_n_neighbors,params_tightness,params_tsne_init,params_tsne_lr,params_tsne_method,params_tsne_metric,params_tsne_n,params_umap_metric,params_umap_n,params_umap_n_neighbors,params_whiten,params_xi,state
515,515,0.16602890193462372,2024-05-01 06:19:14.464030,2024-05-01 06:19:26.595759,0 days 00:00:12.131729,,euclidean,2.0,,,Agglomerative,,,,,,,,,,,,,,,average,,0.8,,,,,,,,,,,,,UMAP,,,,,,,,,,,,,russellrao,11.0,452.0,,,COMPLETE
516,516,-0.08494743829731016,2024-05-01 06:19:26.596630,2024-05-01 06:19:26.842898,0 days 00:00:00.246268,,cosine,3.0,,,Agglomerative,,,,,,,,,,,,,,,average,,,,2.0,none,,,,,,,3.0,9.448104053774486,,PCA,randomized,,,,,,,,,,,,,,,False,,COMPLETE
517,517,0.9516454913654608,2024-05-01 06:19:26.844066,2024-05-01 06:19:27.092829,0 days 00:00:00.248763,,euclidean,2.0,,,Agglomerative,,,,,,,,,,,,,,,average,,,,2.0,none,,,,,,,3.0,9.66894799422969,,PCA,randomized,,,,,,,,,,,,,,,False,,COMPLETE
518,518,0.9516470634351011,2024-05-01 06:19:27.093902,2024-05-01 06:19:27.329027,0 days 00:00:00.235125,,manhattan,2.0,,,Agglomerative,,,,,,,,,,,,,,,average,,,,1.0,none,,,,,,,3.0,9.24867876164017,,PCA,randomized,,,,,,,,,,,,,,,False,,COMPLETE
519,519,0.9516454908965979,2024-05-01 06:19:27.330081,2024-05-01 06:19:27.575039,0 days 00:00:00.244958,,euclidean,2.0,,,Agglomerative,,,,,,,,,,,,,,,average,,,,1.0,none,,,,,,,4.0,9.331121845310005,,PCA,randomized,,,,,,,,,,,,,,,False,,COMPLETE
520,520,0.9093552803539986,2024-05-01 06:19:27.575922,2024-05-01 06:19:27.967739,0 days 00:00:00.391817,,manhattan,3.0,,,Agglomerative,,,,,,,,,,,,,,,average,,,,1.0,none,,,,,,,3.0,9.586280271312718,,PCA,randomized,,,,,,,,,,,,,,,False,,COMPLETE
521,521,0.20281954109668732,2024-05-01 06:19:27.968897,2024-05-01 06:23:13.233637,0 days 00:03:45.264740,,manhattan,2.0,,,Agglomerative,,,,,,,,,,,,,,,average,,,,,,,,,,,,,,49.18620558254273,t-SNE,,,,,,,15.660087422151022,random,35.0,exact,cityblock,17.0,,,,,,COMPLETE
522,522,0.9516470634351011,2024-05-01 06:23:13.234799,2024-05-01 06:23:13.477973,0 days 00:00:00.243174,,manhattan,2.0,,,Agglomerative,,,,,,,,,,,,,,,average,,,,1.0,none,,,,,,,3.0,9.070904668535738,,PCA,randomized,,,,,,,,,,,,,,,False,,COMPLETE
523,523,-1.0,2024-05-01 06:23:13.479049,2024-05-01 06:23:13.650209,0 days 00:00:00.171160,,,,,,OPTICS,,,,,,,,,,,,,,,,1.0,,,1.0,none,kd_tree,65.0,dbscan,minkowski,122.0,,3.0,9.164979129303934,,PCA,randomized,,,,,,,,,,,,,,,False,0.75,COMPLETE
524,524,0.9093506015986997,2024-05-01 06:23:13.651052,2024-05-01 06:23:13.884374,0 days 00:00:00.233322,,manhattan,3.0,,,Agglomerative,,,,,,,,,,,,,,,average,,,,1.0,none,,,,,,,4.0,9.45118525246398,,PCA,randomized,,,,,,,,,,,,,,,False,,COMPLETE
525,525,0.5523716198044105,2024-05-01 06:23:13.885466,2024-05-01 06:23:14.059238,0 days 00:00:00.173772,,,,,,KMeans,,,,,,,,,,elkan,k-means++,18.0,,1.0,,,,,1.0,none,,,,,,,4.0,9.75358146294478,,PCA,randomized,,,,,,,,,,,,,,,False,,COMPLETE
526,526,0.9516470634351011,2024-05-01 06:23:14.060139,2024-05-01 06:23:14.337408,0 days 00:00:00.277269,,manhattan,2.0,,,Agglomerative,,,,,,,,,,,,,,,average,,,,1.0,none,,,,,,,3.0,9.213435553509516,,PCA,randomized,,,,,,,,,,,,,,,False,,COMPLETE
527,527,0.9532357462135064,2024-05-01 06:23:14.343779,2024-05-01 06:23:14.589352,0 days 00:00:00.245573,,manhattan,2.0,,,Agglomerative,,,,,,,,,,,,,,,average,,,,1.0,none,,,,,,,3.0,9.274647385327498,,PCA,randomized,,,,,,,,,,,,,,,True,,COMPLETE
528,528,0.9532357462135064,2024-05-01 06:23:14.590219,2024-05-01 06:23:14.872445,0 days 00:00:00.282226,,manhattan,2.0,,,Agglomerative,,,,,,,,,,,,,,,average,,,,1.0,none,,,,,,,3.0,9.268106188919356,,PCA,randomized,,,,,,,,,,,,,,,True,,COMPLETE
529,529,0.9267847662589,2024-05-01 06:23:14.873521,2024-05-01 06:23:15.153846,0 days 00:00:00.280325,,manhattan,3.0,,,Agglomerative,,,,,,,,,,,,,,,average,,,,1.0,none,,,,,,,3.0,9.337159833424417,,PCA,randomized,,,,,,,,,,,,,,,True,,COMPLETE
530,530,0.9472133311895985,2024-05-01 06:23:15.154724,2024-05-01 06:23:15.439507,0 days 00:00:00.284783,,manhattan,2.0,,,Agglomerative,,,,,,,,,,,,,,,average,,,,1.0,none,,,,,,,4.0,9.497902002237245,,PCA,randomized,,,,,,,,,,,,,,,True,,COMPLETE
531,531,0.9267847662589,2024-05-01 06:23:15.440374,2024-05-01 06:23:15.717029,0 days 00:00:00.276655,,manhattan,3.0,,,Agglomerative,,,,,,,,,,,,,,,average,,,,1.0,none,,,,,,,3.0,9.257595102028349,,PCA,randomized,,,,,,,,,,,,,,,True,,COMPLETE
532,532,0.9532357462135064,2024-05-01 06:23:15.717901,2024-05-01 06:23:15.960147,0 days 00:00:00.242246,,manhattan,2.0,,,Agglomerative,,,,,,,,,,,,,,,average,,,,1.0,none,,,,,,,3.0,9.601744880335014,,PCA,randomized,,,,,,,,,,,,,,,True,,COMPLETE
533,533,0.1966790745483493,2024-05-01 06:23:15.961017,2024-05-01 06:23:16.277567,0 days 00:00:00.316550,nearest_neighbors,,,,cluster_qr,Spectral,61.60255333761369,4.0,lobpcg,,,,,,,,,,,,,,,,1.0,none,,,,,,,3.0,9.582158508335223,,PCA,arpack,9.0,1.6,4.0,20.0,127.0,,,,,,,,,,True,,COMPLETE
534,534,0.9472133311895985,2024-05-01 06:23:16.278929,2024-05-01 06:23:16.547847,0 days 00:00:00.268918,,manhattan,2.0,,,Agglomerative,,,,,,,,,,,,,,,average,,,,1.0,none,,,,,,,4.0,9.706788353668907,,PCA,randomized,,,,,,,,,,,,,,,True,,COMPLETE
535,535,0.834093771863466,2024-05-01 06:23:16.548725,2024-05-01 06:23:16.796233,0 days 00:00:00.247508,,,2.0,,,Agglomerative,,,,,,,,,,,,,,,ward,,,,1.0,none,,,,,,,3.0,9.8489365134656,,PCA,randomized,,,,,,,,,,,,,,,True,,COMPLETE
536,536,0.798197249862118,2024-05-01 06:23:16.797087,2024-05-01 06:23:17.037725,0 days 00:00:00.240638,,manhattan,11.0,,,Agglomerative,,,,,,,,,,,,,,,average,,,,1.0,none,,,,,,,4.0,9.472831113617053,,PCA,randomized,,,,,,,,,,,,,,,True,,COMPLETE
537,537,0.45305028557777405,2024-05-01 06:23:17.038585,2024-05-01 06:23:28.195593,0 days 00:00:11.157008,,manhattan,9.0,,,Agglomerative,,,,,,,,,,,,,,,average,,0.7000000000000001,,,,,,,,,,,,,UMAP,,,,,,,,,,,,,manhattan,16.0,482.0,,,COMPLETE
538,538,0.9267847662589,2024-05-01 06:23:28.196451,2024-05-01 06:23:28.450118,0 days 00:00:00.253667,,manhattan,3.0,,,Agglomerative,,,,,,,,,,,,,,,average,,,,1.0,none,,,,,,,3.0,9.606695950667644,,PCA,randomized,,,,,,,,,,,,,,,True,,COMPLETE
539,539,0.9532357462135064,2024-05-01 06:23:28.451253,2024-05-01 06:23:28.698260,0 days 00:00:00.247007,,manhattan,2.0,,,Agglomerative,,,,,,,,,,,,,,,average,,,,1.0,none,,,,,,,3.0,9.237167562622565,,PCA,randomized,,,,,,,,,,,,,,,True,,COMPLETE
540,540,0.9532357462135064,2024-05-01 06:23:28.699405,2024-05-01 06:23:28.940732,0 days 00:00:00.241327,,manhattan,2.0,,,Agglomerative,,,,,,,,,,,,,,,average,,,,1.0,none,,,,,,,3.0,9.826260288642715,,PCA,randomized,,,,,,,,,,,,,,,True,,COMPLETE
541,541,-1.0,2024-05-01 06:23:28.941598,2024-05-01 06:23:29.095123,0 days 00:00:00.153525,,,,8.8,,HDBSCAN,,,,4.7,kd_tree,45.0,eom,jensenshannon,52.0,,,,,,,,,48.0,1.0,none,,,,,,,3.0,9.838978211986316,,PCA,randomized,,,,,,,,,,,,,,,True,,COMPLETE
542,542,0.9476772559199801,2024-05-01 06:23:29.096194,2024-05-01 06:23:29.413672,0 days 00:00:00.317478,,manhattan,3.0,,,Agglomerative,,,,,,,,,,,,,,,average,,,,1.0,none,,,,,,,4.0,9.815256044006066,,PCA,randomized,,,,,,,,,,,,,,,True,,COMPLETE
543,543,0.9532357462135064,2024-05-01 06:23:29.414910,2024-05-01 06:23:29.647368,0 days 00:00:00.232458,,manhattan,2.0,,,Agglomerative,,,,,,,,,,,,,,,average,,,,1.0,none,,,,,,,3.0,9.968942424734479,,PCA,randomized,,,,,,,,,,,,,,,True,,COMPLETE
544,544,0.5790748596191406,2024-05-01 06:23:29.648254,2024-05-01 06:23:34.759460,0 days 00:00:05.111206,,manhattan,2.0,,,Agglomerative,,,,,,,,,,,,,,,average,,,,,,,,,,,,,,15.006104969942827,t-SNE,,,,,,,7.919332512137686,pca,60.0,barnes_hut,russellrao,1.0,,,,,,COMPLETE
545,545,0.9532357462135064,2024-05-01 06:23:34.760214,2024-05-01 06:23:34.987719,0 days 00:00:00.227505,,manhattan,2.0,,,Agglomerative,,,,,,,,,,,,,,,average,,,,1.0,none,,,,,,,3.0,9.962510974463141,,PCA,randomized,,,,,,,,,,,,,,,True,,COMPLETE
546,546,0.8738209471427201,2024-05-01 06:23:34.988591,2024-05-01 06:23:35.293065,0 days 00:00:00.304474,,,3.0,,,Agglomerative,,,,,,,,,,,,,,,ward,,,,1.0,none,,,,,,,4.0,9.956226915638007,,PCA,randomized,,,,,,,,,,,,,,,True,,COMPLETE
547,547,0.8934726564036833,2024-05-01 06:23:35.293947,2024-05-01 06:23:35.531907,0 days 00:00:00.237960,,manhattan,4.0,,,Agglomerative,,,,,,,,,,,,,,,average,,,,1.0,none,,,,,,,3.0,9.86478424009106,,PCA,randomized,,,,,,,,,,,,,,,True,,COMPLETE
548,548,0.9532357462135064,2024-05-01 06:23:35.532803,2024-05-01 06:23:35.771739,0 days 00:00:00.238936,,manhattan,2.0,,,Agglomerative,,,,,,,,,,,,,,,average,,,,1.0,none,,,,,,,3.0,9.972694178728478,,PCA,randomized,,,,,,,,,,,,,,,True,,COMPLETE
549,549,0.9472133311895985,2024-05-01 06:23:35.772625,2024-05-01 06:23:36.014808,0 days 00:00:00.242183,,manhattan,2.0,,,Agglomerative,,,,,,,,,,,,,,,average,,,,1.0,none,,,,,,,4.0,9.91805074113136,,PCA,randomized,,,,,,,,,,,,,,,True,,COMPLETE
550,550,-1.0,2024-05-01 06:23:36.015917,2024-05-01 06:23:37.343812,0 days 00:00:01.327895,,,,,,OPTICS,,,,,,,,,,,,,,,,100.0,,,1.0,none,brute,10.0,dbscan,chebyshev,187.0,,5.0,9.971690435198715,,PCA,randomized,,,,,,,,,,,,,,,True,0.9,COMPLETE
551,551,0.9267847662589,2024-05-01 06:23:37.344517,2024-05-01 06:23:37.581241,0 days 00:00:00.236724,,manhattan,3.0,,,Agglomerative,,,,,,,,,,,,,,,average,,,,1.0,none,,,,,,,3.0,9.658259681887841,,PCA,randomized,,,,,,,,,,,,,,,True,,COMPLETE
552,552,0.9532357462135064,2024-05-01 06:23:37.582160,2024-05-01 06:23:37.820093,0 days 00:00:00.237933,,manhattan,2.0,,,Agglomerative,,,,,,,,,,,,,,,average,,,,1.0,none,,,,,,,3.0,9.986144328680684,,PCA,randomized,,,,,,,,,,,,,,,True,,COMPLETE
553,553,0.36320039261041837,2024-05-01 06:23:37.821020,2024-05-01 06:23:37.982997,0 days 00:00:00.161977,,,,,,KMeans,,,,,,,,,,lloyd,random,8.0,6.0,0.0001,,,,,1.0,none,,,,,,,4.0,9.99290590111469,,PCA,randomized,,,,,,,,,,,,,,,True,,COMPLETE
554,554,0.9532357462135064,2024-05-01 06:23:37.983925,2024-05-01 06:23:38.229342,0 days 00:00:00.245417,,manhattan,2.0,,,Agglomerative,,,,,,,,,,,,,,,average,,,,1.0,none,,,,,,,3.0,9.984376394757748,,PCA,randomized,,,,,,,,,,,,,,,True,,COMPLETE
555,555,0.8850874331520209,2024-05-01 06:23:38.230448,2024-05-01 06:23:38.490806,0 days 00:00:00.260358,,manhattan,2.0,,,Agglomerative,,,,,,,,,,,,,,,average,,,,1.0,none,,,,,,,3.0,9.96919589087739,,PCA,arpack,,,,,,,,,,,,,,,True,,COMPLETE
556,556,0.9267847662589,2024-05-01 06:23:38.491912,2024-05-01 06:23:38.744320,0 days 00:00:00.252408,,manhattan,3.0,,,Agglomerative,,,,,,,,,,,,,,,average,,,,1.0,none,,,,,,,3.0,9.711487516833333,,PCA,randomized,,,,,,,,,,,,,,,True,,COMPLETE
557,557,0.9532357462135064,2024-05-01 06:23:38.745202,2024-05-01 06:23:39.000808,0 days 00:00:00.255606,,manhattan,2.0,,,Agglomerative,,,,,,,,,,,,,,,average,,,,1.0,none,,,,,,,3.0,9.690567364585718,,PCA,randomized,,,,,,,,,,,,,,,True,,COMPLETE
558,558,0.9472133311895985,2024-05-01 06:23:39.001929,2024-05-01 06:23:39.267071,0 days 00:00:00.265142,,manhattan,2.0,,,Agglomerative,,,,,,,,,,,,,,,average,,,,1.0,none,,,,,,,4.0,9.993680187828595,,PCA,randomized,,,,,,,,,,,,,,,True,,COMPLETE
559,559,0.9532357462135064,2024-05-01 06:23:39.268057,2024-05-01 06:23:39.507048,0 days 00:00:00.238991,,manhattan,2.0,,,Agglomerative,,,,,,,,,,,,,,,average,,,,1.0,none,,,,,,,3.0,9.72451544801864,,PCA,randomized,,,,,,,,,,,,,,,True,,COMPLETE
560,560,0.9267847662589,2024-05-01 06:23:39.507955,2024-05-01 06:23:39.783918,0 days 00:00:00.275963,,manhattan,3.0,,,Agglomerative,,,,,,,,,,,,,,,average,,,,1.0,none,,,,,,,3.0,9.67838941903982,,PCA,randomized,,,,,,,,,,,,,,,True,,COMPLETE
561,561,-1.0,2024-05-01 06:23:39.784811,2024-05-01 06:23:39.921472,0 days 00:00:00.136661,precomputed,,,,discretize,Spectral,72.05811781236817,5.0,arpack,,,,,,,,,,,,,,,,1.0,none,,,,,,,4.0,9.741222977650699,,PCA,randomized,6.0,4.1,13.0,13.0,417.0,,,,,,,,,,True,,COMPLETE
562,562,0.5551387071609497,2024-05-01 06:23:39.922206,2024-05-01 06:23:52.434140,0 days 00:00:12.511934,,manhattan,17.0,,,Agglomerative,,,,,,,,,,,,,,,average,,0.1,,,,,,,,,,,,,UMAP,,,,,,,,,,,,,yule,13.0,352.0,,,COMPLETE
563,563,0.6731618443728996,2024-05-01 06:23:52.435047,2024-05-01 06:23:52.736725,0 days 00:00:00.301678,,manhattan,15.0,,,Agglomerative,,,,,,,,,,,,,,,average,,,,1.0,none,,,,,,,3.0,9.991596405358937,,PCA,randomized,,,,,,,,,,,,,,,True,,COMPLETE
564,564,0.9532357462135064,2024-05-01 06:23:52.737613,2024-05-01 06:23:52.973442,0 days 00:00:00.235829,,manhattan,2.0,,,Agglomerative,,,,,,,,,,,,,,,average,,,,1.0,none,,,,,,,3.0,9.723509331427369,,PCA,randomized,,,,,,,,,,,,,,,True,,COMPLETE
565,565,0.9472133311895985,2024-05-01 06:23:52.974321,2024-05-01 06:23:53.220544,0 days 00:00:00.246223,,manhattan,2.0,,,Agglomerative,,,,,,,,,,,,,,,average,,,,1.0,none,,,,,,,4.0,9.437514171661206,,PCA,randomized,,,,,,,,,,,,,,,True,,COMPLETE
566,566,0.9532357462135064,2024-05-01 06:23:53.221455,2024-05-01 06:23:53.474760,0 days 00:00:00.253305,,manhattan,2.0,,,Agglomerative,,,,,,,,,,,,,,,average,,,,1.0,none,,,,,,,3.0,9.677041784619181,,PCA,randomized,,,,,,,,,,,,,,,True,,COMPLETE
567,567,-1.0,2024-05-01 06:23:53.475753,2024-05-01 06:23:53.719430,0 days 00:00:00.243677,,,,3.7,,HDBSCAN,,,,8.5,ball_tree,85.0,leaf,sokalmichener,237.0,,,,,,,,,26.0,1.0,none,,,,,,,2.0,9.60998488637104,,PCA,randomized,,,,,,,,,,,,,,,True,,COMPLETE
568,568,0.9267847662589,2024-05-01 06:23:53.720147,2024-05-01 06:23:53.970385,0 days 00:00:00.250238,,manhattan,3.0,,,Agglomerative,,,,,,,,,,,,,,,average,,,,1.0,none,,,,,,,3.0,9.36646241139613,,PCA,randomized,,,,,,,,,,,,,,,True,,COMPLETE
569,569,0.18305236101150513,2024-05-01 06:23:53.971305,2024-05-01 06:25:46.643227,0 days 00:01:52.671922,,manhattan,2.0,,,Agglomerative,,,,,,,,,,,,,,,average,,,,,,,,,,,,,,8.243538214033464,t-SNE,,,,,,,14.741105845307517,random,80.0,exact,hamming,4.0,,,,,,COMPLETE
570,570,0.9532357462135064,2024-05-01 06:25:46.644117,2024-05-01 06:25:46.890452,0 days 00:00:00.246335,,manhattan,2.0,,,Agglomerative,,,,,,,,,,,,,,,average,,,,1.0,none,,,,,,,3.0,9.771079035171585,,PCA,randomized,,,,,,,,,,,,,,,True,,COMPLETE
571,571,0.9472133311895985,2024-05-01 06:25:46.891607,2024-05-01 06:25:47.137626,0 days 00:00:00.246019,,manhattan,2.0,,,Agglomerative,,,,,,,,,,,,,,,average,,,,1.0,none,,,,,,,4.0,9.557353576361434,,PCA,randomized,,,,,,,,,,,,,,,True,,COMPLETE
572,572,0.9518219362694045,2024-05-01 06:25:47.138757,2024-05-01 06:25:47.379043,0 days 00:00:00.240286,,manhattan,3.0,,,Agglomerative,,,,,,,,,,,,,,,average,,,,1.0,none,,,,,,,2.0,9.765906754510663,,PCA,randomized,,,,,,,,,,,,,,,True,,COMPLETE
573,573,0.9518219362694045,2024-05-01 06:25:47.380206,2024-05-01 06:25:47.666691,0 days 00:00:00.286485,,manhattan,3.0,,,Agglomerative,,,,,,,,,,,,,,,average,,,,1.0,none,,,,,,,2.0,9.812750447713919,,PCA,randomized,,,,,,,,,,,,,,,True,,COMPLETE
574,574,0.9518219362694045,2024-05-01 06:25:47.669534,2024-05-01 06:25:47.902938,0 days 00:00:00.233404,,manhattan,3.0,,,Agglomerative,,,,,,,,,,,,,,,average,,,,1.0,none,,,,,,,2.0,4.879648760871567,,PCA,randomized,,,,,,,,,,,,,,,True,,COMPLETE
575,575,0.8926440250611231,2024-05-01 06:25:47.903883,2024-05-01 06:25:48.196851,0 days 00:00:00.292968,,manhattan,4.0,,,Agglomerative,,,,,,,,,,,,,,,average,,,,1.0,none,,,,,,,2.0,9.973854542001568,,PCA,randomized,,,,,,,,,,,,,,,True,,COMPLETE
576,576,0.9518219362694045,2024-05-01 06:25:48.197778,2024-05-01 06:25:48.488893,0 days 00:00:00.291115,,manhattan,3.0,,,Agglomerative,,,,,,,,,,,,,,,average,,,,1.0,none,,,,,,,2.0,9.784278724025972,,PCA,randomized,,,,,,,,,,,,,,,True,,COMPLETE
577,577,0.9518219362694045,2024-05-01 06:25:48.493522,2024-05-01 06:25:48.724990,0 days 00:00:00.231468,,manhattan,3.0,,,Agglomerative,,,,,,,,,,,,,,,average,,,,1.0,none,,,,,,,2.0,4.752979094169367,,PCA,randomized,,,,,,,,,,,,,,,True,,COMPLETE
578,578,0.841847106984344,2024-05-01 06:25:48.726121,2024-05-01 06:25:48.975149,0 days 00:00:00.249028,,manhattan,4.0,,,Agglomerative,,,,,,,,,,,,,,,average,,,,1.0,QR,,,,,,,2.0,4.666134428854539,,PCA,randomized,,,,,,,,,,,,,,,True,,COMPLETE
579,579,-1.0,2024-05-01 06:25:48.976064,2024-05-01 06:25:50.487803,0 days 00:00:01.511739,,,,,,OPTICS,,,,,,,,,,,,,,,,inf,,,1.0,none,auto,90.0,xi,dice,357.0,,2.0,4.913092567510358,,PCA,randomized,,,,,,,,,,,,,,,True,0.55,COMPLETE
580,580,0.8418471069843432,2024-05-01 06:25:50.488523,2024-05-01 06:25:50.701032,0 days 00:00:00.212509,,manhattan,4.0,,,Agglomerative,,,,,,,,,,,,,,,average,,,,1.0,none,,,,,,,2.0,4.870418129476531,,PCA,arpack,,,,,,,,,,,,,,,True,,COMPLETE
581,581,0.8926440250611231,2024-05-01 06:25:50.701921,2024-05-01 06:25:50.946025,0 days 00:00:00.244104,,manhattan,4.0,,,Agglomerative,,,,,,,,,,,,,,,average,,,,1.0,none,,,,,,,2.0,4.875085595241716,,PCA,randomized,,,,,,,,,,,,,,,True,,COMPLETE
582,582,0.4663636859731414,2024-05-01 06:25:50.946911,2024-05-01 06:25:51.254977,0 days 00:00:00.308066,,,,,,KMeans,,,,,,,,,,elkan,random,14.0,13.0,1e-06,,,,,1.0,none,,,,,,,2.0,4.502394402299578,,PCA,randomized,,,,,,,,,,,,,,,True,,COMPLETE
583,583,0.9518219362694045,2024-05-01 06:25:51.255934,2024-05-01 06:25:51.503028,0 days 00:00:00.247094,,manhattan,3.0,,,Agglomerative,,,,,,,,,,,,,,,average,,,,1.0,none,,,,,,,2.0,5.012231474363235,,PCA,randomized,,,,,,,,,,,,,,,True,,COMPLETE
584,584,0.8926440250611231,2024-05-01 06:25:51.504155,2024-05-01 06:25:51.747063,0 days 00:00:00.242908,,manhattan,4.0,,,Agglomerative,,,,,,,,,,,,,,,average,,,,1.0,none,,,,,,,2.0,4.222471832401003,,PCA,randomized,,,,,,,,,,,,,,,True,,COMPLETE
585,585,0.5179657340049744,2024-05-01 06:25:51.748206,2024-05-01 06:26:01.856039,0 days 00:00:10.107833,,manhattan,4.0,,,Agglomerative,,,,,,,,,,,,,,,average,,0.45,,,,,,,,,,,,,UMAP,,,,,,,,,,,,,euclidean,18.0,292.0,,,COMPLETE
586,586,0.8926440250611231,2024-05-01 06:26:01.856930,2024-05-01 06:26:02.107532,0 days 00:00:00.250602,,manhattan,4.0,,,Agglomerative,,,,,,,,,,,,,,,average,,,,1.0,none,,,,,,,2.0,4.512163816670146,,PCA,randomized,,,,,,,,,,,,,,,True,,COMPLETE
587,587,0.8926440250611231,2024-05-01 06:26:02.108439,2024-05-01 06:26:02.359845,0 days 00:00:00.251406,,manhattan,4.0,,,Agglomerative,,,,,,,,,,,,,,,average,,,,1.0,none,,,,,,,2.0,4.324554834417181,,PCA,randomized,,,,,,,,,,,,,,,True,,COMPLETE
588,588,-1.0,2024-05-01 06:26:02.360749,2024-05-01 06:26:02.609159,0 days 00:00:00.248410,rbf,,,,kmeans,Spectral,32.4784890114084,1.0,amg,,,,,,,,,,,,,,,,1.0,none,,,,,,,2.0,9.82954583980528,,PCA,randomized,2.0,9.1,19.0,3.0,317.0,,,,,,,,,,True,,COMPLETE
589,589,0.9518219362694045,2024-05-01 06:26:02.610072,2024-05-01 06:26:02.854790,0 days 00:00:00.244718,,manhattan,3.0,,,Agglomerative,,,,,,,,,,,,,,,average,,,,1.0,none,,,,,,,2.0,4.680243167075044,,PCA,randomized,,,,,,,,,,,,,,,True,,COMPLETE
590,590,0.8926440250611231,2024-05-01 06:26:02.859765,2024-05-01 06:26:03.126417,0 days 00:00:00.266652,,manhattan,4.0,,,Agglomerative,,,,,,,,,,,,,,,average,,,,1.0,none,,,,,,,2.0,4.707795291273674,,PCA,randomized,,,,,,,,,,,,,,,True,,COMPLETE
591,591,0.9518219362694045,2024-05-01 06:26:03.127733,2024-05-01 06:26:03.405681,0 days 00:00:00.277948,,manhattan,3.0,,,Agglomerative,,,,,,,,,,,,,,,average,,,,1.0,none,,,,,,,2.0,5.071827089448427,,PCA,randomized,,,,,,,,,,,,,,,True,,COMPLETE
592,592,0.8926440250611231,2024-05-01 06:26:03.406889,2024-05-01 06:26:03.646829,0 days 00:00:00.239940,,manhattan,4.0,,,Agglomerative,,,,,,,,,,,,,,,average,,,,1.0,none,,,,,,,2.0,4.957637056166514,,PCA,randomized,,,,,,,,,,,,,,,True,,COMPLETE
593,593,0.9518219362694045,2024-05-01 06:26:03.647980,2024-05-01 06:26:03.939717,0 days 00:00:00.291737,,manhattan,3.0,,,Agglomerative,,,,,,,,,,,,,,,average,,,,1.0,none,,,,,,,2.0,4.686267462588022,,PCA,randomized,,,,,,,,,,,,,,,True,,COMPLETE
594,594,0.3999897837638855,2024-05-01 06:26:03.940655,2024-05-01 06:26:12.835520,0 days 00:00:08.894865,,manhattan,4.0,,,Agglomerative,,,,,,,,,,,,,,,average,,,,,,,,,,,,,,19.131725272318235,t-SNE,,,,,,,12.949654105751657,random,55.0,barnes_hut,manhattan,2.0,,,,,,COMPLETE
595,595,0.9518219362694045,2024-05-01 06:26:12.836433,2024-05-01 06:26:13.136564,0 days 00:00:00.300131,,manhattan,3.0,,,Agglomerative,,,,,,,,,,,,,,,average,,,,1.0,none,,,,,,,2.0,4.379456655621774,,PCA,randomized,,,,,,,,,,,,,,,True,,COMPLETE
596,596,0.8926440250611231,2024-05-01 06:26:13.137694,2024-05-01 06:26:13.380704,0 days 00:00:00.243010,,manhattan,4.0,,,Agglomerative,,,,,,,,,,,,,,,average,,,,1.0,none,,,,,,,2.0,4.753066885635065,,PCA,randomized,,,,,,,,,,,,,,,True,,COMPLETE
597,597,-1.0,2024-05-01 06:26:13.381808,2024-05-01 06:26:13.521446,0 days 00:00:00.139638,,,,1.5000000000000002,,HDBSCAN,,,,6.7,auto,20.0,eom,seuclidean,72.0,,,,,,,,,154.0,1.0,none,,,,,,,2.0,4.512401575292154,,PCA,randomized,,,,,,,,,,,,,,,True,,COMPLETE
598,598,0.9518219362694045,2024-05-01 06:26:13.522285,2024-05-01 06:26:13.848185,0 days 00:00:00.325900,,manhattan,3.0,,,Agglomerative,,,,,,,,,,,,,,,average,,,,1.0,none,,,,,,,2.0,4.508699213780393,,PCA,randomized,,,,,,,,,,,,,,,True,,COMPLETE
599,599,0.8921000487059627,2024-05-01 06:26:13.849282,2024-05-01 06:26:14.148589,0 days 00:00:00.299307,,manhattan,5.0,,,Agglomerative,,,,,,,,,,,,,,,average,,,,1.0,none,,,,,,,2.0,5.018787925450374,,PCA,randomized,,,,,,,,,,,,,,,True,,COMPLETE
600,600,0.9518219362694045,2024-05-01 06:26:14.149489,2024-05-01 06:26:14.403411,0 days 00:00:00.253922,,manhattan,3.0,,,Agglomerative,,,,,,,,,,,,,,,average,,,,1.0,none,,,,,,,2.0,4.63296410773385,,PCA,randomized,,,,,,,,,,,,,,,True,,COMPLETE
